ShowName,ShowDate,ShowYear,ShowWebsite,SubmittedBy,ExhibitorName,BoothNumber,HallLocation,Website,Email,Phone,Fax,Address,Country,Categories,Manufacturers,Brands,Description
Toy Fair NY,02/09/2022,2022,https://toyfairny.com/,DM,GEOMAGWORLD USA,5863,Level 1  Exhibit Hall,www.geomagworld.com,anthi.ferentinos@geomagworld.com,514-248-7638,,"MD, MD, Grantsville, Grantsville, 1 Corporate Dr, 1 Corporate Dr",United States of America,,,,"In 1998, Geomagworld was founded in Switzerland, focusing on creating high-quality, award-winning products.  In fact, it is one of the leading toy companies that develops award-winning products made from recycled plastic.  Through the science of magnetic constructions and imaginative play, we hope to foster creativity and learning by creating STEM.org authenticated toys for developing young minds."
Toy Fair NY,02/09/2022,2022,https://toyfairny.com/,DM,GeoToys,6434,Level 1  Exhibit Hall,www.geotoystore.com,bob@geotoystore.com,920-967-2581,,"WI, WI, Neenah, Neenah, 218 Linden Court, 218 Linden Court",United States of America,,,,
Toy Fair NY,02/09/2022,2022,https://toyfairny.com/,DM,Gentle Giant Studios,5561,Level 1  Exhibit Hall,www.gentlegiantltd.com,mark@gentlegiantstudios.com,8185043555,,"CA, CA, Burbank, Burbank, 7511 N. San Fernando Rd., 7511 N. San Fernando Rd.",United States of America,,,,
Toy Fair NY,02/09/2022,2022,https://toyfairny.com/,DM,"Gayla Industries, Inc.",1803,Level 3 Exhibit Hall,www.gaylainc.com,,1-713-681-2411,,"TX, TX, Houston, Houston, P.O. Box 920800, P.O. Box 920800",United States of America,,,,
Toy Fair NY,02/09/2022,2022,https://toyfairny.com/,DM,GHOULISH PRODUCTIONS / CARETAS REV,3048,Level 3 Exhibit Hall,https://ghoulishproductions.com/,adriana.espinosa.gls@ghoulishproductions.com,52-777-312-8665,,"Morelos, Morelos, JIUTEPEC, JIUTEPEC, AVENIDA CERILLERA 43, AVENIDA CERILLERA 43",Mexico,,,,"With more than 70 years of experience manufacturing latex masks and 25 years exporting worldwide, our brand Ghoulish Productions is recognized as one of the world's leading manufacturers because of the quality, authenticity and innovation in our hand-crafted processes for latex masks and products.

You can find with us the following categories of products: 
01.- Protective Masks. 02.- Cloth Masks. 03.- Nightmare Collection by Mario Chiodo. 04.- Hellraiser License. 05.- Perfect Fit Masks.  06.- Urban Masks. 07.- Gas Masks & Steampunk. 08.- Creepypastas. 09.- Clowns and Gang Clowns. 10.- Skulls. 11.- Aliens. 12.- Doctor Witch & Voodoo. 13.- Zombies. 14.- Werewolves. 15.- Witches. 16.- Scarecrows. 17.- Pumpkins. 18.- Vampires. 19.- Devils. 20.- Day of the Dead. 21.- Mythological Monsters. 22.- Horror Christmas. 23.- Animals. 24.- Low Poly Masks. 25.- Famous People. 26.- Humor. 27.- Moving Mouth. 28.- Junior Masks. 29.- Serial Killers. 30.- Chinless & Chinless Deluxe. 31.- Helmets. 32.- Staffs. 33.- Hands & Feet. 34.- Shoulder Buddies. 35.- Decoratives. 36.- Appliances. 37.- One Minute Costumes. 38.- Mega Costumes. 39.- Costumes. 40.- Displays.

We hope you enjoy the amazing world of Halloween, as much as we do at Ghoulish Productions.

Terms for wholesale accounts:
Minimum Order: $1,000.00 USD.
Shipping Cost: 12% of your total order to USA from Mexico; or provide your own freight supplier service. Rest of the World to quote.
No P.O. Box deliveries.
Claims contact at: sales@ghoulishproductions.com
Returns: We do not handle returns.
We are not responsible for Governement charges other than duties.
Dimensions shown on productsdo not match real ones.
Prices available until November 2022!

Further information, visit: www.ghoulishproductions.com

Sales:
REGION	          NAME	                         E-MAIL
US West	          Juan Manuel Gomez	sales4@gruporev.com
US Southwest  Luis Miguel	                a3.sales@ghoulishproductions.com
US Midwest	  Yared García	        a5.sales@ghoulishproductions.com
US Northeast	  Juan Manuel Gomez	sales4@gruporev.com
US Southeast   Yared García	        a5.sales@ghoulishproductions.com
Canada	          Luis Miguel	                a3.sales@ghoulishproductions.com
Europe	          Zayra Martinez	        a1.sales@ghoulishproductions.com
OTHERS	          Zayra Martinez	        a1.sales@ghoulishproductions.com
Supermarkets  Adriana Espinosa        adriana.espinosa@ghoulishproductions.com"
Toy Fair NY,02/09/2022,2022,https://toyfairny.com/,DM,"Games Workshop, PLC",140,Level 3 Exhibit Hall,,,800-394-4263,,"TN, TN, Memphis, Memphis, 6211 E. Holmes Road, 6211 E. Holmes Road",United States of America,,,,
Toy Fair NY,02/09/2022,2022,https://toyfairny.com/,DM,FUZION-NEXTSPORT,2D06,Level 2D Meeting Rooms,www.nextsport.com,,510-601-8802,,"CA, CA, Emeryville, Emeryville, 2340 Powell Street, 2340 Powell Street",United States of America,,,,
Toy Fair NY,02/09/2022,2022,https://toyfairny.com/,DM,Galt Toys Inc.,6256,Level 1  Exhibit Hall,https://www.galttoys.com/us,,+4416-1428-9111,301-895-5029,"MD, MD, Grantsville, Grantsville, One Corporate Drive, One Corporate Drive",United States of America,,,,
Toy Fair NY,02/09/2022,2022,https://toyfairny.com/,DM,Gamelyn Games,6742,Level 1  Exhibit Hall,,michael@gamelyngames.com,1-480-215-0186,,"AZ, AZ, Queen Creek, Queen Creek, 20364 E Via De Arboles, 20364 E Via De Arboles",United States of America,,,,
Toy Fair NY,02/09/2022,2022,https://toyfairny.com/,DM,Funrise Inc.,3019,Level 3 Exhibit Hall,www.funrise.com,,818-883-2400,,"CA, CA, Van Nuys, Van Nuys, 7811 Lemona Avenue, 7811 Lemona Avenue",United States of America,,,,
Toy Fair NY,02/09/2022,2022,https://toyfairny.com/,DM,Fun Lines,1275,Level 3 Exhibit Hall,www.funlines.net,,949-661-3687,949-661-2214,"CA, CA, SAN JUAN CAPISTRANO, SAN JUAN CAPISTRANO, 27132A PASEO ESPADA, 27132A PASEO ESPADA",United States of America,,,,
Toy Fair NY,02/09/2022,2022,https://toyfairny.com/,DM,Funko LLC,5705,Level 1  Exhibit Hall,www.funko.com,,425-783-3616 ext 5063,,"WA, WA, Everett, Everett, 2802 Wetmore Ave, 2802 Wetmore Ave",United States of America,,,,
Toy Fair NY,02/09/2022,2022,https://toyfairny.com/,DM,Friendly Loom by Harrisville Designs Inc.,351,Level 3 Exhibit Hall,www.harrisville.com,,1-603-827-3333,,"NH, NH, Harrisville, Harrisville, P.O. Box 806, P.O. Box 806",United States of America,,,,
Toy Fair NY,02/09/2022,2022,https://toyfairny.com/,DM,Froggy's Lair,1869,Level 3 Exhibit Hall,http://wholesale.froggyslair.com,,833-376-4491,,"CO, CO, Centennial, Centennial, 6950 S Tucson Way, 6950 S Tucson Way",United States of America,,,,
Toy Fair NY,02/09/2022,2022,https://toyfairny.com/,DM,Fun in Motion Toys,3719,Level 3 Exhibit Hall,www.funinmotiontoys.com,kevin@funinmotiontoys.com,888-588-9908,888-588-9908,"FL, FL, Fort Lauderdale, Fort Lauderdale, 505 SW 17th Street, 505 SW 17th Street",United States of America,,,,
Toy Fair NY,02/09/2022,2022,https://toyfairny.com/,DM,FREDS SWIM ACADEMY East Coast USA LLC,3548,Level 3 Exhibit Hall,www.swimtrainer.com,,862-249-3896,,"DE, DE, Dover, Dover, 8 The Green, 8 The Green",United States of America,,,,"Our innovative design was curated in Germany 40 years ago by a beloved father and swimming instructor, Fred Warmuth. Fred wanted to find a balance between allowing his students to feel safe in the water whilst simultaneously instilling confidence and encouraging a sense of independence in their learning process. There was no tool on the market that would allow for such a balance, so Fred curated the ultimate swimming aid himself. 
Now, over 500,000 SWIMTRAINERS are sold every year in over 50 countries worldwide! 

The patented SWIMTRAINER ""Classic"" offers babies and children the following:
◦ The perfect swimming position.
◦ Ideal amount of support in the water. 
◦ Independent movement in the water.
◦ Sufficient freedom and movement of the arms.
◦ Early support for the natural swim reflex in infancy.
◦ Correct swimming techniques thanks to the three-step learning system.
◦ Easy to use fastening system."
Toy Fair NY,02/09/2022,2022,https://toyfairny.com/,DM,"Franklin Sports, Inc.",5507,Level 1  Exhibit Hall,www.franklinsports.com,,781 344-1111,,"MA, MA, STOUGHTON, STOUGHTON, 17 CAMPANELLI PKWY, 17 CAMPANELLI PKWY",United States of America,,,,
Toy Fair NY,02/09/2022,2022,https://toyfairny.com/,DM,Fred & Friends,5969,Level 1  Exhibit Hall,www.genuinefred.com,,5162861008,,"RI, RI, Pawtucket, Pawtucket, 999 Main st, 999 Main st",United States of America,,,,"FRED focuses on well-designed stuff that solves a problem, puts a smile on your face, and doesn’t cost a fortune. We delight in taking everyday, functional products and turning them into something fresh and unexpected, something funny, something personal.

We understand that design drives our business so we maintain our own creative studio while working with talent from all over the world — England, Europe, Latin America, Israel, China, Turkey, Korea, Thailand — an ever-expanding list.

We combine the best materials and processes with real-world pricing, supporting our products with close manufacturing supervision, relentless quality management, and ongoing safety testing — guaranteeing our customers’ satisfaction."
Toy Fair NY,02/09/2022,2022,https://toyfairny.com/,DM,Folkmanis Inc.,2437,Level 3 Exhibit Hall,www.folkmanis.com,,800-654-8922,5106547756,"CA, CA, EMERYVILLE, EMERYVILLE, 1219 PARK AVE, 1219 PARK AVE",United States of America,,,,"Folkmanis has been inspiring young imaginations since 1976 with its innovative and engaging specialty puppets, promoting creativity and discovery while winning nearly every industry, child development, and kid-tested award. Folkmanis has grown to become the premier manufacturer of plush puppets worldwide, offering over 250 of the most heartwarming and realistically designed creatures--both exotic and familiar--on the market today."
Toy Fair NY,02/09/2022,2022,https://toyfairny.com/,DM,Forbidden Games,6611,Level 1  Exhibit Hall,,,720-436-3483,,"IL, IL, Plainfield, Plainfield, 13731 Capista Dr, 13731 Capista Dr",United States of America,,,,
Toy Fair NY,02/09/2022,2022,https://toyfairny.com/,DM,Fox Chapel Publishing,6107,Level 1  Exhibit Hall,https://www.FoxChapelB2B.com,,800-457-9112,,"PA, PA, Mount Joy, Mount Joy, 903 Square Street, 903 Square Street",United States of America,,,,"Fox Chapel Publishing is passionate about inspiring young minds to discover something new within themselves. We offer an array of engaging, hands-on titles for kids that encourage creativity and self-expression, and imaginative play. From storybooks and seek-and-find adventures to coloring and activity books, journals, arts and crafts guides, and so much more, open the door to possibilities and see all our titles kids of all ages will be sure to love!"
Toy Fair NY,02/09/2022,2022,https://toyfairny.com/,DM,FoxMind Games,6535,Level 1  Exhibit Hall,www.foxmind.com,,514-369-7777,514-221-2271,"QC, QC, Montreal, Montreal, 5530 Saint Patrick Street, 5530 Saint Patrick Street",Canada,,,,
Toy Fair NY,02/09/2022,2022,https://toyfairny.com/,DM,Foam Brain Games,6746,Level 1  Exhibit Hall,www.foambrain.com,,15188949353,,"NY, NY, Troy, Troy, 48 Desson Ave, 48 Desson Ave",United States of America,,,,
Toy Fair NY,02/09/2022,2022,https://toyfairny.com/,DM,"Fotorama USA, LLC",6468,Level 1  Exhibit Hall,www.fotoramausa.com,,715-386-6420,,"WI, WI, Hudson, Hudson, 615  ½ Second Street, 615  ½ Second Street",United States of America,,,,
Toy Fair NY,02/09/2022,2022,https://toyfairny.com/,DM,"Flexible Flyer Sleds / Paricon, Inc.",3602,Level 3 Exhibit Hall,www.pariconsleds.com,,2077436896,,"ME, ME, South Paris, South Paris, 52 Park Street, 52 Park Street",United States of America,,,,
Toy Fair NY,02/09/2022,2022,https://toyfairny.com/,DM,Flybar Inc,5629,Level 1  Exhibit Hall,www.flybar.com,stalynf@flybar.com,845-647-8400,,"NJ, NJ, Freehold, Freehold, 323A Fairfield Road, 323A Fairfield Road",United States of America,,,,"In 1918 George Hansburg was inspired to invent the pogo stick. and brought   his idea to personal friend, Florenz Ziegfeld, of the world-famous Ziegfeld Follies. Ziegfeld, choreographed a pogo routine into his Follies show and created the first pogo craze.

Over 100 years later and with innovations in jump an bounce play, we are proud to have become the Masters of Bounce.

But  Flybar today is so much more. New products for toddlers, stilts, scooters , swings, vehicles  and skateboards are all designed and developed with the passion and innovation George Hansburg first demonstrated over 100 years ago.  

Flybar, Since 1918"
Toy Fair NY,02/09/2022,2022,https://toyfairny.com/,DM,Flex Deck Playing Cards,5490,Level 1  Exhibit Hall,flexdeckplayingcards.com,mike@flexdeckplayingcards.com,1-516-582-4046,,"CT, CT, STAMFORD, STAMFORD, 81 PALMER STREET, 81 PALMER STREET",United States of America,,,,"Flex Deck Playing Cards combine multiple classic games (dominoes, letter games, traditional cards and more) all in one deck of cards. We created them for a camping trip into the Grand Canyon when we wanted to bring multiple games with us but needed to save weight and space in our bags.

They are standard poker size and manufactured by the United States Playing Card Company in Kentucky."
Toy Fair NY,02/09/2022,2022,https://toyfairny.com/,DM,Floodgate Games,5678,Level 1  Exhibit Hall,Www.floodgategames.com,,1-609-204-3485,,"NJ, NJ, Somers Point, Somers Point, 16 Gulph Mill Road, 16 Gulph Mill Road",United States of America,,,,
Toy Fair NY,02/09/2022,2022,https://toyfairny.com/,DM,Floss & Rock,6619,Level 1  Exhibit Hall,www.flossandrock.co.uk,,+4412-5383-1500,,"Lancashire, Lancashire, Blackpool, Blackpool, Whitehills Business Park, Whitehills Business Park",United Kingdom,,,,
Toy Fair NY,02/09/2022,2022,https://toyfairny.com/,DM,Flat River Group LLC,5617,Level 1  Exhibit Hall,www.flatrivergroup.com,,616 794 5496,,"MI, MI, Belding, Belding, 306 Reed Street, 306 Reed Street",United States of America,,,,"Flat River Group is a leading end-to-end e-commerce partner. We take our vendors’ businesses to the next level by owning their inventory and facilitating rapid sales growth, all while maintaining brand integrity and elevating reputation. We are truly a unique partner, with 1st Party Seller (1P) status and best-in-class dropship capability. We specialize in partnering with consumer goods manufacturers including toys & games, pets, baby, outdoor sporting goods and more."
Toy Fair NY,02/09/2022,2022,https://toyfairny.com/,DM,FIVE K LTD.,3111,Level 3 Exhibit Hall,www.fiveksales.com,bking@fivek.biz,425-861-9100 x 2402,425-556-0674,"WA, WA, Redmond, Redmond, 8561 154th Ave. NE, 8561 154th Ave. NE",United States of America,,,,"Five K Ltd. is your home for high quality European toy brands. Five K. Ltd. identifies, imports, markets and develops each brand in the U.S. market. Key Five K Ltd. European brands include Eitech steel construction toys, Teifoc brick building sets, Anbac bacteria absorption toys, Bubabloon balloon cover toys, Trefl puzzles & FischerTechnik action, stem construction toys."
Toy Fair NY,02/09/2022,2022,https://toyfairny.com/,DM,Flash Sales,2079,Level 3 Exhibit Hall,www.flashsales.com,,305 830 2900,,"FL, FL, Miami, Miami, 4401 NW 167th Street, 4401 NW 167th Street",United States of America,,,,
Toy Fair NY,02/09/2022,2022,https://toyfairny.com/,DM,FiGPiN,5382,Level 1  Exhibit Hall,https://www.figpin.com,dan@cmfgdirect.com,425-268-6851,,"CA, CA, Irvine, Irvine, 12 Goodyear Suite 115, 12 Goodyear Suite 115",United States of America,,,,"FiGPiN embraces larger-than-life entertainment characters that fans love; captures their essence and honors what makes them special. Through unmatched craftsmanship in hard enamel and thoughtfulness in design, from packaging to the digital experience, FiGPiN provides highly collectible works of art that fans can connect deeply with, at home or on the go"
Toy Fair NY,02/09/2022,2022,https://toyfairny.com/,DM,Find It Games,128,Level 3 Exhibit Hall,www.finditgames.com,,425-422-3199,,"TX, TX, Abilene, Abilene, 3301 South 14th ST #16 Unit 324, 3301 South 14th ST #16 Unit 324",United States of America,,,,
Toy Fair NY,02/09/2022,2022,https://toyfairny.com/,DM,Fiesta,1157,Level 3 Exhibit Hall,www.fiestatoy.com,,323-581-9988,,"CA, CA, Vernon, Vernon, 2834 E 46th St, 2834 E 46th St",United States of America,,,,"Fiesta, founded in 1972, is a leading manufacturer and distributor of plush toys. Fiesta’s story began in California on the Santa Monica Pier, where they provided amusement plush for the amusement games and concessions. The company has since evolved to become a premier plush toy company with distribution channels that include major toy and gift retailers, some of the largest amusement and entertainment venues in the United States, destination locations, zoos, aquariums, specialty retailers, as well as grocery and drug store chains."
Toy Fair NY,02/09/2022,2022,https://toyfairny.com/,DM,FELIX EUROPE BV,6076,Level 1  Exhibit Hall,https://www.felixeurope.be,,+32 466 36 59 68,,"Brussels, Brussels, Koningslosteenweg No.34,1800, Koningslosteenweg No.34,1800",Belgium,,,,
Toy Fair NY,02/09/2022,2022,https://toyfairny.com/,DM,Fashion Angels,1703,Level 3 Exhibit Hall,www.fashionangels.com,Customerservice@fashionangels.com,414-961-9200,,"WI, WI, Milwaukee, Milwaukee, 306 N. Milwaukee Street, 306 N. Milwaukee Street",United States of America,,,,"Milwaukee-based Fashion Angels was established in 1996 and from its earliest days, we were committed to creating high quality activity products that are trend leading, stylish, and easy-to-use. Fashion Angels is a leading designer and manufacturer of award-winning tween girls’ lifestyle and activity products. We are a company that asks girls to “Find your Wings” and we design products to help them fly. All of our products are designed to inspire and delight…whether it is a craft kit or sparkly bag. Our lines encompass every tween girl's dream: activity kits, fashion sketch books, DIY crafts, stationery, licensed products, accessories, room décor, and bath and beauty products. Fashion Angels products are carried in specialty shops, mass retailers, and department stores around the world. Fashion Angels' mission: To empower tween girls to become self-confident, self-assured and stylish young women by providing them with experiences that encourage them to believe in themselves, express themselves and to be happy with who they are and proud of what they can do. Find Your Talents. Find Your Style. Find Your Wings."
Toy Fair NY,02/09/2022,2022,https://toyfairny.com/,DM,"Far Out Toys, Inc.",3011,Level 3 Exhibit Hall,www.farouttoysinc.com,,310-529-4830,,"CA, CA, El Segundo, El Segundo, 300 N. Pacific Coast Hwy, Suite 1050, 300 N. Pacific Coast Hwy, Suite 1050",United States of America,,,,"Far Out Toys Inc. is a rapidly growing force in the global toy marketplace with a mission to innovate to the outer reaches. Led by toy industry veterans, Far Out Toys leverages its expertise and extensive relationships with inventors, global distributors, IP holders and mass retailers to launch and expand brands across multiple toy categories including vehicles, arts & crafts, games, licensed collectibles, electronic toys and more. For more information, visit www.farouttoysinc.com."
Toy Fair NY,02/09/2022,2022,https://toyfairny.com/,DM,FAO Schwarz / Sharper Image / ThreeSixty Group,2D01,Level 2D Meeting Rooms,www.fao.com,,949-900-0907,,"CA, CA, Irvine, Irvine, 7755 Irvine Center Drive, 7755 Irvine Center Drive",United States of America,,,,
Toy Fair NY,02/09/2022,2022,https://toyfairny.com/,DM,"Fascinations, Inc.",157,Level 3 Exhibit Hall,www.fascinations.com,,206-870-3000,,"WA, WA, SEATTLE, SEATTLE, 19224 DES MOINES MEMORIAL DR, 19224 DES MOINES MEMORIAL DR",United States of America,,,,
Toy Fair NY,02/09/2022,2022,https://toyfairny.com/,DM,"Fantasma Toys, Inc.",1250,Level 3 Exhibit Hall,www.fantasmatoys.com,,212-924-8345 x 103,,"NJ, NJ, Wayne, Wayne, 189 Berdan Ave, 189 Berdan Ave",United States of America,,,,
Toy Fair NY,02/09/2022,2022,https://toyfairny.com/,DM,Fat Brain Toy Co.,6135,Level 1  Exhibit Hall,www.fatbraintoyco.com,,800-335-5621,402-779=3253,"NE, NE, Elkhorn, Elkhorn, 20516 Nicholas Circle, 20516 Nicholas Circle",United States of America,,,,
Toy Fair NY,02/09/2022,2022,https://toyfairny.com/,DM,Explore Scientific - BRESSER,3053,Level 3 Exhibit Hall,www.explorescientificusa.com,ben@explorescientific.com,1-866-252-3811,479-347-2998,"AR, AR, Springdale, Springdale, 1010 South 48th Street, 1010 South 48th Street",United States of America,,,,"Explore Scientific is a manufacturer of optics to include telescopes, microscopes, binoculars and outdoor products for both kids and adults. We were founded in 2008 on the premise of making astronomy, microscopy, and exploration of nature accessible and affordable to the public.  We help ordinary people experience the adventure, wonder, and excitement of exploration and hands-on scientific inquiry.  Through high-quality, durable, and affordable optical instruments we support scientific literacy among the populace."
Toy Fair NY,02/09/2022,2022,https://toyfairny.com/,DM,"Factory Entertainment, Inc.",5419,Level 1  Exhibit Hall,www.factoryent.com,jordan@factoryent.com,925-270-3739,925-271-8801,"CA, CA, Concord, Concord, 2355 Whitman Road, 2355 Whitman Road",United States of America,,,,"Factory Entertainment, Inc. is a leading manufacturer and distributor of high-quality licensed toys, collectibles and home goods featuring a wide variety of entertainment properties, including Masters Of The Universe, James Bond, ThunderCats, Star Trek, Harry Potter, DC Comics, The Beatles, Monty Python, Men in Black, Universal Monsters, Jurassic World, Back to the Future, Jaws, The Goonies, Halloween and many others. For all the latest product information, please visit www.factoryent.com."
Toy Fair NY,02/09/2022,2022,https://toyfairny.com/,DM,Exquisite Gaming Limited,5469,Level 1  Exhibit Hall,https://www.EXGpro.com,,410-941-9375,,"Essex, Essex, Colchester, Colchester, Electra House, Electra House",United Kingdom,,,,"Exquisite Gaming Ltd – Products With a Purpose! 
Makers of Cable Guys, The Original Mobile Phone and Gaming Controller Holder; dedicated to keeping the FUN in Functional!

EXG is a forward-facing team of gaming and entertainment specialists delivering fan-favorite licensed merchandise solutions for Gaming and Entertainment Brands, including wildly successful products from Disney, Marvel, Lucas, Warner Brothers, Sega, Microsoft, Sony, Activision, Capcom, Gearbox, 2K, Rare...and many more!

We create unique purposeful products, build brand awareness and achieve meaningful sales revenue across all channels by consistently supplying fan demand for the characters they love from gaming, entertainment and pop culture brands worldwide! 

Contact: john@EXGPro.com to learn more or to schedule a meeting at BOOTH# 5469! See our entire range of exciting products at www.ExgPro.com!"
Toy Fair NY,02/09/2022,2022,https://toyfairny.com/,DM,Excell Brands,5364,Level 1  Exhibit Hall,www.excellmktg.com,,515-280-4811,,"IA, IA, Des Moines, Des Moines, 5501 Park Avenue, 5501 Park Avenue",United States of America,,,,
Toy Fair NY,02/09/2022,2022,https://toyfairny.com/,DM,Family Games America FGA Inc.,203,Level 3 Exhibit Hall,www.familygamesamerica.com,susan@familygamesamerica.com,514-485-1834,514-485-2944,"QC, QC, Montreal, Montreal, P.O. Box 97 Snowdon, P.O. Box 97 Snowdon",Canada,,,,"Founded in 1987, FGA's award-winning line up includes gifts, games and toys for ages 12 months and up. MADE IN CANADA Tutti Frutti Scented Modeling dough kits come in regular, sparkling and Gluten Free choices. MADE IN CANADA  Rustik wooden games for indoor or outdoor play. MADE IN CANADA Matchitecture Construction Kits for older folks. Sturdy children's garden tools, travel games, and our famous Don't Break the Bottle wine puzzles for adults challenge and delight all who participate."
Toy Fair NY,02/09/2022,2022,https://toyfairny.com/,DM,Exploding Kittens,5973,Level 1  Exhibit Hall,,,206-550-0029,,"CA, CA, Los Angeles, Los Angeles, 7162 BEVERLY BLVD, 7162 BEVERLY BLVD",United States of America,,,,
Toy Fair NY,02/09/2022,2022,https://toyfairny.com/,DM,Everest Toys,415,Level 3 Exhibit Hall,www.everesttoys.com,,905-304-9155,,"ON, ON, Ancaster, Ancaster, 1430 Cormorant Rd, 1430 Cormorant Rd",Canada,,,,
Toy Fair NY,02/09/2022,2022,https://toyfairny.com/,DM,Eurofins Products Testing US Inc.,5913,Level 1  Exhibit Hall,www.eurofinsus.com/consumer-product-testing,,858-568-7175,,"WA, WA, Bothell, Bothell, 11822 North Creek Parkway N., #110, 11822 North Creek Parkway N., #110",United States of America,,,,
Toy Fair NY,02/09/2022,2022,https://toyfairny.com/,DM,Epoch Everlasting Play LLC,311,Level 3 Exhibit Hall,www.epocheverlastingplay.com,,800-631-1272,,"NJ, NJ, Pine Brook, Pine Brook, 330  Changebridge Rd., 330  Changebridge Rd.",United States of America,,,,
Toy Fair NY,02/09/2022,2022,https://toyfairny.com/,DM,EuroGraphics Inc.,317,Level 3 Exhibit Hall,www.eurographics.ca,,514-939-0310,,"QC, QC, LaSalle, LaSalle, 9105 Rue Salley, 9105 Rue Salley",Canada,,,,
Toy Fair NY,02/09/2022,2022,https://toyfairny.com/,DM,"Everrich Industries, Inc.",6607,Level 1  Exhibit Hall,www.everrichindinc.com,,972-478-5800,,"TX, TX, Carrollton, Carrollton, 1050 Venture Ct, 1050 Venture Ct",United States of America,,,,
Toy Fair NY,02/09/2022,2022,https://toyfairny.com/,DM,Evergreen (C.P.) USA Inc.,5710,Level 1  Exhibit Hall,https://www.evergreencpusa.com,,650-952-8091,,"CA, CA, South San Francisco, South San Francisco, 338 North Canal Street, 338 North Canal Street",United States of America,,,,
Toy Fair NY,02/09/2022,2022,https://toyfairny.com/,DM,Enviro-Mental Toy Co. Inc.,3110,Level 3 Exhibit Hall,,,718-428-8972,,"NY, NY, BAYSIDE, BAYSIDE, 209-11 33RD ROAD, 209-11 33RD ROAD",United States of America,,,,
