ShowName,ShowDate,ShowYear,ShowWebsite,SubmittedBy,ExhibitorName,BoothNumber,HallLocation,Website,Email,Phone,Fax,Address,Country,Categories,Manufacturers,Brands,Description
Toy Fair NY,02/09/2022,2022,https://toyfairny.com/,DM,Barry and Jason - Games & Entertainment,6519,Level 1  Exhibit Hall,http://www.barryandjason.com/,barry@barryandjason.com,323-844-2267,,"CA, CA, Los Angeles, Los Angeles, 1835 S. Genesee Ave, 1835 S. Genesee Ave",United States of America,,,,
Toy Fair NY,02/09/2022,2022,https://toyfairny.com/,DM,Bananagrams,6329,Level 1  Exhibit Hall,www.bananagrams.com,,1-401-781-9649,,"RI, RI, Providence, Providence, 845 Allens Ave, 845 Allens Ave",United States of America,,,,
Toy Fair NY,02/09/2022,2022,https://toyfairny.com/,DM,Bachmann Trains,1230,Level 3 Exhibit Hall,https://www.bachmanntrains.com,,1-215-533-1600,,"PA, PA, Philadelphia, Philadelphia, 1400 East Erie Avenue, 1400 East Erie Avenue",United States of America,,,,
Toy Fair NY,02/09/2022,2022,https://toyfairny.com/,DM,Autruche,6718,Level 1  Exhibit Hall,www.autruche.ca,gillesstrauss@autruche.ca,450-670-2323,,"QC, QC, Longueuil, Longueuil, 715 Delage Street, 715 Delage Street",Canada,,,,
Toy Fair NY,02/09/2022,2022,https://toyfairny.com/,DM,Avocatt,5583,Level 1  Exhibit Hall,https://avocatt.com,,6267096214,,"CA, CA, Azusa, Azusa, 1330 Mountain View Cir, 1330 Mountain View Cir",United States of America,,,,
Toy Fair NY,02/09/2022,2022,https://toyfairny.com/,DM,Atlantis Toy and Hobby,5753,Level 1  Exhibit Hall,https://www.atlantis-models.com/,info@atlantis-models.com,631-486-9533,,"NY, NY, Deer Park, Deer Park, 435 Brook Avenue, 435 Brook Avenue",United States of America,,,,
Toy Fair NY,02/09/2022,2022,https://toyfairny.com/,DM,Bandai Namco (Bandai America / Bluefin),5302,Level 1  Exhibit Hall,www.bandai.com,venturap@bandai.com,1-714-816-9500,,"CA, CA, El Segundo, El Segundo, 2120 Park Place, 2120 Park Place",United States of America,,,,
Toy Fair NY,02/09/2022,2022,https://toyfairny.com/,DM,"Ball, Bounce and Sport Inc. - Hedstrom",2765,Level 3 Exhibit Hall,www.hedstrom-entertainment.com,,419-289-9310,,"OH, OH, Ashland, Ashland, 1 Hedstrom Drive, 1 Hedstrom Drive",United States of America,,,,
Toy Fair NY,02/09/2022,2022,https://toyfairny.com/,DM,Basic Fun!,2237,Level 3 Exhibit Hall,www.basicfun.com,,561-997-8901,,"FL, FL, Boca Raton, Boca Raton, 301 Yamato Road, 301 Yamato Road",United States of America,,,,
Toy Fair NY,02/09/2022,2022,https://toyfairny.com/,DM,Banana Panda,6368,Level 1  Exhibit Hall,bananapanda.com,,856-720-0580,646-607-3620,"NJ, NJ, Trenton, Trenton, 354 S Broad St., 354 S Broad St.",United States of America,,,,"We are committed to the relationship between parents and their children. We strongly believe that spending quality time with kids is extremely important for their future development, self-confidence and creating long-lasting connections with others. Our purpose is to enrich this special bond, as well as inspire and excite through educational play. Because we all deserve beautiful memories, meaningful relationships and the space for balanced personal growth.  

All our product ideas are born in a family-run studio, where a team of illustrators, designers, project managers, as well as educators work together to transform original concepts into innovative and inspiring products. We share our passion, creativity and knowledge so that Banana Panda’s educational cards, books and sets of puzzles help the youngest and their caregivers explore the world, develop their imagination, and above all – enjoy play like never before! 

Great graphic design and quality really matter to us because we believe they really matter to our customers. We want our products to be appealing to little ones with beautiful, funny illustrations and fresh, contemporary aesthetics. We always use the best, safe, top-quality materials and we double-check every element of our products before they are shipped to stores. 

We truly believe that exploring the world together with a baby as early as possible will give them the best start in life, and that’s why our toys are designed to stimulate babies’ brains from their very first days. Banana Panda supports the development of a child in many aspects, including emotional, social, motor, intellectual, and creative spheres.

We are more than happy that our toys can help parents and kids to learn about the world together, inspire each other and bring so much fun! We truly value long-term relationships with our little and adult customers. 

We love what we do."
Toy Fair NY,02/09/2022,2022,https://toyfairny.com/,DM,Baby Jack,6280,Level 1  Exhibit Hall,http://babyjackandcompany.com,,8667452491,8667452491,"WISCONSIN, WISCONSIN, Hales Corners, Hales Corners, 5300 S 108th Street, 5300 S 108th Street",United States of America,,,,"The Learning Lovey Collection by Baby Jack (http://babyjackco.com/)  features tag toys and security blankets that teach self regulation and basic learning concepts. The fabrics are made to be educational with images made of shapes, letters and numbers - creating a look and find design appealing to kids.  These fabrics are created by mom inventor Kelley Legler and her two kids Jack and Bailey, by turning their crayon drawings into fabric textiles.  

Baby Jack is known for being the only children’s brand with tag toys having ribbons sewn shut for added safety, after seeing her son get his finger intertwined in a looped ribbon tag blanket. This is an added safety feature keeping kids’ fingers, toes and even tongue ties safe from getting caught.  These Baby Jack sewn shut ribbon tags still provide sensory play and stimulation which helps the development of kids’ sense of touch, taste, smell, sight and sound.  Sensory play is essential for growth, meeting milestones and children grow cognitively, socially and emotionally with developmental toys that Baby Jack & Co. sells.

Recently, owner Kelley Legler debuted The Learning Lovey Travel Collection featuring top city landscapes and state fabric designs that educate kids about state capitals, birds, trees, etc. and encourage a love for travel."
Toy Fair NY,02/09/2022,2022,https://toyfairny.com/,DM,b4Adventure,3423,Level 3 Exhibit Hall,www.b4adventure.com,molly@b4adventure.com,303-339-0482,,"CO, CO, Denver, Denver, 4010 Holly St, Unit 16, 4010 Holly St, Unit 16",United States of America,,,,"b4Adventure offers a variety of products that encourage kids of all ages to play outdoors and stay active! Our family of brands, which includes Slackers, American Ninja Warrior, Playzone-fit and 4Fun; has something to offer every level of adventurer from toddler stage all the way through to adulthood. 
We believe great things happen when you stay active and play outdoors, which is why we are dedicated to building all the gear kids need to get outside and meet adventure head on!"
Toy Fair NY,02/09/2022,2022,https://toyfairny.com/,DM,Zoey Koko,5757,Level 1  Exhibit Hall,,,860-205-6712,,"MA, MA, Stoneham, Stoneham, 38 Montvale Ave, 38 Montvale Ave",United States of America,,,,
Toy Fair NY,02/09/2022,2022,https://toyfairny.com/,DM,"YOTTOY Productions, Inc.",6035,Level 1  Exhibit Hall,www.yottoy.com,,212-594-2202,,"NY, NY, New York, New York, 226 East 54th Street, 226 East 54th Street",United States of America,,,,
Toy Fair NY,02/09/2022,2022,https://toyfairny.com/,DM,Bababoo and friends,5673,Level 1  Exhibit Hall,,,1-206-486-8090,,"WA, WA, Seattle, Seattle, 95 South Jackson Street, 95 South Jackson Street",United States of America,,,,
Toy Fair NY,02/09/2022,2022,https://toyfairny.com/,DM,ASTRA (American Specialty Toy Retailing Association),6123,Level 1  Exhibit Hall,www.astratoy.org,,312-222-0984,,"IL, IL, Chicago, Chicago, 1 E Erie St, Suite 525, PMB4624, 1 E Erie St, Suite 525, PMB4624",United States of America,,,,
Toy Fair NY,02/09/2022,2022,https://toyfairny.com/,DM,"Astro Toys America, LLC",6077,Level 1  Exhibit Hall,,astrotoysamerica@gmail.com,,,"FL, FL, Orlando, Orlando, 7065 Westpoint Boulevard, 7065 Westpoint Boulevard",United States of America,,,,
Toy Fair NY,02/09/2022,2022,https://toyfairny.com/,DM,"Aurora World, Inc.",749,Level 3 Exhibit Hall,www.auroragift.com,imtiaz@auroragift.com,562-205-1222,,"CA, CA, Pico Rivera, Pico Rivera, 8820 Mercury Lane, 8820 Mercury Lane",United States of America,,,,"Established in 1981, Aurora World is a global leader in plush toys and high-quality gift products, and a respected leader in the character and content industry. Aurora World offers an extensive range of branded and licensed products for children and adults. In 2018, Aurora World began transitioning its products into “Eco-Friendly” plush. The change began by using 100% biodegradable pellets (made from recycled materials).
All of our shipping boxes are made from recycled materials. 
At Aurora, we are saving over 400,000,000 plastic bottles globally on an annual basis, contributing to a greener world by producing all of our plush using eco-friendly materials."
Toy Fair NY,02/09/2022,2022,https://toyfairny.com/,DM,Zing,1737,Level 3 Exhibit Hall,www.zing.toys,,503-802-6692,,"Kowloon, Kowloon, TST, TST, Mirror Tower, Mirror Tower",Hong Kong,,,,
Toy Fair NY,02/09/2022,2022,https://toyfairny.com/,DM,ZURU Inc.,1837,Level 3 Exhibit Hall,www.zuru.com,,424-277-1274,,"CA, CA, El Segundo, El Segundo, 228 Nevada Street, 228 Nevada Street",United States of America,,,,
Toy Fair NY,02/09/2022,2022,https://toyfairny.com/,DM,"Zber, LLC",6080,Level 1  Exhibit Hall,www.zberdisc.com,,307-272-5263,,"WY, WY, Cody, Cody, 73 Road 2 ABN, 73 Road 2 ABN",United States of America,,,,
Toy Fair NY,02/09/2022,2022,https://toyfairny.com/,DM,Zen Monkey Studios,5476,Level 1  Exhibit Hall,www.zenmonkeystudios.com,,,,"NY, NY, Rockville Centre, Rockville Centre, 13 The Loch, 13 The Loch",United States of America,,,,
Toy Fair NY,02/09/2022,2022,https://toyfairny.com/,DM,YouTheFan,6736,Level 1  Exhibit Hall,www.youthefan.com,,3173796950,,"IN, IN, Warsaw, Warsaw, 1024 Southgate Park Drive, 1024 Southgate Park Drive",United States of America,,,,
Toy Fair NY,02/09/2022,2022,https://toyfairny.com/,DM,Zorbitz,6476,Level 1  Exhibit Hall,www.zorbitz.net,,323-571-4944,,"CA, CA, Los Angeles, Los Angeles, 5948 Lindenhurst Avenue, 5948 Lindenhurst Avenue",United States of America,,,,
Toy Fair NY,02/09/2022,2022,https://toyfairny.com/,DM,"WSLicensing, Inc dba COOSY USA",6054,Level 1  Exhibit Hall,,,323-721-1750,,"CA, CA, Commerce, Commerce, 2059 Hoefner Ave, 2059 Hoefner Ave",United States of America,,,,
Toy Fair NY,02/09/2022,2022,https://toyfairny.com/,DM,Xcello Sports,3620,Level 3 Exhibit Hall,,,800-610-1089,,"MA, MA, Marlborough, Marlborough, 45 BARTLETT ST, 45 BARTLETT ST",United States of America,,,,
Toy Fair NY,02/09/2022,2022,https://toyfairny.com/,DM,XHONG GROUP INC.,6142,Level 1  Exhibit Hall,,,347-539-0101,631-673-1313,"NY, NY, Huntington Station, Huntington Station, 130 W 10th St., 130 W 10th St.",United States of America,,,,
Toy Fair NY,02/09/2022,2022,https://toyfairny.com/,DM,"York-Jersey Underwriters, Inc.",5925,Level 1  Exhibit Hall,www.york-jersey.com,,732-842-2012,,"NJ, NJ, Tinton Falls, Tinton Falls, 185 Newman Springs Road, 185 Newman Springs Road",United States of America,,,,"Service Provider
Specializing in Product Liability Insurance. We also have special programs for the following coverages: 
CARGO/OCEAN MARINE,CYBER,FULL RECALL, PROPERTY, E&O, D&O,CRFEDIT INSURANCE,ETC."
Toy Fair NY,02/09/2022,2022,https://toyfairny.com/,DM,Yookidoo,6211,Level 1  Exhibit Hall,www.yookidoo.com,,800-355-4987,,"MD, MD, Grantsville, Grantsville, One Corporate Dr., One Corporate Dr.",United States of America,,,,
Toy Fair NY,02/09/2022,2022,https://toyfairny.com/,DM,Yomega Corp.,160,Level 3 Exhibit Hall,www.yomega.com,,800-338-8796,,"MD, MD, Grantsville,, Grantsville,, One Corporate Drive,, One Corporate Drive,",United States of America,,,,
Toy Fair NY,02/09/2022,2022,https://toyfairny.com/,DM,WS Game Company,6435,Level 1  Exhibit Hall,www.wsgamecompany.com,,978-525-2816,,"MA, MA, Manchester, Manchester, 66 Summer Street, 66 Summer Street",United States of America,,,,
Toy Fair NY,02/09/2022,2022,https://toyfairny.com/,DM,Worldwide Buddies,6118,Level 1  Exhibit Hall,www.worldwidebuddies.com,,6466851856,,"NY, NY, New York, New York, 447 West 18th Street, 447 West 18th Street",United States of America,,,,
Toy Fair NY,02/09/2022,2022,https://toyfairny.com/,DM,WowWee,3220,Level 3 Exhibit Hall,https://wowwee.com,sarah@wowwee.com,1-438-920-8089,,"CA, CA, La Jolla, La Jolla, 5845 Camino de la Costa, 5845 Camino de la Costa",United States of America,,,,
Toy Fair NY,02/09/2022,2022,https://toyfairny.com/,DM,World of Toys by Spielwarenmesse eG,1771,Level 3 Exhibit Hall,www.spielwarenmesse-rg.de,,+49-911-99813-0,,"Nürnberg, Nürnberg, Herderstraße 7, Herderstraße 7",Germany,,,,
Toy Fair NY,02/09/2022,2022,https://toyfairny.com/,DM,"Wrebbit Puzzles, Inc.",6729,Level 1  Exhibit Hall,www.wrebbit3d.com,jtheberge@wrebbit3d.com,855-787-8842 x 12,,"QC, QC, Montreal, Montreal, 8047 Jarry E, 8047 Jarry E",Canada,,,,
Toy Fair NY,02/09/2022,2022,https://toyfairny.com/,DM,Wonder & Wise,371,Level 3 Exhibit Hall,www.asweetsus.com,,626-333-4222,,"CA, CA, City of Industry, City of Industry, PO BOX 3054, PO BOX 3054",United States of America,,,,
Toy Fair NY,02/09/2022,2022,https://toyfairny.com/,DM,World Tech Toys,3437,Level 3 Exhibit Hall,,,818-675-9001,,"CA, CA, Valencia, Valencia, 28904 Ave Paine, 28904 Ave Paine",United States of America,,,,
Toy Fair NY,02/09/2022,2022,https://toyfairny.com/,DM,Wilton Bradley Ltd.,1579,Level 3 Exhibit Hall,www.wiltonbradley.com,jeff.goldstein@wiltonbradley.com,441-626-5400,,"NJ, NJ, Morristown, Morristown, 44 Hill St, 44 Hill St",United States of America,,,,"With over 25 years of expertise, Wilton Bradley Ltd specialise in the design, development, distribution and marketing of quality consumer products in the toy, sports and outdoor leisure markets. We supply our own brands and products to a broad range of customers from independent and multinational retailers to distributors. We also design, develop and manufacture OEM products for other brand owners.

Our portfolio boasts of more than 4,000 products, distributed in over 40 countries around the globe. It is that breadth of business, as well as continual investment which has enabled us to trade well throughout these current challenging and volatile times. We pride ourselves on being highly flexible and able to adapt quickly, focussing on continuous improvement and sustainability.
Product of course plays a significant role in the success of our business and many of our product range promote active play for all the family. Brands such as Xootz, a leading wheeled toy brand, or PlayHouse, an outdoor creative play brand, will encourage children and families to go out exploring and have fun. 
The entire Xootz range delivers the full package with superb specification and features, competitive pricing and multiple Toy awards. 
Playhouse, our range of garden play furniture, provides hours of exciting fun for all kids. The addition of Water Wall to the range teaches kids about gravity, angles and water flow. Water Wall is packed with limitless combinations, for children to enjoy a different creation every time they move the pieces. With a multitude of modular accessories included, kids can have fun creating their own water flows and seeing their problem-solving skills come to life as they pour water from the top.

Other brands such as Mi-Mic, combine innovation, technology and hot trends, allow children to become a pop star in their own home. With Mi-Mic kids can play your favourite songs directly from a mobile and sing along over the top, thanks to the Bluetooth microphone speaker.

Whilst product development is at the heart of what we do, we rely on a team of over 200 talented people in the UK, Hong Kong and the USA to make all this happen. 

The last 12 months have also seen significant investments in the US, such as the opening of a new fulfilment facility in Los Angeles to service our partners with some other leading brands - Osprey, one of Europe’s main contenders in action sports on both land and sea, offering rugged, affordable products that are perfect for thrill-seekers of all abilities, and Volkswagen Leisure, featuring the iconic VW campervan in a fun product range.

With such a wide range of product offer as well as a professional, engaging team to work with, Wilton Bradley is a perfect partner."
Toy Fair NY,02/09/2022,2022,https://toyfairny.com/,DM,WordTeasers,6464,Level 1  Exhibit Hall,www.wordteasers.com,susan@wordteasers.com,310-922-8163,,"CA, CA, Manhattan Beach, Manhattan Beach, P.O. Box 1141, P.O. Box 1141",United States of America,,,,
Toy Fair NY,02/09/2022,2022,https://toyfairny.com/,DM,Wood Expressions Games,307,Level 3 Exhibit Hall,https://woodexpressions.com/,sales@woodexpressions.com,310-329-9143,310-327-7772,"CA, CA, Gardena, Gardena, 444 East Gardena Blvd., 444 East Gardena Blvd.",United States of America,,,,"WE Games has been manufacturing and distributing high quality traditional board games since 1977. We specialize in a unique collection games from around the world from an entry level game set to high end quality. We carry many classic, time-honored games such as Chess, Backgammon, Cribbage, Checkers, Dominoes, Go, Shoot the Moon, Antiquity Games and many more. We are known for our elegant game designs, our “WE Games” packaging and great customer service. Our superior quality products are offered"
Toy Fair NY,02/09/2022,2022,https://toyfairny.com/,DM,WONDERFULJUNGLE,6090,Level 1  Exhibit Hall,,,516-474-6204,,"NY, NY, Atlantic Beach, Atlantic Beach, 82 Kings Ave, 82 Kings Ave",United States of America,,,,
Toy Fair NY,02/09/2022,2022,https://toyfairny.com/,DM,Wireless Express,2076,Level 3 Exhibit Hall,,,917-763-0880,,"NY, NY, Plainview, Plainview, 57 North Mall, 57 North Mall",United States of America,,,,
Toy Fair NY,02/09/2022,2022,https://toyfairny.com/,DM,Wizkids LLC,5307,Level 1  Exhibit Hall,www.wizkids.com,,908-986-5279,,"NJ, NJ, Hillside, Hillside, 603 Sweetland Avenue, 603 Sweetland Avenue",United States,,,,
Toy Fair NY,02/09/2022,2022,https://toyfairny.com/,DM,Wood Trick,3265,Level 3 Exhibit Hall,www.woodtrick.com,,+3809-9935-2767,,"OH, OH, Columbus, Columbus, 6344 Nicholas Dr, Columbus OH, 34235 USA, 6344 Nicholas Dr, Columbus OH, 34235 USA",United States of America,,,,
Toy Fair NY,02/09/2022,2022,https://toyfairny.com/,DM,Wise Elk Trading,6813,Level 1  Exhibit Hall,www.wiseelk.us,,747-221-2732,,"TX, TX, Gainesville, Gainesville, 316 West Broadway str, 316 West Broadway str",United States of America,,,,
Toy Fair NY,02/09/2022,2022,https://toyfairny.com/,DM,Worx Toys,6106,Level 1  Exhibit Hall,www.worxtoys.com,,888-967-9869,,"ON, ON, Markham, Markham, 2-401 Alden Rd., 2-401 Alden Rd.",Canada,,,,
Toy Fair NY,02/09/2022,2022,https://toyfairny.com/,DM,Wrist World,5658,Level 1  Exhibit Hall,,,405-308-9717,,"OK, OK, Norman, Norman, 151 12th Ave. SE, 151 12th Ave. SE",United States of America,,,,
Toy Fair NY,02/09/2022,2022,https://toyfairny.com/,DM,William Mark Corp.,6006,Level 1  Exhibit Hall,www.x-zylo.com,,909-608-7340,,"CA, CA, Claremont, Claremont, 112 N. Harvard Avenue, 112 N. Harvard Avenue",United States of America,,,,
Toy Fair NY,02/09/2022,2022,https://toyfairny.com/,DM,"Wildlife Artists, Inc.",1979,Level 3 Exhibit Hall,http://www.wildlifeartistsinc.com/,,203-982-8202,,"USA, USA, Southbury, Southbury, 3 Pomperaug Office Park, 3 Pomperaug Office Park",United States of America,,,,
Toy Fair NY,02/09/2022,2022,https://toyfairny.com/,DM,What Do You Meme?,6481,Level 1  Exhibit Hall,www.whatdoyoumeme.com,sales@whatdoyoumeme.com,858-414-7732,,"NY, NY, New York, New York, 214 Sullivan Street, 214 Sullivan Street",United States of America,,,,"Founded in 2016 in New York City, What Do You Meme?® is an entertainment product company driven by the digital age and inspired by pop culture. The products we make are designed to create joy; either by bringing internet-style, shareable humor from your phone into your life, or bringing the competitive fun to you wherever you are. Beginning with our original breakout hit and #1 Best-Seller What Do You Meme?®, our collection has grown! It now includes a wide array of adult party games as well as family-friendly games, kids' games, outdoor games, and more. We continue to innovate on products that bring people of all generations together. 

We’ve sold millions of copies of our games in the U.S, and abroad, and we are honored to be considered the category leader in the party game space. We pride ourselves on knowing how to reach our millennial and Gen-Z consumers with products and content that speaks to them like no other Toy & Game brand. 

As we continue to evolve, we look forward to achieving the same in other categories and verticals."
Toy Fair NY,02/09/2022,2022,https://toyfairny.com/,DM,White Mountain Puzzles,241,Level 3 Exhibit Hall,www.whitemountainpuzzles.com,sean@whitemountainpuzzles.com,800-548-8009,,"NH, NH, Jackson, Jackson, www.whitemountainpuzzles.com, www.whitemountainpuzzles.com",United States of America,,,,"WHITE MOUNTAIN PUZZLES HAS BEEN PRODUCING FUN, FULLY INTERLOCKING PUZZLES OF THE FINEST QUALITY FOR OVER 30 YEARS.  PROUDLY MADE IN AMERICA SINCE 1978, WE HAVE OVER 400 PUZZLES RANGING FROM 24 PIECES TO 1000 PIECES FOR ALL AGES.  WE OFFER FUN COLLAGE PUZZLES, BEAUTIFUL SCENIC AND NOSTALGIC PUZZLES, LICENSED PUZZLES, KIDS PUZZLES, AND PUZZLE ACCESSORIES. COME SEE THE BEST PUZZLES IN AMERICA."
Toy Fair NY,02/09/2022,2022,https://toyfairny.com/,DM,Weplay / Kiddie's Paradise Inc.,6316,Level 1  Exhibit Hall,www.E-Weplay.com,,+8862-2756-8001,,"Taipei, Taipei, 9/F, No. 70, Sec. 5, Nanking E. Rd., 9/F, No. 70, Sec. 5, Nanking E. Rd.",Taiwan,,,,
Toy Fair NY,02/09/2022,2022,https://toyfairny.com/,DM,Weta Workshop,5443,Level 1  Exhibit Hall,www.wetaworkshop.com,,642-180-7599,,"Wellington, Wellington, 21 Camperdown Road, 21 Camperdown Road",New Zealand,,,,
Toy Fair NY,02/09/2022,2022,https://toyfairny.com/,DM,Whatsitsface?,1269,Level 3 Exhibit Hall,www.whatsitsface.com,joanna@whatsitsface.com,720-900-6386,,"CO, CO, Highlands Ranch, Highlands Ranch, 10795 Sundial Rim Road, 10795 Sundial Rim Road",United States of America,,,,"Whatsitsface is the plush toy that changes faces. With a simple turn of a knob or a flip of a face, each Whatsitsface plush toy features six separate faces – offering your child endless opportunities to create new imaginative play scenarios while having fun and developing emotional intelligence."
Toy Fair NY,02/09/2022,2022,https://toyfairny.com/,DM,Watchitude,2075,Level 3 Exhibit Hall,www.watchitude.com,,732-745-2626,,"NJ, NJ, New Brunswick, New Brunswick, 24a Joyce Kilmer Avenue N., 24a Joyce Kilmer Avenue N.",United States of America,,,,
Toy Fair NY,02/09/2022,2022,https://toyfairny.com/,DM,"Water Sports, LLC",3403,Level 3 Exhibit Hall,www.streammachine.com,kerrie@streammachine.com,630-552-9815,6305665959,"IL, IL, North Aurora, North Aurora, 501 Airport Road, 501 Airport Road",United States of America,,,,"Water Sports, LLC is the manufacturer of the Original Stream Machine water launcher as well and over 100 products for use in the pool and the backyard.  Our Instant Fun Sports line are the perfect games to bring to your tailgate, BBQ, backyard or the beach."
Toy Fair NY,02/09/2022,2022,https://toyfairny.com/,DM,Well Played Toys,5542,Level 1  Exhibit Hall,www.wellplayedtoys.com,,317-472-4101,,"IN, IN, Indianapolis, Indianapolis, 1901 W 16th St, 1901 W 16th St",United States of America,,,,
Toy Fair NY,02/09/2022,2022,https://toyfairny.com/,DM,Warm Fuzzy Toys,5740,Level 1  Exhibit Hall,www.warmfuzzytoys.com,,800-888-9845,,"CA, CA, Burlingame, Burlingame, 23 Broderick Road, 23 Broderick Road",United States of America,,,,
Toy Fair NY,02/09/2022,2022,https://toyfairny.com/,DM,Waterline Toys,3614,Level 3 Exhibit Hall,,,949-246-8798,,"CA, CA, Laguna Beach, Laguna Beach, 1278 Glenneyre St. #429, 1278 Glenneyre St. #429",United States of America,,,,
Toy Fair NY,02/09/2022,2022,https://toyfairny.com/,DM,Waypoint Geographic,2053,Level 3 Exhibit Hall,www.waypointgeographic.com,,317-257-7352,,"FL, FL, Lake Mary, Lake Mary, PO Box 954224, PO Box 954224",United States of America,,,,
Toy Fair NY,02/09/2022,2022,https://toyfairny.com/,DM,"Waboba, Inc.",3545,Level 3 Exhibit Hall,www.waboba.com,,470-545-4232,,"GA, GA, Peachtree Corners, Peachtree Corners, 3850 Holcomb Bridge Road, 3850 Holcomb Bridge Road",United States of America,,,,
Toy Fair NY,02/09/2022,2022,https://toyfairny.com/,DM,US Toy / Cre8tive Minds,6225,Level 1  Exhibit Hall,www.ustoykidfun.com,,(816) 761-5900,,"MO, MO, Grandview, Grandview, 13201 Arrington Rd, 13201 Arrington Rd",United States of America,,,,"Our products are sold around the world to the early education
market, specialty toy retailers, museums, zoos, aquariums, national parks, gift stores, craft, hobby, attractions, and theme parks. The company offers a broad selection of over 1,900 kid-favorite products in attractive packaging and displays for specialty retailers; and 3,700 products developed by teachers for
teachers and the early childhood education centers

Cre8tive Minds: Educational Fun. At Cre8tive Minds, we believe that children receive the most enjoyment from toys that nourish both mind and body."
Toy Fair NY,02/09/2022,2022,https://toyfairny.com/,DM,WeCool Toys,3337,Level 3 Exhibit Hall,www.wecooltoys.com,,732 598 5600,,"NJ, NJ, Point Pleasant Beach, Point Pleasant Beach, 801 Arnold Avenue, 801 Arnold Avenue",United States of America,,,,
Toy Fair NY,02/09/2022,2022,https://toyfairny.com/,DM,Viking Toys USA,6358,Level 1  Exhibit Hall,www.us.viking-toys.com,,716-912-6592,301-895-5029,"MD, MD, Grantsville, Grantsville, One Corporate Drive, One Corporate Drive",United States of America,,,,
