ShowName,ShowDate,ShowYear,ShowWebsite,SubmittedBy,ExhibitorName,BoothNumber,HallLocation,Website,Email,Phone,Fax,Address,Country,Categories,Manufacturers,Brands,Description
Maison & Objet - January,03/23/2022,2022,https://www.maison-objet.com/en/paris/exhibitors,DM,Les Doucettes - Eva,H20,2,,,,,,,Kids | Kids > Children's accessories | Kids > Children's accessories > Toys,,,"Each JOLIJOU doll is a heroine and evolves in her bubble...: it opens worlds, bubbles of imagination (I invent), bubbles of friendship (I tell), bubbles of joy (I dance), … that allow children to create their inner strength to face the world, to develop the best of themselves. Far from the stress and the daily rhythm, JOLIJOU reconnects the child with the development and lightness of childhood: so that it remains soft, radiant and joyful.
Happiness is… The ability to marvel at simple things."
Maison & Objet - January,03/23/2022,2022,https://www.maison-objet.com/en/paris/exhibitors,DM,PALMITO DORE,E9,2,,,,,,,Fashion | Fashion > Fashion accessories | Fashion > Fashion accessories > Jewelry,,,
Maison & Objet - January,03/23/2022,2022,https://www.maison-objet.com/en/paris/exhibitors,DM,Yoto Headphones,H85,2,,,,,,,Kids | Decorative item | Kids > Children's accessories | Decorative item > Gifts and decorative accessories | Kids > Children's accessories > Kids accessories | Decorative item > Gifts and decorative accessories > Gifts,,,"Our carefully connected speakers put kids in control of their listening, learning and play.

No cameras. No microphones. No ads."
Maison & Objet - January,03/23/2022,2022,https://www.maison-objet.com/en/paris/exhibitors,DM,KAWAII | Mini Wallet,F66,2,,,,,,,Fashion | Fashion > Fashion accessories | Fashion > Fashion accessories > Leather goods,,,
Maison & Objet - January,03/23/2022,2022,https://www.maison-objet.com/en/paris/exhibitors,DM,Velvet streetwear slippers,B32,2,,,,,,,Fashion | Fashion > Fashion accessories | Fashion > Fashion accessories > Shoes,,,
Maison & Objet - January,03/23/2022,2022,https://www.maison-objet.com/en/paris/exhibitors,DM,Lola&Lykke Smart Breast Pump,I101,2,,,,,,,Kids | Kids > Children's accessories | Kids > Children's accessories > Childcare  accessories,,,
Maison & Objet - January,03/23/2022,2022,https://www.maison-objet.com/en/paris/exhibitors,DM,Panda Charm Bracelet,D69,2,,,,,,,Fashion | Fashion > Fashion accessories | Fashion > Fashion accessories > Jewelry,,,"Founded in Costa Rica, Pura Vida provides sustainable jobs to artisans worldwide and
raises awareness & donations to charities with bracelets, jewellery & clothing that give back. Since launching
in 2010, Pura Vida has supported over 800 artisans worldwide, supported 200+
charities and given over $4M in lifetime donations.

Pura Vida is a state of mind. It means celebrating good fortune, living life to the fullest,
and not taking anything for granted."
Maison & Objet - January,03/23/2022,2022,https://www.maison-objet.com/en/paris/exhibitors,DM,Moon ring,F64,2,,,,,,,Fashion | Fashion > Fashion accessories | Fashion > Fashion accessories > Jewelry,,,
Maison & Objet - January,03/23/2022,2022,https://www.maison-objet.com/en/paris/exhibitors,DM,ODILE,D92,2,,,,,,,Fashion | Fashion > Fashion accessories | Fashion > Fashion accessories > Bags and totes,,,"NATURELLEMENT-ARTICA based in Madagascar since 1998 manufactures and distributes products for export-based fibers
The main material for producing our products is raffia. Raffia is a natural fiber taken from the raffia palm, whose main production area is located on the west coast of Madagascar.
From this fiber we perform dyeing and then weaving. Weaving is not mechanized. It is made by hand on traditional looms."
Maison & Objet - January,03/23/2022,2022,https://www.maison-objet.com/en/paris/exhibitors,DM,World map,G52,2,,,,,,,Kids | Decorative item | Kids > Children's accessories | Decorative item > Other decorative objects | Kids > Children's accessories > Children's decorative items | Decorative item > Other decorative objects > Decorative objects,,,
Maison & Objet - January,03/23/2022,2022,https://www.maison-objet.com/en/paris/exhibitors,DM,Feather brooches,F27,2,,,,,,,Fashion | Fashion > Fashion accessories | Fashion > Fashion accessories > Jewelry,,,
Maison & Objet - January,03/23/2022,2022,https://www.maison-objet.com/en/paris/exhibitors,DM,Gift accessories “by My Little Day”,H55,2,,,,,,,Kids | Kids > Children's accessories | Kids > Children's accessories > Birthdays,,,"My little day or how to make a child's birthday an UNFORGETTABLE and ECO-FRIENDLY party!
For 11 years, My little day has offered busy and demanding parents products for beautiful and festive birthday snacks. In the blink of an eye, the table is set, balloons and garlands invade the premises, cups and plates compete on the table.
Now, these products are made in Europe in a completely eco-friendly way. This makes My Little Day the first brand to offer responsible disposable."
Maison & Objet - January,03/23/2022,2022,https://www.maison-objet.com/en/paris/exhibitors,DM,Swimming Cap and Bag,D56,2,,,,,,,Fashion | Fashion > Fashion accessories | Fashion > Fashion accessories > Hair accessories,,,"Kores is a Greek brand of contemporary jewelry and accessories.
The brand advocates uniqueness, rebellion and innovation with an independent attitude.
Kores is an experimental workshop of ideas.
Today the brand offers  women’s clothing , combining contemporary, innovative and sophisticated design with the uniqueness of handcrafted products."
Maison & Objet - January,03/23/2022,2022,https://www.maison-objet.com/en/paris/exhibitors,DM,Clover Pebble,E72,2,,,,,,,Decorative item | Decorative item > Gifts and decorative accessories | Decorative item > Gifts and decorative accessories > Gifts,,,"For 20 years, CARRÉ DE TRÈFLES has had the world license of the ""French National Institute of Agronomic Research"" (I.N.R.A.) for cultivating & valorizing the true four-leaf clover. 
Each leaf is hand-picked, carefully treated to keep its apparent freshness & dried in the sun in its herbarium. 
A few months later the most beautiful will be entrusted to rare workshops in France capable of making them messenger offerings of optimism, love & sharing accompanied by their certificates of authenticity. 

""We harvest what we love..."" is the motto house. Our creed. Unalterable."
Maison & Objet - January,03/23/2022,2022,https://www.maison-objet.com/en/paris/exhibitors,DM,Teddy rabbit Hector,G64,2,,,,,,,Kids | Kids > Children's accessories | Kids > Children's accessories > Childcare  accessories,,,"MAISON CHARLOTTE is a French brand dedicated to furniture, decoration and bed linen for babies and children. It designs and manufactures only in France and Europe high quality ecological products. The textile is made with 100% organic cotton percale, the fabrics are dyed and made in Portugal in an Oeko-Tex certified factory that recycles waste. The furniture is made from materials that meet the highest standards in order to design eco-friendly furniture."
Maison & Objet - January,03/23/2022,2022,https://www.maison-objet.com/en/paris/exhibitors,DM,GINKGO Necklace,F86,2,,,,,,,Fashion | Fashion > Fashion accessories | Fashion > Fashion accessories > Jewelry,,,
Maison & Objet - January,03/23/2022,2022,https://www.maison-objet.com/en/paris/exhibitors,DM,"2021 ""New York"" Collection Scarves",E25,2,,,,,,,Home Fabrics | Decorative item | Fashion | Home Fabrics > Bedroom and living room textiles | Decorative item > Sculptures and artworks | Fashion > Fashion accessories | Home Fabrics > Bedroom and living room textiles > Throw blankets | Decorative item > Sculptures and artworks > Unique pieces | Fashion > Fashion accessories > Scarves,,,"YEN TING CHO STUDIO is a London-based design studio, established in 2016. Our philosophy is to capture in our contemporary designs the dynamic energy of the world around us. Using our digital technology, we manipulate images of the natural environment into unique abstract patterns. We print our patterns onto the finest materials to produce luxury fashion accessories (wool, cashmere and silk scarves, silk squares and t-shirts) and limited edition interior design fabrics and objects (such as cushions and prints). Our award-winning products blur the boundaries between art, design and fashion."
Maison & Objet - January,03/23/2022,2022,https://www.maison-objet.com/en/paris/exhibitors,DM,“Mini SIOOU” tattoos,D60,2,,,,,,,Fashion | Fashion > Fashion accessories | Fashion > Fashion accessories > Jewelry,,,"Since 2016, Sioou also offers to enchant your events with its famous tattoo bar and its customised tattoo service."
Maison & Objet - January,03/23/2022,2022,https://www.maison-objet.com/en/paris/exhibitors,DM,Leather bags,E64,2,,,,,,,Fashion | Fashion > Fashion accessories | Fashion > Fashion accessories > Bags and totes,,,"SORUKA... These are timeless collections created for women who dare to wear something other than a classic handbag. Easy to wear, stylish, colorful and accessible, each piece is handmade in recycled leather, it is authentic and unique."
Maison & Objet - January,03/23/2022,2022,https://www.maison-objet.com/en/paris/exhibitors,DM,Zodiac Baby Blanket,I76 - J75,2,,,,,,,Kids | Kids > Children's accessories | Kids > Children's accessories > Childcare  accessories,,,"Fabelab is a playful organic Scandinavian children’s interior brand, founded in Copenhagen, that believes in creating high-quality, innovative, and responsibly made products for a cosy and creative home. From our Copenhagen studio, we design products that encourage curiosity and imagination - all products deeply grounded in storytelling. Our products are multipurpose and grow with the family, gathering stories and memories along the way."
Maison & Objet - January,03/23/2022,2022,https://www.maison-objet.com/en/paris/exhibitors,DM,Galopin changing unit white,I42 - J41,2,,,,,,,Kids | Kids > Children's furniture | Kids > Children's furniture > Baby furniture,,,"Harmony, softness and quality have always been our watchwords.
Our furniture is made in France. We are proud of our workshops based in Guéret (23), in which, every day, we imagine baby furniture and textile combining design, security and comfort.
Our raw materials are carefully selected and our manufacturing process is certified: ISO9001, ISO14001 and PEFC.
Your choice will be the best, a baby’s room from Creuse with love!"
Maison & Objet - January,03/23/2022,2022,https://www.maison-objet.com/en/paris/exhibitors,DM,Foulard,C34,2,,,,,,,Fashion | Fashion > Fashion accessories | Fashion > Fashion accessories > Scarves,,,
Maison & Objet - January,03/23/2022,2022,https://www.maison-objet.com/en/paris/exhibitors,DM,Toys for active babies & toddlers - Done by Deer,G63,2,,,,,,,Kids | Kids > Children's accessories | Kids > Children's accessories > Childcare  accessories,,,"The Deer friends form the DONE BY DEER DNA. They are ready to join little ones on their incredible journey growing up, learning and mastering new skills.

The DONE BY DEER interior and toys combine humour, simplicity, aesthetics, and functionality, and pays special attention to safety. Each design is thoroughly tested to comply with European standards and 100% friendly."
Maison & Objet - January,03/23/2022,2022,https://www.maison-objet.com/en/paris/exhibitors,DM,BAVOIRS,G33,2,,,,,,,Kids | Kids > Children's accessories | Kids > Children's accessories > Childcare  accessories,,,
Maison & Objet - January,03/23/2022,2022,https://www.maison-objet.com/en/paris/exhibitors,DM,FRANCIS FW 21/22,D77,2,,,,,,,Fashion | Fashion > Fashion accessories | Fashion > Fashion accessories > Jewelry,,,
Maison & Objet - January,03/23/2022,2022,https://www.maison-objet.com/en/paris/exhibitors,DM,Storyteller & Night Light - Owly & Owlivia,G71,2,,,,,,,Kids | Kids | Kids | Kids | Kids | Decorative item | Kids > Children's furniture | Kids > Children's accessories | Kids > Children's accessories | Kids > Children's accessories | Kids > Children's accessories | Decorative item > Connected objects | Kids > Children's furniture > Children's bedrooms | Kids > Children's accessories > Children's lighting | Kids > Children's accessories > Children's lighting | Kids > Children's accessories > Children's lighting | Kids > Children's accessories > Children's decorative items | Decorative item > Connected objects > Speakers and radios,,,"Bigben has been designing audio equipments for all the family for more than 30 years. In order to attract and gather a large public around our product, we have created diverse universes and brands around the sound experience.
AROMASOUND: Enjoy a well-being moment with our diffusers of essential oils and luminous Bluetooth speaker. 3 in 1!
COLORLIGHT: Decorative audio frames for the Kids' bedrooms to the Living Room. All can be piloted with an application to adjust colors and/or brightness.
LUMIN'US: More than 15 different models of Bluetooth luminous speakers & night lights!"
Maison & Objet - January,03/23/2022,2022,https://www.maison-objet.com/en/paris/exhibitors,DM,DIVINE BLACK LEATHER BAG,E25 - E25,2,,,,,,,Fashion | Fashion | Fashion | Fashion | Fashion | Fashion > Fashion accessories | Fashion > Fashion accessories | Fashion > Fashion accessories | Fashion > Fashion accessories | Fashion > Women's and men's fashion | Fashion > Fashion accessories > Pet accessories | Fashion > Fashion accessories > Bags and totes | Fashion > Fashion accessories > Shopping baskets | Fashion > Fashion accessories > Sport bags | Fashion > Women's and men's fashion > Apparel,,,"AMWA and Co, 
The articles are urban, comfortable, and well-adapted to thse who strive for simplicity while focusing on quality.
The pure lines of the totebags can be personalized according to our outfit or an activity : at work, outing with friends, evening wear, shopping, riding a scooter or a bike, weekends...
With straps in around 30 different colors, a multitude of looks can be yours. 
Our bags are unisex.
Let your modd, or your schedule, define your bag.
Made in France."
Maison & Objet - January,03/23/2022,2022,https://www.maison-objet.com/en/paris/exhibitors,DM,Natural Stone Bracelets,D64 - E63,2,,,,,,,Fashion | Fashion > Fashion accessories | Fashion > Fashion accessories > Jewelry,,,"We also offer collections of baskets, sarongs, earrings, long necklaces, but also a display stand with bracelets for first names, a display stand for dream catcher, as well as a very complete range of raw or painted wrought iron animals. 

Feel free to visit our websites."
Maison & Objet - January,03/23/2022,2022,https://www.maison-objet.com/en/paris/exhibitors,DM,Sacs et accessoires,D79,2,,,,,,,Fashion | Fashion > Fashion accessories | Fashion > Fashion accessories > Bags and totes,,,
Maison & Objet - January,03/23/2022,2022,https://www.maison-objet.com/en/paris/exhibitors,DM,Activity book for children 0-2 years old with sea animals,H98,2,,,,,,,Kids | Kids > Children's accessories | Kids > Children's accessories > Toys,,,
Maison & Objet - January,03/23/2022,2022,https://www.maison-objet.com/en/paris/exhibitors,DM,"Lennie ring, necklace & earrings",D28,2,,,,,,,Fashion | Fashion > Fashion accessories | Fashion > Fashion accessories > Jewelry,,,
Maison & Objet - January,03/23/2022,2022,https://www.maison-objet.com/en/paris/exhibitors,DM,Pokemon backpack,H97,2,,,,,,,Kids | Fashion | Kids > Children's accessories | Fashion > Fashion accessories | Kids > Children's accessories > Bags and backpacks | Fashion > Fashion accessories > Bags and totes,,,
Maison & Objet - January,03/23/2022,2022,https://www.maison-objet.com/en/paris/exhibitors,DM,Celestial earrings,E85,2,,,,,,,Fashion | Fashion > Fashion accessories | Fashion > Fashion accessories > Jewelry,,,
Maison & Objet - January,03/23/2022,2022,https://www.maison-objet.com/en/paris/exhibitors,DM,Backpacks & bottles,G51,2,,,,,,,Kids | Kids > Children's accessories | Kids > Children's accessories > Bags and backpacks,,,
Maison & Objet - January,03/23/2022,2022,https://www.maison-objet.com/en/paris/exhibitors,DM,Carousel - storage system,G5,2,,,,,,,Kids | Workplace | Furniture | Kids > Children's furniture | Workplace > Office furniture and fittings | Furniture > Storage | Kids > Children's furniture > Children's bedrooms | Workplace > Office furniture and fittings > Office furniture and storage | Furniture > Storage > Storage boxes,,,"His collections are created freehand: he draws, sketches and designs until the draft reflects his gut feeling. 

The result is a set of streamlined, yet playful collections with wood in the leading role and a highly detailed finish.
The IN2WOOD collections are perfectly keyed to a nomadic lifestyle.

Beautiful in their simplicity, the pieces are simple to move about, allowing you to easily adapt their new function to your interior needs."
Maison & Objet - January,03/23/2022,2022,https://www.maison-objet.com/en/paris/exhibitors,DM,Decoration lamp,H63,2,,,,,,,Lighting | Lighting > Indoor lighting | Lighting > Indoor lighting > LED modules,,,"KIDYWOLF : is our Belgian brand for young and less young. We offer technological toy's, educative, fun and design toys which will seduce children and grown-up!
Twistiti: A simple and colorful approach to teach children how to read the time! A Belgian brand.
WillUp: aims to develop products around the theme ""Planting makes you grow"". It's fun, local, sustainable and made in Belgium!
Les P’tits Fouets: A belgian brand who makes kids kitchen tools adapted to them. 
Half Toys: A unique ways of making 3D puzzles."
Maison & Objet - January,03/23/2022,2022,https://www.maison-objet.com/en/paris/exhibitors,DM,PLAYMOBIL by COLLECTOYS Collection,H95,2,,,,,,,Decorative item | Decorative item > Gifts and decorative accessories | Decorative item > Gifts and decorative accessories > Design objects,,,"Our brands regroup licenses both timeless and contemporary (Playmobil, Astérix, Dragon Ball, Harry Potter, DC Comics...). 
We imagine collections in a modern and iconic style, first in resin with for example our figures collections ""Comics Speech"" and ""Stack of Comics"", or our collection of big vintage Playmobil figures; and second with our collection of chibi money banks with their pop design so characteristic. 
Our design objects unite a quality and a know-how guaranteed by our sculpture and casting Normandy workshop."
Maison & Objet - January,03/23/2022,2022,https://www.maison-objet.com/en/paris/exhibitors,DM,Moulin Roty Olga baby playmat - bag,I31,2,,,,,,,Kids | Decorative item | Kids > Children's accessories | Decorative item > Gifts and decorative accessories | Kids > Children's accessories > Kids accessories | Decorative item > Gifts and decorative accessories > Gifts,,,"PLAY&GO is a wonderful decoration brand for children. Our first product and worldwide success is the colourful PLAY&GO bag. This practical bag is ideal for kids and parents as it encourages play at home or away. The PLAY&GO bag makes it easy to transport toys and to tidy them away. Crafted from durable canvas and available in a range of attractive colours, this bag is also a great idea for nursery and playroom storage.

Welcome to the fun and colourful world of PLAY&GO !"
Maison & Objet - January,03/23/2022,2022,https://www.maison-objet.com/en/paris/exhibitors,DM,Make up,I77,2,,,,,,,Kids | Kids > Children's accessories | Kids > Children's accessories > Children's arts and crafts,,,"Besides our two brands ""SOUZA !"" and ""Rose & Romeo"", we develop and produce private label collections. We are the preferred supplier of several major retailers, fun parks and museums.

We bring joy and color to the dream world of children!"
Maison & Objet - January,03/23/2022,2022,https://www.maison-objet.com/en/paris/exhibitors,DM,HOME TEXTILE COLLECTION,G32,2,,,,,,,Kids | Kids > Children's furniture | Kids > Children's furniture > kids linen,,,"This Belgian label, produced in Portugal, creates timeless clothing and textiles for children age 0 to 4. The song “Heart of Gold” by Neil Young provided the perfect mission statement and inspiration: “I want to live – I want to give.” The search of the perfect sustainable fabrics and soft colours results in an accessible and functional label, combining an easy fit with an exclusive touch, subtle details and unique colour palettes."
Maison & Objet - January,03/23/2022,2022,https://www.maison-objet.com/en/paris/exhibitors,DM,LÄSSIG Activity Toy Blanket Tiny Farmer,G42,2,,,,,,,Kids | Kids > Children's accessories | Kids > Children's accessories > Soft toy,,,"""We care"" describes the innovative force that has characterized LÄSSIG since its creation in 2007. The dynamic German brand is forward-looking because it puts the emphasis on its multifunctional products and the selection of sustainable materials on sustainability.

Our collections offer a selection of eco-friendly products: changing bags, bibs, tableware or even children's bags ranging from nursery to primary ... textiles for the bath or everyday life, storage for the baby's room, play mats and matching accessories: the LÄSSIG universe is casual and full of emotions."
Maison & Objet - January,03/23/2022,2022,https://www.maison-objet.com/en/paris/exhibitors,DM,Miffy by Bon Ton Toys - 100% recycled Teddy Miffy Yellow,H64 - I63,2,,,,,,,Kids | Decorative item | Kids > Children's accessories | Decorative item > Gifts and decorative accessories | Kids > Children's accessories > Soft toy | Decorative item > Gifts and decorative accessories > Gifts,,,
Maison & Objet - January,03/23/2022,2022,https://www.maison-objet.com/en/paris/exhibitors,DM,Earring Ruby Earcandy,D36,2,,,,,,,Fashion | Fashion > Fashion accessories | Fashion > Fashion accessories > Jewelry,,,"MUJA JUMA jewelry is the culmination of a little girl’s creative imagination, a woman’s belief in fair business practice and a life-long desire to give beautiful gifts to special people. MUJA JUMA shares these lovely little treasures with you."
Maison & Objet - January,03/23/2022,2022,https://www.maison-objet.com/en/paris/exhibitors,DM,Adjustable bracelet chains,D33 - F51,2,,,,,,,Fashion | Fashion > Fashion accessories | Fashion > Fashion accessories > Jewelry,,,
Maison & Objet - January,03/23/2022,2022,https://www.maison-objet.com/en/paris/exhibitors,DM,Bermuda Collection,E88,2,,,,,,,Fashion | Fashion > Fashion accessories | Fashion > Fashion accessories > Jewelry,,,"BATUCADA is a French company established in 2005.
BATUCADA collections represent our collaboration with a parade of talented stylists, designers & artists who have crafted timeless accessories that are exquisite, Eco-Friendly and Fair trade.
BATUCADA's jewels on the skin promise an experience that is distinctive.

All our creations are made of: 80% vegetable-based product, 20% of certified « sustainable » hardener.
Our products  are hypoallergenic. As a natural product, our materials are 100% recyclable.
We received the MSA (Museum Store Association) Award as best product of the year."
Maison & Objet - January,03/23/2022,2022,https://www.maison-objet.com/en/paris/exhibitors,DM,Amazona earrings,F46,2,,,,,,,Fashion | Fashion > Fashion accessories | Fashion > Fashion accessories > Jewelry,,,"ACAÏ: French brand, hand made, Brazilian production.
Jewelries in golden grass, natural and poetic universe.
Legend tells that in the 15th century the last Inca king Atahualpa had to hide the fabulous Inca treasure in an undisclosed location, while the last Spanish conquest in South America was raging. Atahualpa then asked the Coya Camaquen to turn his treasure into gold dust and entrust it to the god of the wind. With one breath, he transported him and gave him back to mother earth: the Pachamama.
Capim dourado (syngonanthus nitens) is a unique herb in the world with a metallic golden color"
Maison & Objet - January,03/23/2022,2022,https://www.maison-objet.com/en/paris/exhibitors,DM,DREAM VAN:1 silicone mat + 5 markers + 1 bracelet EASY TO WIPE CLEAN - REUSABLE - FROM 3 YEARS OLD,I25,2,,,,,,,Kids | Kids > Children's accessories | Kids > Children's accessories > Children's arts and crafts,,,"SUPER PETIT brings a new touch to coloring and develops a range of 100% soft silicone playmat for endless coloring. Finished the waste of paper, this smart playmat to color again and again with its markers, easy to erase with water is a real “must have”. Children can exercise their creative talents and develop their imaginations away from the screens. They become Super heroes of their daily lives. SUPER PETIT develops nomad products with a graphic and design collection that integrates into the environment of modern families. The playmat or Mini to take everywhere."
Maison & Objet - January,03/23/2022,2022,https://www.maison-objet.com/en/paris/exhibitors,DM,ALBY BEE - VIBRANT TOY 100% ORGANIC COTTON,G27,2,,,,,,,Kids | Kids > Children's accessories | Kids > Children's accessories > Toys,,,"Charlotte the carrot, the green peas family, Louie the radish, the Cherry sisters ..

Quality rattles that are suitable for babies from birth. 
Evolutionary toys that follow the child for the game of the merchant and the dinette.
Music boxes, reversible toys and more ...

Funny and colorful, old-fashioned toys that respect people and nature.
Organic - Plastic free - Low carbon - Cruelty free - Hand-made - Uni gender"
