ShowName,ShowDate,ShowYear,ShowWebsite,SubmittedBy,ExhibitorName,BoothNumber,HallLocation,Website,Email,Phone,Fax,Address,Country,Categories,Manufacturers,Brands,Description
Maison & Objet - January,03/23/2022,2022,https://www.maison-objet.com/en/paris/exhibitors,DM,Classic or contemporary style dressing room.,L127,6,,,,,,,Hospitalities & Contracts | Furniture | Hospitalities & Contracts > Furniture and storage | Furniture > Storage | Hospitalities & Contracts > Furniture and storage > Hotel bedrooms | Furniture > Storage > Walk-in closets,,,"With 20 years of experience, we are committed to the creation and realization of your interior design. Our design office and our factory combine know-how, technology and quality when precision and excellence are our priorities during the implementation. To offer you a product and a service of quality we put forward 5 essential values in our eyes: passion, listening, creativity, quality and eco-responsibility."
Maison & Objet - January,03/23/2022,2022,https://www.maison-objet.com/en/paris/exhibitors,DM,Nina Bed,F121,6,,,,,,,Furniture | Furniture > Nighttime spaces | Furniture > Nighttime spaces > Beds,,,
Maison & Objet - January,03/23/2022,2022,https://www.maison-objet.com/en/paris/exhibitors,DM,GOOOOO OTO Terra Forte,C2 - E1,6,,,,,,,Outdoor | Outdoor > Outdoor decor | Outdoor > Outdoor decor > Flower pots,,,"Gooooo, the original. Design Geert Van Acker. You like or you don't."
Maison & Objet - January,03/23/2022,2022,https://www.maison-objet.com/en/paris/exhibitors,DM,Terra,H54 - I53,6,,,,,,,Outdoor | Rugs | Outdoor > Garden furniture | Rugs > Contemporary carpets | Outdoor > Garden furniture > Garden textiles,,,"Put simply, the heritage of ROLS is making exquisite carpets.

The heart of our ethos is the bond between the skilled craftsmen and prime materials selected for every ROLS carpet. 
Our story, along with our continuous desire for perfection, began in 1917, when our founder, Francisco Gomez, began weaving carpets from vegetable fibers using a simple hand loom.

From our humble beginning, through a century of global change and technological advance, Moquetas ROLS has evolved to become a market leading manufacturer of premium quality carpets and rugs."
Maison & Objet - January,03/23/2022,2022,https://www.maison-objet.com/en/paris/exhibitors,DM,BROMO Dining Table,E68 - F67,6,,,,,,,Furniture | Furniture > Tables | Furniture > Tables > Dining Tables,,,"Started in 1980 by José Manuel Leite de Castro, JLC has 40 years of expertise designing and producing a range of products from furniture, upholstery, lighting, fabrics to accessories.

Present in more than 40 countries, we offer both classic and modern products, as well as the ability to customize products to specific requests. The purpose of JLC is to provide the customers with excellent and effective service, supplying exclusive and high-quality products."
Maison & Objet - January,03/23/2022,2022,https://www.maison-objet.com/en/paris/exhibitors,DM,The oblate cachepot.,J92,6,,,,,,,Outdoor | Outdoor > Outdoor decor | Outdoor > Outdoor decor > Flower pots,,,
Maison & Objet - January,03/23/2022,2022,https://www.maison-objet.com/en/paris/exhibitors,DM,THE JOOULY,I120,6,,,,,,,Lighting | Decorative item | Lighting > Outdoor lighting | Decorative item > Gifts and decorative accessories | Lighting > Outdoor lighting > Moveable lighting | Decorative item > Gifts and decorative accessories > Design objects,,,"Use the remote control to select between 9 different led colours for the right light and 4 different play of light variants. Several ""Jooulys"" can be connected via the ""sync"" function, so that they all play the same music and light up in the same light colour.

The possibilities are limitless! With the ""Jooulys"" you create the right atmosphere anytime and anywhere. The ""Jooulys"" have a powerful rechargeable battery for mobile use.

The ""Jooulys"" are available in three different sizes: s, m and l !"
Maison & Objet - January,03/23/2022,2022,https://www.maison-objet.com/en/paris/exhibitors,DM,Hatt Shelving System,G124,6,,,,,,,Furniture | Furniture > Storage | Furniture > Storage > Bookshelves,,,"Our products reveal themselves in their versatility in a technological era and in the experience they establish with the user, in a continuous process of discovery. Functionality, movement and materials are the language we choose to achieve a new interaction. 
The different daily interactions have increasingly blurred contours, sometimes overlapping... Hatt believes that, accepting this new social and cultural construction, technology, leisure, work and comfort leading to a movement that aims to develop authentic products, reforming the design intervention."
Maison & Objet - January,03/23/2022,2022,https://www.maison-objet.com/en/paris/exhibitors,DM,Nabuk,H98,6,,,,,,,Home Fabrics | Home Fabrics > Bedroom and living room textiles | Home Fabrics > Bedroom and living room textiles > Upholstery fabrics,,,
Maison & Objet - January,03/23/2022,2022,https://www.maison-objet.com/en/paris/exhibitors,DM,Candle Holder Collection,C130,6,,,,,,,Fragrances & wellness | Fragrances & wellness > Fragrances | Fragrances & wellness > Fragrances > Candles,,,
Maison & Objet - January,03/23/2022,2022,https://www.maison-objet.com/en/paris/exhibitors,DM,Manhattan,L91,6,,,,,,,Home Fabrics | Home Fabrics > Bedroom and living room textiles | Home Fabrics > Bedroom and living room textiles > Upholstery fabrics,,,
Maison & Objet - January,03/23/2022,2022,https://www.maison-objet.com/en/paris/exhibitors,DM,Beach Umbrella - Nuit d'été pastel - Klaoos,J133,6,,,,,,,Outdoor | Decorative item | Outdoor > Shades | Decorative item > Gifts and decorative accessories | Outdoor > Shades > Sunshades | Decorative item > Gifts and decorative accessories > Design objects,,,"Klaoos umbrellas offer high quality designer protection against the sun or the rain.
Our manufacturing is based on a 100% made in Europe, eco-responsible supply-chain, which favors the use of recycled plastic materials as well as ecological textile printing.
Our collections are designed with trendy colors and patterns to create contemporary fashion accessories and outdoor equipment."
Maison & Objet - January,03/23/2022,2022,https://www.maison-objet.com/en/paris/exhibitors,DM,FENG SHUI I & II PAINTINGS,E102,6,,,,,,,Decorative item | Decorative item > Wall decor | Decorative item > Wall decor > Paintings,,,"NOVOCUADRO ART COMPANY has a huge collection of original paintings representing a wide range of artists, most of them from Spain, which have been distinguished for their talent. Among the company objectives are to bring the works of great artists closer to its clients and allowing customers to create their personal space with a unique atmosphere and style, where good taste and respect for the original work of art can be appreciated."
Maison & Objet - January,03/23/2022,2022,https://www.maison-objet.com/en/paris/exhibitors,DM,MONTREAL SOFA,E94 - F93,6,,,,,,,Furniture | Furniture > Seating | Furniture > Seating > Small sofas,,,"ORMO´s is conceived with the idea of offering its customers a quality product that covers a wide market spectrum, from a classic and traditional line to models with modern and avant-garde features. The idea is to offer the chance to personalize each and everyone of our pieces and adapt ourselves to our customers’ needs. We use first class raw materials which, in the hands of our professional artisans, is reflected in our excellent price-quality ratio."
Maison & Objet - January,03/23/2022,2022,https://www.maison-objet.com/en/paris/exhibitors,DM,Liseuse Alizée,H102 - I101,6,,,,,,,Lighting | Lighting > Indoor lighting | Lighting > Indoor lighting > Floor lamps,,,
Maison & Objet - January,03/23/2022,2022,https://www.maison-objet.com/en/paris/exhibitors,DM,Lineas,D101,6,,,,,,,Rugs | Rugs > Design carpets,,,
Maison & Objet - January,03/23/2022,2022,https://www.maison-objet.com/en/paris/exhibitors,DM,D01 Pendant 30,J20,6,,,,,,,Lighting | Lighting > Indoor lighting | Lighting > Indoor lighting > Hanging lights,,,"Attracted by innovations, materials and new technologies, we see light as one of the most important resources of our life. The poetic but functional aspect of lighting takes us to design new projects and fittings focused on the true needs of the final consumer. Putting together our creativity, ideas and experiences we apply the same rigorous attention to context, process, material quality and detail to all our creations.
We are driven by the belief that lighting design is not just about light up a space but rather a a way of furnishing, creating astonishment, magic and beauty."
Maison & Objet - January,03/23/2022,2022,https://www.maison-objet.com/en/paris/exhibitors,DM,Vida,I144,6,,,,,,,Outdoor | Decorative item | Outdoor > Outdoor decor | Decorative item > Other decorative objects | Outdoor > Outdoor decor > Flower pots | Decorative item > Other decorative objects > Decorative objects,,,"Clay is the matter that DESEO uses to create stylish and sustainable ceramic pots. Shapes, colors and styles challenge one another. Each ceramic pot or vase is an artistic expression of eternal happiness."
Maison & Objet - January,03/23/2022,2022,https://www.maison-objet.com/en/paris/exhibitors,DM,Cobalt Sand Rug,I30 - J29,6,,,,,,,Rugs | Rugs > Bespoke carpets,,,"For 75 years, Ferreira de Sá has been driven by curiosity to design and produce exceptional pieces.
Founded in Portugal in 1946, we have become one of the largest and oldest luxury rug companies in Europe.
We offer two different production techniques: Robot/Hand Tufting and Flatweave. Both are operated by talented artisans who share a passion for handcrafted and bespoke rugs. Constantly innovating, Ferreira de Sá has always improved production methods and raw materials, offering quality, flexibility, and the best solutions for its customers worldwide."
Maison & Objet - January,03/23/2022,2022,https://www.maison-objet.com/en/paris/exhibitors,DM,EcoFurn EcoBench,H56,6,,,,,,,Furniture | Outdoor | Furniture > Seating | Outdoor > Garden furniture | Furniture > Seating > Benches | Outdoor > Garden furniture > Deck chairs,,,"ECOFURN products are made from solid wood of Nordic Origin only. No raw materials from fragile rain forests are used. We only buy wood from managed forests and from sources that either have FSC certificate or can specify the location of the wood material delivered to us. Besides the Nordic wood, we use hemp rope and for some items, metallic fasteners. The products are preferably delivered in flat packs in order to avoid excessive packing material and freight space. 

ECOFURN products are ideal for both indoor and outdoor use: saunas, spas, terraces and garden."
Maison & Objet - January,03/23/2022,2022,https://www.maison-objet.com/en/paris/exhibitors,DM,BLOOMING,G116,6,,,,,,,Home Fabrics | Home Fabrics > Bedroom and living room textiles | Home Fabrics > Bedroom and living room textiles > Fabrics,,,"Aldeco is a Portuguese textile brand with distribution in over 60 countries and Showrooms in Madrid, Porto, Lisbon and Algarve. We are textile editors, we provide fabrics and wallpapers for the several segments:
Home, Hospitality, Public Spaces, Health and Well-being, Outdoor and Marine.
The collections strive for originality and are inspired by the world's cultural heritage, are developed by our Design Department in tune with the fashion trends obeying to the highest quality standards.
Our mission is to create fabrics of excellence providing the best service to our customers."
Maison & Objet - January,03/23/2022,2022,https://www.maison-objet.com/en/paris/exhibitors,DM,CAPELLA COFFE TABLE,D16 - E15,6,,,,,,,Furniture | Furniture > Tables | Furniture > Tables > Coffee tables,,,"Brucs collections are a unique combination of colors, materials and textures consisting of furniture, home accessories, lighting and upholsteries to offer a complete interior concept. We focus on retail worldwide, Interiors Designers and Architects, with large experience in hospitality projects. We offer a fully “made-to-measure” approach for projects on a larger scale. 
Our main goal is to give a high level of service, beeing most of our collection is on stock that enables us a fast delivery. For upholstery we can customize completly any item, from fabric to wood color."
Maison & Objet - January,03/23/2022,2022,https://www.maison-objet.com/en/paris/exhibitors,DM,UP,K112,6,,,,,,,Lighting | Furniture | Lighting > Indoor lighting | Furniture > Seating | Lighting > Indoor lighting > Floor lamps | Furniture > Seating > Sofas,,,
Maison & Objet - January,03/23/2022,2022,https://www.maison-objet.com/en/paris/exhibitors,DM,Rosie Dressing Table,H82 - I81,6,,,,,,,Furniture | Furniture > Tables | Furniture > Tables > Other tables,,,"Established in the city of Porto (Portugal) in 2004, Laskasas is a furniture design brand renowned for creating handmade furniture, upholstery and metalwork pieces, for residential and commercial projects.

Laskasas furniture and upholstery collections strive to honour and elevate Portuguese heritage of craftsmanship.

Each piece is a new perspective of traditional design, defying laws of silhouettes, materials and textures combinations

With long-lasting expertise, Laskasas pieces are available worldwide."
Maison & Objet - January,03/23/2022,2022,https://www.maison-objet.com/en/paris/exhibitors,DM,Taj rose Quartz vanity tray,B87,6,,,,,,,Bath | Decorative item | Bath > Bathroom accessories | Decorative item > Other decorative objects | Bath > Bathroom accessories > Installation accessories | Decorative item > Other decorative objects > Decorative objects,,,"We offer a choice of over 45 colors to coordinate with your client's bathroom interior.  Select from architectural Corian, high quality Lucite,  semi precious Gemstone and hand enamel collections.  Opulent accents for the luxury bathroom interior."
Maison & Objet - January,03/23/2022,2022,https://www.maison-objet.com/en/paris/exhibitors,DM,CHANDELIER FRUIT MURANO,C134 - D133,6,,,,,,,Lighting | Hospitalities & Contracts | Lighting > Indoor lighting | Hospitalities & Contracts > Furniture and storage | Lighting > Indoor lighting > Hanging lights | Hospitalities & Contracts > Furniture and storage > Hotel bedrooms,,,"The story of my company is a story of passion for handmade and high quality chandeliers in Florentine style combined with a huge creativity. We want to recreate our customers' dreams' chandeliers step-by-step, choosing with them the shapes, colors and materials that could fit perfectly with their needs! Once my grandfather passed away in February 2018, I decide to keep his memory alive continuing on create his chandeliers with the help of my father for the manual labor and of my sister thanks to her knowledge of foreign language, trying to expand our beautiful creations around the World!"
Maison & Objet - January,03/23/2022,2022,https://www.maison-objet.com/en/paris/exhibitors,DM,blankets woven fur,D104,6,,,,,,,Home Fabrics | Home Fabrics > Bedroom and living room textiles | Home Fabrics > Bedroom and living room textiles > Throw blankets,,,"blankets, pillows to cuddle with, imitation fur, woven fur made of 100% Polyester"
Maison & Objet - January,03/23/2022,2022,https://www.maison-objet.com/en/paris/exhibitors,DM,"CUSHION CABOURG 18"" x 18"" cm",K48 - L47,6,,,,,,,Decorative item | Home Fabrics | Decorative item > Gifts and decorative accessories | Home Fabrics > Bedroom and living room textiles | Decorative item > Gifts and decorative accessories > Cushions | Home Fabrics > Bedroom and living room textiles > Fabric cushions,,,"Our cushions combine colours, inspirations and elegance to create a unique, personal touch and to redesign the most beautiful of contemporary interiors.
Each shade and each item has been designed in perfect harmony with the other cushions in the range, whatever the style or pattern. Your very own mix & match, using your own selections, immensely creative, but always in the “Maison Casamance” style.
Become your own stylist in your own home is the audacious promise made by this magni"
Maison & Objet - January,03/23/2022,2022,https://www.maison-objet.com/en/paris/exhibitors,DM,PU leather travel bag with shoe slot and suit,F139,6,,,,,,,Fashion | Furniture | Fashion > Travel accessories | Furniture > Storage | Furniture > Storage > Walk-in closets,,,"With its experience with luxury fashion professionals, Mon Cintre offers hangers with shapes specially designed for each type of clothing, with a high-end artisanal finish, in stained ash or covered with leather, linen, Alcantara, etc.

Mon Cintre has also developed a range of products for travel in leather and imitation leather. Discover in particular our clever travel bag that transforms into a bag with a shoe slot and a large storage space and also our clothing bag and our two-tone imitation leather shoe bag."
Maison & Objet - January,03/23/2022,2022,https://www.maison-objet.com/en/paris/exhibitors,DM,Natural bamboo DUCHESS DOR DESSERT 18 PI,B77 - C78,6,,,,,,,Kitchen | Tableware | Decorative item | Kitchen > Kitchen accessories | Tableware > Cutlery | Decorative item > Gifts and decorative accessories | Kitchen > Kitchen accessories > Kitchen utensils | Tableware > Cutlery > Flatware | Decorative item > Gifts and decorative accessories > Gifts,,,"With over 20 years of experience in the High Decoration market, Ishela has over 3,000 products in its portfolio, without losing the differentiation and exclusivity that you value.

Our commitment is to offer the best of the latest world trends, translated our lines, offering a diverse, exclusive and highly sophisticated selection.

Our experienced and highly curated curatorship travels across five continents, researching not only the best suppliers, but those who have something unique, beyond producing a product, who produce art in the form of unique and highly sophisticated products."
Maison & Objet - January,03/23/2022,2022,https://www.maison-objet.com/en/paris/exhibitors,DM,FLOORIUM BESPOKE RUGS,E91,6,,,,,,,Rugs | Rugs > Bespoke carpets,,,"Our custom-made rugs can be made in virtually any size and color. Rugs are hand-knotted in any custom size.

Materials: wool-silk, bamboo silk, ""Tencel"".
Production place: Turkey, India, Nepal.
Technics: hand-knotted, robo-tufted, flat-weave.
Challenges: fast production, strong design team."
Maison & Objet - January,03/23/2022,2022,https://www.maison-objet.com/en/paris/exhibitors,DM,Hexagon series,B71,6,,,,,,,Lighting | Lighting > Indoor lighting | Lighting > Indoor lighting > Floor lamps,,,"""Pure Dutch Design"" typifies the lighting collection of MARETTI LIGHTING. 

We produce unique lighting designs from our own design studio and designs from leading Dutch designers at our factory in Almere, Netherlands. Quality, craftsmanship and originality are high on our list.

Our years of experience and the close partnerships with designers, architects, interior specialists and project developers have translated into the most beautiful projects worldwide.

By manufacturing everything in-house we guarantee a high quality and original design."
Maison & Objet - January,03/23/2022,2022,https://www.maison-objet.com/en/paris/exhibitors,DM,Synergy 35 Pro,J64 - K63,6,,,,,,,Lighting | Decorative item | Lighting > Indoor lighting | Decorative item > Connected objects | Lighting > Indoor lighting > Wireless lamps | Decorative item > Connected objects > Speakers and radios,,,"Kooduu is a consumer electronics brand that has Dutch and Danish roots and was founded in 2017 on the basis of togetherness, happiness, positive ambiance, coziness, innovation and putting a smile on people’s faces. The brand invites people to set the mood wherever and whenever. This means all products are the perfect companion for any social event, such as a summer barbecue, indoor family gatherings, picnics in the park or a romantic evening for two on the couch. Enjoy the cozy minimalism lifestyle and create meaningful moments in life with a little help of Kooduu. Visit our stand :)"
Maison & Objet - January,03/23/2022,2022,https://www.maison-objet.com/en/paris/exhibitors,DM,KELLY,I112,6,,,,,,,Lighting | Lighting > Indoor lighting | Lighting > Indoor lighting > Wall lamps,,,
Maison & Objet - January,03/23/2022,2022,https://www.maison-objet.com/en/paris/exhibitors,DM,Palermo Large Jewellery Box,B38 - C37,6,,,,,,,Fashion | Decorative item | Fashion > Fashion accessories | Decorative item > Gifts and decorative accessories | Fashion > Fashion accessories > Jewelry | Decorative item > Gifts and decorative accessories > Caskets and boxes,,,"It all began with a jewellery case over 185 years ago. Five generations later, WOLF continues to handcraft the world’s finest jewellery cases, travel accessories, watch winders and safes. Extraordinary objects are representations of extraordinary moments in life. We believe that for a legacy to endure, it must be nourished and upheld while melding beauty & functionality. Only WOLF has the patented technologies of Lusterloc™ to prevent tarnish and watch winders that count the precise number of rotations. WOLF is dedicated to honouring people’s stories and the priceless pieces entrusted to them."
Maison & Objet - January,03/23/2022,2022,https://www.maison-objet.com/en/paris/exhibitors,DM,Kwadrat set 3,F87,6,,,,,,,Furniture | Furniture > Tables | Furniture > Tables > Coffee tables,,,"We manufacture our iron furniture collection STEELE in our factory, in Latvia.
We are specialized in custom-made projects for shops, hotel, restaurants, outdoor.
Combinations of oak, glass, marble, brass, concrete, etc."
Maison & Objet - January,03/23/2022,2022,https://www.maison-objet.com/en/paris/exhibitors,DM,Symbiose Glass display cabinet,H128,6,,,,,,,Furniture | Furniture > Storage | Furniture > Storage > Sideboards,,,
Maison & Objet - January,03/23/2022,2022,https://www.maison-objet.com/en/paris/exhibitors,DM,MINIMAL collection OAK,A1,6,,,,,,,Furniture | Furniture > Seating | Furniture > Seating > Stools,,,"JOE SAYEGH PARIS presents a collection of furniture, decoration accessories, wall panels, table art and mouth-blown glass."
Maison & Objet - January,03/23/2022,2022,https://www.maison-objet.com/en/paris/exhibitors,DM,BLACK&BRASS TV STAND,B50 - C49,6,,,,,,,Furniture | Furniture > Storage | Furniture > Storage > Sideboards,,,"We are that object that identifies you, we are that color that does not look like another, we are the subtle detail of the table, the chair, the lamp, that makes your home breathe its own style.

Different styles that accompany the avant-garde and the tradition."
Maison & Objet - January,03/23/2022,2022,https://www.maison-objet.com/en/paris/exhibitors,DM,VLUV SOVA fabric sitting ball,F157,6,,,,,,,Furniture | Furniture > Seating | Furniture > Seating > Ottomans,,,"VLUV is an ergonomic, stylish seating element and balance ball. It's an eye-catching item of designer furniture that keeps you sitting in a comfortable upright position, but you can also use it for gymnastics. And it's even fun to just play with!

VLUV is a brand of ""Hock Design"", a German design company that designs and manufactures health and fitness related products since 2009."
Maison & Objet - January,03/23/2022,2022,https://www.maison-objet.com/en/paris/exhibitors,DM,VILINE chandelier black&rust LGH0841,G58 - H57 - H59,6,,,,,,,Lighting | Lighting > Indoor lighting | Lighting > Indoor lighting > Hanging lights,,,
Maison & Objet - January,03/23/2022,2022,https://www.maison-objet.com/en/paris/exhibitors,DM,BOLLA,G80 - H79,6,,,,,,,Furniture | Furniture > Seating | Furniture > Seating > Armchairs,,,"IMPERIAL LINE produces chairs, tables and stools for the home and contract projects.

Our company believes in the pleasure of beholding well-made things. For this reason, we employ the best of industrial progress and maintain painstaking details through scrupulous craftsmanship. It’s a method that’s immediately perceived. In an IMPERIAL LINE product the harmony created by quality materials, technological precision and handcrafted processes are instantly evident."
Maison & Objet - January,03/23/2022,2022,https://www.maison-objet.com/en/paris/exhibitors,DM,Flamingo Umbrella,D132,6,,,,,,,Decorative item | Decorative item > Other decorative objects | Decorative item > Other decorative objects > Decorative objects,,,"In the Mantuan countryside, in Castellucchio, there are those who continue to produce luxury umbrellas, entirely handmade, and to distribute them in every corner of the globe: Pasotti, who differs in creativity and continuous research in materials, all exclusively Italian."
Maison & Objet - January,03/23/2022,2022,https://www.maison-objet.com/en/paris/exhibitors,DM,ARDAMEZ • HAUSSMANN Bistro table - Ceramic with natural veins - White,L46,6,,,,,,,Outdoor | Hospitalities & Contracts | Furniture | Outdoor > Garden furniture | Hospitalities & Contracts > Furniture and storage | Furniture > Tables | Outdoor > Garden furniture > Lawn tables | Hospitalities & Contracts > Furniture and storage > Tables for hotels | Furniture > Tables > Dining Tables,,,"Its star product, the genuine French bistro table, is still made with materials that made its success:  enamel steel, brass, stainless steel and copper, and the original machines used since 1954."
Maison & Objet - January,03/23/2022,2022,https://www.maison-objet.com/en/paris/exhibitors,DM,MARRAKECH pendant light XL size,G104 - H103,6,,,,,,,Lighting | Lighting > Indoor lighting | Lighting > Indoor lighting > Hanging lights,,,"Purchased by the company ""Corep"" in June 2016, MARKET SET is a creative brand of lightings which maintains its fundamentals and develops new collections more decorative, of affordable luxury.

The new artistic direction turns around two universes: ""Men"" and ""Women"".

Come and discover our collections on our stand."
