ShowName,ShowDate,ShowYear,ShowWebsite,SubmittedBy,ExhibitorName,BoothNumber,HallLocation,Website,Email,Phone,Fax,Address,Country,Categories,Manufacturers,Brands,Description
Maison & Objet - January,03/23/2022,2022,https://www.maison-objet.com/en/paris/exhibitors,DM,Hand Crafted Reed Diffuser,C58 - D57,5A,,,,,,,Fragrances & wellness | Fragrances & wellness > Fragrances | Fragrances & wellness > Fragrances > Home fragrances,,,"VANILLA BLANC stands for innovation in design, quality of craft and healthy lifestyle: ""unique hand"" crafted pine wooden pieces that incorporate any interior design and that have their own individual finish applied. Chemical free organic ingredients of the highest grade sourced locally in the county of Surrey, long-lasting oil based fragrance diffusers that last beyond 5 months, hand poured soy and coconut wax candles that have an incredible scent  that can fill larger rooms.

We fashion exquisite, rich but yet subtle aromas for your surroundings."
Maison & Objet - January,03/23/2022,2022,https://www.maison-objet.com/en/paris/exhibitors,DM,"""Renaissance"", Wooden tree and glass",L27,5A,,,,,,,"Lighting | Decorative item | Lighting > Indoor lighting | Decorative item > Sculptures and artworks | Lighting > Indoor lighting > Table lamps | Decorative item > Sculptures and artworks > Sculptures, statuettes and miniatures",,,"Arango creates lighting works of French origin. Carved wood pieces combined with hand-cut glass and highlighted by integrated dimmable LED light.
As aesthetic as useful.
All these materials are used in different proposals and arranged in such a way as to express primarily a feeling of surprise and wonder in people who discover his works for the first time. 
The light gives a crystalline and sparkling effect, the wood is robust and stable, the lighting can be programmed strong and therefore useful."
Maison & Objet - January,03/23/2022,2022,https://www.maison-objet.com/en/paris/exhibitors,DM,Bed Spread,F64 - G63,5A,,,,,,,Home Fabrics | Home Fabrics > Bedroom and living room textiles | Home Fabrics > Bedroom and living room textiles > Bed linens,,,"KUTNİA, taking its inspiration from Kutnu that is a traditional fabric of Gaziantep, was established by AJK textile in order to adapt this national value to today’s modern world. Kutnu that had been almost forgotten, turned into a new brand as KUTNİA to reach into the future. KUTNİA offers an eclectic lifestyle due to Kutnu’s colorful and striped essence, and has a wide range of a collection from clothing to home textiles. Our Kutnu fabrics are woven on hand loom by craftsmen who are from Gaziantep. Each product carries its own private signature which makes all of them unique."
Maison & Objet - January,03/23/2022,2022,https://www.maison-objet.com/en/paris/exhibitors,DM,bol grand modèle Empreinte,J44,5A,,,,,,,Tableware | Tableware > Glassware | Tableware > Glassware > Carafes,,,"SOPHIE MASSON designs and handmade tableware and living objects in porcelain, where each piece passed through the filter of its sensitivity becomes a unique object. 

It responds to a demand from customers who, saturated by a hyper-standardized offer, are looking for authenticity.

Sophie invites artists of all sensibilities to express themselves. Together they produce small series, unique, numbered and signed. 
Each porcelain can be personalized with your messages, lettering, drawings, or logos."
Maison & Objet - January,03/23/2022,2022,https://www.maison-objet.com/en/paris/exhibitors,DM,Palm Tree Half Ball Pendant,Q27,5A,,,,,,,Lighting | Lighting > Indoor lighting | Lighting > Indoor lighting > Hanging lights,,,"Since 2011, the handmade, ""poor craft"" or the use of natural materials, vintage have forged the soul of Rock The Kasbah. An ethic to which the brand is attached since its beginning. In its large factory in Soukra, Tunisia, it brings together internally all the trades that feed the work of its designer, giving him total freedom of creation. Carpenters, upholsterers, painters, weavers, blacksmiths ... Together they form the great Rock The Kasbah family. This new way of producing, allows the brand to adapt to the unique demands of its customers."
Maison & Objet - January,03/23/2022,2022,https://www.maison-objet.com/en/paris/exhibitors,DM,ZOZIO Glass Painting,J14,5A,,,,,,,Decorative item | Decorative item > Wall decor | Decorative item > Wall decor > Stained glass decoration,,,
Maison & Objet - January,03/23/2022,2022,https://www.maison-objet.com/en/paris/exhibitors,DM,Scented candle Major Arcana,C24,5A,,,,,,,Fragrances & wellness | Fragrances & wellness > Fragrances | Fragrances & wellness > Fragrances > Candles,,,"Each product is hand crafted following original recipes, combining both traditional folk wisdom and experience, but also modern perfumery, candle and incense craft methodology.

We look for the tender distance between daily usage of unique products and the touch of magic in our life. It's a kind of charming game that brings fantasy to our routine.

Sober and sleek SMELLS LIKE SPELLS packaging, designed for letting scents express themselves. Our design aims to assist not to persist and calls you into a pleasant unpacking adventure. Luxury through subtlety and elegance."
Maison & Objet - January,03/23/2022,2022,https://www.maison-objet.com/en/paris/exhibitors,DM,Menhirs,J29,5A,,,,,,,Lighting | Decorative item | Lighting > Indoor lighting | Decorative item > Other decorative objects | Lighting > Indoor lighting > Table lamps | Decorative item > Other decorative objects > Decorative objects,,,It offers lighting and decorative objects unpublished combining light metal and origami.
Maison & Objet - January,03/23/2022,2022,https://www.maison-objet.com/en/paris/exhibitors,DM,Vase GL.B.80,J23,5A,,,,,,,Decorative item | Decorative item > Sculptures and artworks | Decorative item > Sculptures and artworks > Ceramic,,,"Unique decorative and sculptural pieces in sandstone and porcelain, decorated with leather straps and sequins in oxidized metal."
Maison & Objet - January,03/23/2022,2022,https://www.maison-objet.com/en/paris/exhibitors,DM,Set 2 tabourets BLUE LAGOON,Q17,5A,,,,,,,Decorative item | Decorative item > Wall decor | Decorative item > Wall decor > Other wall decoration,,,"All year long, Alexis, creator of ALFONZ and textile designer, unearths and develops fashionable decoration and lifestyle products.

The best of his trends in a new collection: indoor, outdoor, decoration, lamps, wall decoration. 

ALFONZ's universe is characterized by a design and raw materials, the use of natural fibers, colors and a sense of timelessness."
Maison & Objet - January,03/23/2022,2022,https://www.maison-objet.com/en/paris/exhibitors,DM,PETRIFIED WOOD | Side tables of petrified wood,S54,5A,,,,,,,Furniture | Furniture > Seating | Furniture > Seating > Stools,,,"XYLEIA NATURAL INTERIORS import top quality interior design items made of wood, tree roots and petrified wood.  We offer unique interior products, such as dining tables, coffee tables, desks, consoles, side tables, stools, benches, wash hand basins, lamps, decorative items and sculptures. Please visit our website for more information. Feel free to contact us with any questions or remarks."
Maison & Objet - January,03/23/2022,2022,https://www.maison-objet.com/en/paris/exhibitors,DM,Geological Formation Gogotte,P35,5A,,,,,,,Decorative item | Decorative item > Sculptures and artworks | Decorative item > Sculptures and artworks > Unique pieces,,,"COMPTOIR DES CRISTAUX offers a wide variety of minerals and fossils for collection and decoration purposes to its business clientele including retailers, decorators, museums and collectors.

The company is known internationnally for its ""Gogottes"", the famous sandstone concretions originated from ""Fontainebleau sands"" and proeminently featured in numerous museums and high standing interiors.

Based in Neuilly Plaisance (France)."
Maison & Objet - January,03/23/2022,2022,https://www.maison-objet.com/en/paris/exhibitors,DM,PRINTED SOFT COTTON PILLOW COVER COLLECTION,F53,5A,,,,,,,Home Fabrics | Fashion | Home Fabrics > Bedroom and living room textiles | Fashion > Women's and men's fashion | Home Fabrics > Bedroom and living room textiles > Throw blankets | Fashion > Women's and men's fashion > Homewear,,,"The Company present a 100% Made in Italy collection for home decor.
From 1968, FRATI combines innovative solutions, textile expertise and Italian style.

The collection ranges from noble fibers' collection in wool, cashmere, alpaca and natural fibers' collection made of cotton, linen, bamboo, viscose and recycled fibers and last generation of polar fleece mixture with cotton and bamboo.

FRATI HOME COLLECTION, from the production of fabric to the packaging of the ready-made product, adds its blend of industrial skill and craftsmanship to create a wholly Italian product."
Maison & Objet - January,03/23/2022,2022,https://www.maison-objet.com/en/paris/exhibitors,DM,Canyon sculptural candle holder,J46,5A,,,,,,,Fragrances & wellness | Fragrances & wellness > Fragrances | Fragrances & wellness > Fragrances > Candlesticks and candle holders,,,"After ten years of product design, the designer decides to create ceramic items combining techniques from Industrial Design and Arts and Crafts. Thus he learns ceramics art in order to create a new line of luxury objects designed and crafted by himself.
Items proposed by Clément Boutillon are designed for a long time, using every skills of Clément such as numerical sculpture, drawing, 3D printing. When the shape intention is over, Clément creates the mold in his workshop. Earthenware pieces are then glazed with a translucent effect giving a unique raw finish to the piece."
Maison & Objet - January,03/23/2022,2022,https://www.maison-objet.com/en/paris/exhibitors,DM,Sisal rugs,P24 - Q23,5A,,,,,,,Home Fabrics | Home Fabrics > Bedroom and living room textiles | Home Fabrics > Bedroom and living room textiles > Rugs,,,Each item has a corresponding material and community. Simplicity is the word.
Maison & Objet - January,03/23/2022,2022,https://www.maison-objet.com/en/paris/exhibitors,DM,CERAMIC POT,B98 - D97,5A,,,,,,,Outdoor | Decorative item | Outdoor > Outdoor decor | Decorative item > Sculptures and artworks | Outdoor > Outdoor decor > Flower pots | Decorative item > Sculptures and artworks > Ceramic,,,A French company for decoration and flower professionals.
Maison & Objet - January,03/23/2022,2022,https://www.maison-objet.com/en/paris/exhibitors,DM,"Cotton rug, cushion cover, kuchi pile, kuchi bag, puffs",M76 - N75,5A,,,,,,,Rugs | Decorative item | Rugs > Design carpets | Decorative item > Gifts and decorative accessories | Decorative item > Gifts and decorative accessories > Cushions,,,"Rooted in age-old techniques, CHUK PALU pile rugs, sumaks and kilims have a modern feel: patterns are subtle. 
Colour and bold textures are central to the design. 

A contemporary piece of art produced in ancient ways, each rug is woven completely by hand, using hand spun yarns.
Bringing folkloric craft tradition into the realm of high art is the mission of founder Rahim Walizada. 
This year CHUK PALU introduces a collection of hand-blown Herat glass: spectacular glasses, plates and tiles."
Maison & Objet - January,03/23/2022,2022,https://www.maison-objet.com/en/paris/exhibitors,DM,IMMERSION-HAZELNUT,K2,5A,,,,,,,"Outdoor | Decorative item | Outdoor > Outdoor decor | Decorative item > Sculptures and artworks | Outdoor > Outdoor decor > Outdoor decorative accessories | Decorative item > Sculptures and artworks > Sculptures, statuettes and miniatures",,,
Maison & Objet - January,03/23/2022,2022,https://www.maison-objet.com/en/paris/exhibitors,DM,Sculpture “Ripple”,J45,5A,,,,,,,"Decorative item | Decorative item > Sculptures and artworks | Decorative item > Sculptures and artworks > Sculptures, statuettes and miniatures",,,"Abstract sculptures in bronze.
The sensuality of their curved lines invites the touch.
The accent is placed on tactile perception. These immobile yet lively forms are suggestive of oscillating movement, of aquatic flight. They generate emotion and simplicity."
Maison & Objet - January,03/23/2022,2022,https://www.maison-objet.com/en/paris/exhibitors,DM,Albanegra XXXII Sculpture,J39,5A,,,,,,,Decorative item | Decorative item | Decorative item > Sculptures and artworks | Decorative item > Sculptures and artworks | Decorative item > Sculptures and artworks > Ceramic | Decorative item > Sculptures and artworks > Ceramic,,,"Claire Fréchet designs and handcrafts ceramics that add poetic depth to interior decoration. Her unique pieces invite to a three-dimensional journey into imagination and wonder in the heart of living places decorated with art. Claire’s sculptures inhabit luxurious private and public spaces around the world .

Her special style combines organic and telluric shapes and textures. Her objet d’art entice interior designers and galleries with whom she collaborates in the framework of her collections"
Maison & Objet - January,03/23/2022,2022,https://www.maison-objet.com/en/paris/exhibitors,DM,Sculpture Bull,J11,5A,,,,,,,"Decorative item | Decorative item > Sculptures and artworks | Decorative item > Sculptures and artworks > Sculptures, statuettes and miniatures",,,"The animal sculptures of ATHENA JAHANTIGH are made of sandstone or porcelain.
They carry on their arched backs the iconographic heritage linking them to the parietal art of his native Persia, an inspiration both emotional and nostalgic, but which marries to perfection with her other great formal source, the cave painting.
They are contemporary sculptures with deep roots.
Unique pieces entirely modeled by hand."
Maison & Objet - January,03/23/2022,2022,https://www.maison-objet.com/en/paris/exhibitors,DM,Assorted glassware,R54,5A,,,,,,,Decorative item | Decorative item > Other decorative objects | Decorative item > Other decorative objects > Decorative objects,,,"The objects we propose are all original and for the vast majority datable between the 1940’s and 1960’s, but in some cases are as old as early 1900.  Product research is one of our main activities and is key in bringing a tailored offer to our diverse and very demanding customers. Clients can pick items directly on our M&O stand or buy from the product catalog selecting from over 40 product categories. We are able to restock in large quantities and at any time.  We have a 1000 square meter showroom in northern Italy open to all registered businesses."
Maison & Objet - January,03/23/2022,2022,https://www.maison-objet.com/en/paris/exhibitors,DM,Cushion Covers,F98,5A,,,,,,,Decorative item | Decorative item > Gifts and decorative accessories | Decorative item > Gifts and decorative accessories > Cushions,,,"Meenu Tholia has been devoted in trying to preserve the local handicraft of block printing, hand embroidery, hand quilting...
She works with the local and rural artisans in creating a link between traditional handicraft and the ever-changing global fashion. 

Exporting  to countries like the USA, Italy, France, Germany, UAE, Australia, etc."
Maison & Objet - January,03/23/2022,2022,https://www.maison-objet.com/en/paris/exhibitors,DM,Ze'Tabouret,L13,5A,,,,,,,Furniture | Furniture > Seating | Furniture > Seating > Stools,,,
Maison & Objet - January,03/23/2022,2022,https://www.maison-objet.com/en/paris/exhibitors,DM,Tripod Standing luminaire,M6,5A,,,,,,,Lighting | Lighting > Indoor lighting | Lighting > Indoor lighting > Floor lamps,,,"FLORENCE LEMOINE is a glassblowing artist . Her work, subtle and poetic is the result of a long process of research around  melting glass.
Her creations trigger confusion between senses and matter, playing with transparency and opacity of the material. Mastery and haphazardness brush against each other and intertwine to marry nature and contemporary art."
Maison & Objet - January,03/23/2022,2022,https://www.maison-objet.com/en/paris/exhibitors,DM,Oak ceiling lamp,L2 - L1,5A,,,,,,,Lighting | Lighting > Indoor lighting | Lighting > Indoor lighting > Hanging lights,,,"By working on carefully selected trees, PASCAL OUDET creates very thin pieces that he takes up to transparency, creating a real lace out of wood which emphasizes all the history of the trees he's working with. 

One of a kind pieces for galleries, design and decoration stores, architects and interior designers."
Maison & Objet - January,03/23/2022,2022,https://www.maison-objet.com/en/paris/exhibitors,DM,Decorative object Ricciocaprese Fragrance,B14 - C13,5A,,,,,,,Fragrances & wellness | Fragrances & wellness > Fragrances | Fragrances & wellness > Fragrances > Home fragrances,,,RICCIOCAPRESE is an Italian design that is inspired by its homeland and its culture and that only creates handmade items.
Maison & Objet - January,03/23/2022,2022,https://www.maison-objet.com/en/paris/exhibitors,DM,Metropolis pendant lamp,H13,5A,,,,,,,Lighting | Decorative item | Lighting > Indoor lighting | Decorative item > Sculptures and artworks | Lighting > Indoor lighting > Ceiling lights | Decorative item > Sculptures and artworks > Unique pieces,,,
Maison & Objet - January,03/23/2022,2022,https://www.maison-objet.com/en/paris/exhibitors,DM,Dried Tree,R62,5A,,,,,,,Decorative item | Decorative item > Sculptures and artworks | Decorative item > Sculptures and artworks > Unique pieces,,,
Maison & Objet - January,03/23/2022,2022,https://www.maison-objet.com/en/paris/exhibitors,DM,Golden Christmas Balls,A128 - B127,5A,,,,,,,Decorative item | Decorative item > Christmas decorations | Decorative item > Christmas decorations > Christmas garlands and baubles,,,"SHISHI is a Norwegian-Estonian joint venture established in 1998 by Linda JOHNSEN, Lilli BENDRISS, Taivo PILLER and Mart HABER. The company of friends wanted to create an international brand that would offer fresh and interesting ideas for interior decoration.
The name SHISHI was chosen for its appealing look: the owners wanted to create a meaning for it themselves. Initially, the main emphasis was on self-created vases and artificial flowers, as both Linda JOHNSEN and Taivo PILLER are internationally recognized florists, champions of their respective countries on numerous occasions."
Maison & Objet - January,03/23/2022,2022,https://www.maison-objet.com/en/paris/exhibitors,DM,Old Chinese Theater Headdresses,N108 - O107,5A,,,,,,,Decorative item | Decorative item > Sculptures and artworks | Decorative item > Sculptures and artworks > Unique pieces,,,"AsiaDecoration, Asian decorative objects and products from Chinese crafts. Each object is unique and was chosen directly by our decorators. Browse our sections to find the Asian decorative object that you like. We deliver very quickly throughout France and the world. Paints, boxes, brushes, jewelry, Feng Shui ..."
Maison & Objet - January,03/23/2022,2022,https://www.maison-objet.com/en/paris/exhibitors,DM,Small copper teapot,P86,5A,,,,,,,Tableware | Tableware > Glassware | Tableware > Glassware > Carafes,,,a
Maison & Objet - January,03/23/2022,2022,https://www.maison-objet.com/en/paris/exhibitors,DM,100% linen products,F37,5A,,,,,,,Home Fabrics | Decorative item | Home Fabrics > Bedroom and living room textiles | Decorative item > Gifts and decorative accessories | Home Fabrics > Bedroom and living room textiles > Bed linens | Decorative item > Gifts and decorative accessories > Cushions,,,"Decorative maintaining quality and environmentally linen that insulates winter, cool in summer with no harm to nature. Our philosophy is simple. We create beautiful textiles for every corner of your life"
Maison & Objet - January,03/23/2022,2022,https://www.maison-objet.com/en/paris/exhibitors,DM,"Leather butterfly chair, rattan lounge chair",Q110 - R109,5A,,,,,,,Furniture | Furniture > Seating | Furniture > Seating > Chairs,,,"MALAGOON, a collection of bed linen and happy accessories, easy to mix and match in and around the house."
Maison & Objet - January,03/23/2022,2022,https://www.maison-objet.com/en/paris/exhibitors,DM,IKAT CUSHION,Q85,5A,,,,,,,Decorative item | Home Fabrics | Decorative item > Gifts and decorative accessories | Home Fabrics > Bedroom and living room textiles | Decorative item > Gifts and decorative accessories > Cushions | Home Fabrics > Bedroom and living room textiles > Fabric cushions,,,
Maison & Objet - January,03/23/2022,2022,https://www.maison-objet.com/en/paris/exhibitors,DM,YOYO - LONG LONG NECKLACE 6 - P/E 2021,J27,5A,,,,,,,Fashion | Fashion > Fashion accessories | Fashion > Fashion accessories > Jewelry,,,"The textile material worked is a synthetic mesh. Light, airy but also full of spring and tonicity, the hand gestures to shape it are multiple.
Stretched, retracted, sewn, welded, heated, Françoise plays with freedom to create shapes and volumes.
Jewelry, lights, sculptures, paintings ...
Françoise's creations take us into a soft, feminine and very Couture universe."
Maison & Objet - January,03/23/2022,2022,https://www.maison-objet.com/en/paris/exhibitors,DM,Stone Washed Bed Linen,E46,5A,,,,,,,Home Fabrics | Home Fabrics > Bedroom and living room textiles | Home Fabrics > Bedroom and living room textiles > Bed linens,,,"At LinenMe we are committed to ensuring our products are sustainably produced. Linen itself is an environmentally-friendly fabric as it requires fewer resources to grow and process, and is biodegradable. We use every last inch of fabric in our production process to minimise waste, and we craft products that are made to last, in keeping with our love of slow-living and considered consumption. We use only green energy in our production."
Maison & Objet - January,03/23/2022,2022,https://www.maison-objet.com/en/paris/exhibitors,DM,deckchairs,E30,5A,,,,,,,Outdoor | Outdoor > Garden furniture | Outdoor > Garden furniture > Deck chairs,,,"The ARTIGA adventure began 19 years ago when Quitterie Delfour bought out a dressmaking firm located in southwest France and then decided to keep the full production chain there.

ARTIGA, this is a natural origin product, made of pure cotton or a linen-cotton blend, well known for its sturdiness, its weave and its inimitable texture."
Maison & Objet - January,03/23/2022,2022,https://www.maison-objet.com/en/paris/exhibitors,DM,Krama Scarf,Q90,5A,,,,,,,Fashion | Fashion > Fashion accessories | Fashion > Fashion accessories > Scarves,,,
Maison & Objet - January,03/23/2022,2022,https://www.maison-objet.com/en/paris/exhibitors,DM,Bamboo Linen Tablecloth,F16 - G15,5A,,,,,,,Kitchen | Kitchen > Kitchen fabrics | Kitchen > Kitchen fabrics > Table cloths,,,"THE NAPKING BY BELLAVIA, a new line of pure linen high quality napkins, cocktail serviettes, tablecloths and place mats. An Italian brand with a contemporary attitude, created to satisfy the unique needs and characteristics of top clients.
Every napkin and serviette is delivered with the highest standard of quality and elegance. All our products are created with only the best linen and entirely produced by highly skilled craftsmen and women. We offer a wide range of ready-made products, as well as customized."
Maison & Objet - January,03/23/2022,2022,https://www.maison-objet.com/en/paris/exhibitors,DM,Bougie végétale 180g,D45,5A,,,,,,,Fragrances & wellness | Fragrances & wellness > Fragrances | Fragrances & wellness > Fragrances > Candles,,,
Maison & Objet - January,03/23/2022,2022,https://www.maison-objet.com/en/paris/exhibitors,DM,Forbidden Fig 3 Wick Tin,C14 - D13,5A,,,,,,,Fragrances & wellness | Fragrances & wellness > Fragrances | Fragrances & wellness > Fragrances > Candles,,,"Voluspa is a reflection of the art, beauty and culture that inspire its founders. Hand poured in California, and curated to perfection, each unique vessel is designed by our in-house artisans and packaged to perfection. Our signature fragrances are meticulously handcrafted, using the finest ingredients sourced from around the globe, and blended into our clean burning luxurious coconut wax. Fill your home with a luxury fragrance experience that enlightens, entertains and inspires."
Maison & Objet - January,03/23/2022,2022,https://www.maison-objet.com/en/paris/exhibitors,DM,Screen,P108 - Q107,5A,,,,,,,Hospitalities & Contracts | Workplace | Decorative item | Hospitalities & Contracts > Community design and outfitting | Workplace > Office furniture and fittings | Decorative item > Gifts and decorative accessories | Hospitalities & Contracts > Community design and outfitting > Panels | Workplace > Office furniture and fittings > Office design and planning | Decorative item > Gifts and decorative accessories > Design objects,,,"Stools, bowls, sinks, and slabs and much more. New collection of ray skin furniture and accessories made to measure with this amazing material. Also a new uniques products in stabilized  vegetal, from wall to accessories in stabilized vegetals. Unique and new on our stand this year... Sting ray fashion accessories and Damascus blade knives for collectors."
Maison & Objet - January,03/23/2022,2022,https://www.maison-objet.com/en/paris/exhibitors,DM,“CROSS” dining table,O16 - P15,5A,,,,,,,Furniture | Furniture > Tables | Furniture > Tables > Dining Tables,,,"BEST BEFORE... objects are made by hand, using natural and environmentally friendly materials. Collections are designed by Corinne Muller and Piotr Oleszkowicz and made by expert hands who perpetuate ancestral traditions."
Maison & Objet - January,03/23/2022,2022,https://www.maison-objet.com/en/paris/exhibitors,DM,Mask in drums,O92 - P91,5A,,,,,,,Decorative item | Decorative item > Wall decor | Decorative item > Wall decor > Other wall decoration,,,
