ShowName,ShowDate,ShowYear,ShowWebsite,SubmittedBy,ExhibitorName,BoothNumber,HallLocation,Website,Email,Phone,Fax,Address,Country,Categories,Manufacturers,Brands,Description
Maison & Objet,03/24/2022,2022,https://www.maison-objet.com/en/paris/exhibitors,DM,Adjustable bracelet chains,F51,1 - 2,,,,,,France,,,MIMI ROSE ATELIER,"Are you looking for a customizable piece of jewelry? Fall for our pretty chain bracelet, the perfect accessory to add to your jewelry collection.
Available in gold and silver, our chain can be worn in all situations, it's up to you to adapt it to the situation by personalizing it!

Material: stainless steel
IP plating, mini 0.4 micron: IP Gold and IP rodhium
Mini length = 16 cm / maximum length = 24 cm"
Maison & Objet,03/24/2022,2022,https://www.maison-objet.com/en/paris/exhibitors,DM,Bermuda Collection,E92,2,,,,,,France,,,BATUCADA,"Our jewels are composed of 80% organic soy oil 

Don't need to buy a ticket to travel to the Bermuda Triangle? 
Chic and discreet, the Bermuda set will dress you with a contemporary touch.
Its Short necklace does not require you to wear a neckline and therefore can be worn all year round.

Collection available in Necklace, Bracelet & Earrings.

Designed by Antoine Verbrugghe

Public prices around: €13.50 for the earrings and bracelet, 29.50 Euros for the necklace."
Maison & Objet,03/24/2022,2022,https://www.maison-objet.com/en/paris/exhibitors,DM,Amazona earrings,F46,2,,,,,,France,,,ACAÏ,Golden grass earrings with black silk thread
Maison & Objet,03/24/2022,2022,https://www.maison-objet.com/en/paris/exhibitors,DM,DREAM VAN:1 silicone mat + 5 markers + 1 bracelet EASY TO WIPE CLEAN - REUSABLE - FROM 3 YEARS OLD,I25,2,,,,,,France,,,SUPER PETIT,"FOR YOUNG ARTISTS: Ideal for keeping the young ones busy, at home or on the go. Colour, erase, start again, it’s smart and reusable!
SAFE & SOFT: Made of 100% food grade silicone. Its non-porous anti-bacterial surface is perfect for your little ones.
FUN & CREATIVE: Unique designs made to spark the imagination of kids of all ages.
A RESPONSIBLE PRODUCT: Member of 1% for the Planet, we donate 1% of our sales to organisations committed to protecting the environment.
FRENCH BRAND: Created in 2015 by two sisters, SuperPetit develops innovative products inspired by our children."
Maison & Objet,03/24/2022,2022,https://www.maison-objet.com/en/paris/exhibitors,DM,ALBY BEE - VIBRANT TOY 100% ORGANIC COTTON,G27,2,,,,,,France,,,MYUM - THE VEGGY TOYS,"Alby is going to surprise you! She vibrates when you pull her heart.Friends from the garden are created to teach the children on little insects & animals from the garden and help them not to be afraid of them ... This toy is suitable for babies, girls or boys, from birth. It is handmade with crochet. Its texture awakens the senses and its shape is created to make babies aware of nature. This is an original and fair birth gift!"
Maison & Objet,03/24/2022,2022,https://www.maison-objet.com/en/paris/exhibitors,DM,Tin toys / Pedal Cars / Music boxes,H98,2,,,,,,Spain,,,PROTOCOL,"Tin toys wind up or friction
Pedal cars and speedsters
Musical movements and Music boxes"
Maison & Objet,03/24/2022,2022,https://www.maison-objet.com/en/paris/exhibitors,DM,"Helium tank, mint, 30 balloons",I109,2,,,,,,Poland,,,PARTYDECO,"Helium Tank - ready to use!
Now you can prepare each party yourself!

Helium tank for 30 pieces of balloons in mint colour with black print, capacity approx. 0.21 m3."
Maison & Objet,03/24/2022,2022,https://www.maison-objet.com/en/paris/exhibitors,DM,iron on patch - Triton,E5,2,,,,,,France,,,MACON & LESQUOY,"Designed and made like jewels, our patches are funny and practical. Elegant parade for all the little snags or stains, they will also charm transfer nostalgics and small detail amateurs.

Protected original creations"
Maison & Objet,03/24/2022,2022,https://www.maison-objet.com/en/paris/exhibitors,DM,"Outils éducatifs, esthétiques, poétiques et utiles au quotidien!",G23,2,,,,,,France,,,LES PETITES HIRONDELLES,mm
Maison & Objet,03/24/2022,2022,https://www.maison-objet.com/en/paris/exhibitors,DM,DIY COSTUME COLLECTION / ASTRONAUT,H91,2,,,,,,Poland,,,KOKO CARDBOARDS,"We introduce our brand new collection...DIY COSTUMES! The entire collection has 8 options: traveler, astronaut, mermaid, fairy, superhero, t-rex, unicorn, and king. 
The astronaut set includes a helmet and backpack. 
It is a perfect activity for kids and parents, which ends up with a fantastic product made by your hands!
Working time is about  2 hours. 
The product is made in Poland from certified cardboard. 
Be an astronaut and explore the universe!
For more information contact us!"
Maison & Objet,03/24/2022,2022,https://www.maison-objet.com/en/paris/exhibitors,DM,Jewelry Postcards,E58,2,,,,,,Netherlands,,,A BEAUTIFUL STORY,"18 postcards with a unique illustration, handmade bracelet and envelope. Gifts for any occasion."
Maison & Objet,03/24/2022,2022,https://www.maison-objet.com/en/paris/exhibitors,DM,FABA - Songs,I69 - I69,2,,,,,,Italy,,,"FABA, VOTRE CONTEUR D'HISTOIRES","With FABA’s songs, you never get bored! You can listen to them during a party, playing, or helping Mom tidy up the room. FABA’s music has been carefully chosen, in order to convey the right messages to the smallest and to be adapted to all target groups. Marcher dans le Monde, Les Chansons des Animaux, Les Câlins avant de Dormir and many more!"
Maison & Objet,03/24/2022,2022,https://www.maison-objet.com/en/paris/exhibitors,DM,MAMY HAT,D85,2,,,,,,France,,,SUN AND GREEN,"RAW edge

Local leather outer band
Fine knit

Size: 60
Height: front 10 cm, back 9 cm

Sale by pack of 4"
Maison & Objet,03/24/2022,2022,https://www.maison-objet.com/en/paris/exhibitors,DM,Mecodi Hat,D57,2,,,,,,France,,,CAMALYA,Handmade two-tone raffia hat
Maison & Objet,03/24/2022,2022,https://www.maison-objet.com/en/paris/exhibitors,DM,Necklace Eye Psyche,B18,2,,,,,,France,,,COUCOT,"Necklace Eye Psyche

 Silver 925 & silk
EYE OF ROCK Collection"
Maison & Objet,03/24/2022,2022,https://www.maison-objet.com/en/paris/exhibitors,DM,"Bonne Nuit Les Petits BIRTH BOXES, 100% organic cotton, with free customization",G98,2,,,,,,United Arab Emirates,,,RETAIL CATCH FASHION FZE,"The perfect gift for a new baby! Elegant and simple, this padded pouch is topped with our iconic hot air balloon and our little Sweet Dreams babies. Includes a bodysuit with a wrap opening in the front, pant pants to keep baby's legs warm, and a matching hat. Available in polka dot and stripe prints in 1 month size.

We offer free personalization on Petit Jul.'s organic baby line A name can be embroidered on it to be a special gift!"
Maison & Objet,03/24/2022,2022,https://www.maison-objet.com/en/paris/exhibitors,DM,Medal bracelet Alabama,F38,2,,,,,,France,,,LITCHI,Medal bracelet illustrated by Annabi
Maison & Objet,03/24/2022,2022,https://www.maison-objet.com/en/paris/exhibitors,DM,POCHETTE XL / XXL,F7,2,,,,,,France,,,1970-1976 COMPANY,"Pochette XXL intemporelle, un style atypique, empreinte d’un univers à la fois urbain et sophistiqué, un bijoux décomplexé !
VIBRANTE, SINGULIERE, IMPREVISIBLE, Pochette XL / XXL intemporelle avec double zip doré à l’or fin ou noir mat, , dimension H 24 L35/ H29 L40 cuir à tannage végétal.
Avec son Genuis Bag"
Maison & Objet,03/24/2022,2022,https://www.maison-objet.com/en/paris/exhibitors,DM,all day long bag,E78 - F77,2,,,,,,Italy,,,EBARRITO RE:THINKING FASHION,This patchwork leather satchel from Ebarrito has a compact and eye-catching silhouette with silver hardware and a snap closure. Patchwork leather will brighten up even the classic outfits of jackets and ankle boots. Convenient to carry by hand but also has an adjustable leather shoulder strap.
Maison & Objet,03/24/2022,2022,https://www.maison-objet.com/en/paris/exhibitors,DM,Socks : Léopold & Zoé,C9,2,,,,,,France,,,CABAÏA,"Our inseparable socks are soft and smell good ! 

80% crafted coton, one size fits all form men (40/45 EU) and women (35/40). 

Wood button on top to tight your socks together (after you removed them please). 

Packaging in recycled kraft.
Kids collection is also available"
Maison & Objet,03/24/2022,2022,https://www.maison-objet.com/en/paris/exhibitors,DM,Pleated Tote Bag | Millerighe,E35,2,,,,,,Italy,,,WRITE SKETCH &,"Satin pleated bag Millerighe, size 41 x 51 cm. The pleated fabric bag is made of silk-effect synthetic satin, with resistant handles applied with a triple stitch. A shopping bag as comfortable and roomy as it is elegant and light. Write Sketch & bags are Made in Italy and produced with the highest quality materials"
Maison & Objet,03/24/2022,2022,https://www.maison-objet.com/en/paris/exhibitors,DM,"Zip case for MacBook air 13"" 2020 / Pro 13"" in Sofa Lurex",E18 - F17,2,,,,,,Italy,,,PIJAMA,"This soft case will keep your device safe from all annoying situations. 
It fits Macbook Pro 13” touch bar, new Macbook Air 13” (2018 release), Macbook 12"" and laptop up to 30,4x21,2 x1,49cm. 
YKK zip closure. 
3mm neoprene and black synthetic jersey lining glued to external fabric. 
Made in Italy."
Maison & Objet,03/24/2022,2022,https://www.maison-objet.com/en/paris/exhibitors,DM,Pompom Hat,,2,,,,,,France,,,LE VENT A LA FRANCAISE,"Woven and made in Saint-Didier-en-Velay, in the Auvergne-Rhône-Alpes region
Fleece lining for extra comfort!
100% Acrylic Animal Free
Timeless product
For Men & Women
One size fits all
Result of the work of 35 people in France.

This hat is packaged in a pouch logoted “Le Vent à la Française”"
Maison & Objet,03/24/2022,2022,https://www.maison-objet.com/en/paris/exhibitors,DM,Wide cuff EDEN KHAKI,F22,2,,,,,,France,,,BANGLE UP,Printed enamel adjustable wide cuff. Gilded brass. Width: 3.0 cm
Maison & Objet,03/24/2022,2022,https://www.maison-objet.com/en/paris/exhibitors,DM,Hydrangea collection.,F41,2,,,,,,Spain,,,RAS,"Set of hydrangea petals. Necklace, earrings, brooches and bracelets.
Light pieces of Japanese style that evoke romantic moments. With colours and with out colors. Gold plated or silver plated. Nices collections - special lovely colection."
Maison & Objet,03/24/2022,2022,https://www.maison-objet.com/en/paris/exhibitors,DM,Urban Framboise Beanie,H25,2,,,,,,France,,,HELLO HOSSY®,"Wow! The Urban Framboise beanie will give winter some pep. Beautiful colors, 100% organic cotton, available from 9 months, it will enchant kids. An endearing model for kids, attractive for parents... As usual!"
Maison & Objet,03/24/2022,2022,https://www.maison-objet.com/en/paris/exhibitors,DM,TROPICAL ELEGANCE,D91,2,,,,,,United Kingdom,,,LEJU,"LeJu works alongside Colombian artisans to create unique and wearable pieces to style and stack.  Every collection we design is handmade by artisans who, for many years, have kept alive the traditional techniques applied to each and every one of our pieces.  Our jewellery resembles color, imagination, happiness, freedom and originality."
Maison & Objet,03/24/2022,2022,https://www.maison-objet.com/en/paris/exhibitors,DM,Hand cleansing spray,E14,2,,,,,,France,,,KERZON,"This cleansing spray effectively washes your hands without water. Its formulation is based on a mix of natural glycerin and organic aloe vera, which leaves your skin soft, clean, and freshly scented."
Maison & Objet,03/24/2022,2022,https://www.maison-objet.com/en/paris/exhibitors,DM,Word bracelet bbuble,E12,2,,,,,,France,,,BBUBLE,"Word bracelets
Black letters on white stones or white letters on black stones
Sliding knots  
Nicely packaged, on a card with a shower of golden stars in a transparent pouch."
Maison & Objet,03/24/2022,2022,https://www.maison-objet.com/en/paris/exhibitors,DM,Cushions,I6 - J5,2,,,,,,Spain,,,NOBODINOZ,"Of all colours, all shapes, all sizes, for the little ones as well as for the grown-ups, you will find happiness among the large collection of Nobodinoz cushions. 
Designed and manufactured in Barcelona, these cushions are entirely made with organic cotton or recycled fibres and are Oeko-Tex certified, in order to guarantee you the best quality, in addition to providing style and colour to your home.
Designed and made in Barcelona - local production."
Maison & Objet,03/24/2022,2022,https://www.maison-objet.com/en/paris/exhibitors,DM,FRIGG - MUSHIE,G101,2,,,,,,Belgium,,,MAMELOU BV,"FRIGG means “beloved,” ultimately coming from the Indo-European price for “love.” 
In northern mythology, Frigg was the goddess of earth, air, fertility and the wife of Odin. 
We appreciate beauty in minimalistic design and the use of minimalistic materials. 

Mushie is the first name of the brain behind the Mushie brand. 
Together with her husband, she started Mushie after the birth of their second child. 
Mushie is a brand from the US, which mainly combines eco-friendly materials with modern, simplistic designs."
Maison & Objet,03/24/2022,2022,https://www.maison-objet.com/en/paris/exhibitors,DM,Matching caps Wild Child & Cool Dad/Mum,G41,2,,,,,,France,,,CHAMAYE,"Matching caps for parents and kids
“Wild Child” embroidery  for kids (available in 2 sizes: 9-24 mo and 3-6 yo)
“Cool Dad” or “Cool Mum” embroidery for adults
100% Cotton
Front embroidery for kids, in the back pour adults
Colors: yellow and olive green"
Maison & Objet,03/24/2022,2022,https://www.maison-objet.com/en/paris/exhibitors,DM,Headband Lady Rosa,H110,2,,,,,,Poland,,,UL&KA,"Headband is made of elastic cotton, so it is stretchy and comfortable.
The fabric has GOTS certificate.
All items are custom made in Poland in our own workshop."
Maison & Objet,03/24/2022,2022,https://www.maison-objet.com/en/paris/exhibitors,DM,Teddy Bear - LE PETIT FRENCHIE - 20 cm - Brown - Made in France,I19,2,,,,,,France,,,MAILOU TRADITION,"The Petit Frenchie comforter, with its pretty bear shape, is designed like a gingerbread to remind us of our tender childhood. It calls to the greed of cuddles from 0 to 99 years.
Cousin of ""L'ours Français"", the soft toy bear Petit Frenchie is a unique piece designed and handmade in our plush workshop in Brittany.  Our promise and the DNA of our brand: to transmit the soul of a child from generation to generation! Maïlou Tradition, a manufacturer with excellent know-how."
Maison & Objet,03/24/2022,2022,https://www.maison-objet.com/en/paris/exhibitors,DM,NEIGE - BEANIE,E24,2,,,,,,France,,,DENOVEMBRE,"Ribbed beanie, knitted with the exclusive Missègle yarn, an ultra soft and warm blend of mohair and silk. Knitted in France.
One size
Exclusive Missègle yarn: 60% mohair and 40% silk.
Ribbed finish
For care, machine wash on a wool program at low temperature and less than 500 turns or hand wash at maximum 30°, dry flat."
Maison & Objet,03/24/2022,2022,https://www.maison-objet.com/en/paris/exhibitors,DM,Two-Tone Earrings,E71,2,,,,,,France,,,MERVEILLES DU MONDE BIJOUX,"Come and discover our range Bicolore.
The whole range of Metal and Gold Metal to discover on our stand Wonders of the World Bijoux.
Hall 2 Stand B38
All our collections on www.wonderdumonde.fr"
Maison & Objet,03/24/2022,2022,https://www.maison-objet.com/en/paris/exhibitors,DM,Edgy earrings - stainless steel,E67,2,,,,,,Netherlands,,,GO DUTCH LABEL,"The earrings are set with zirkonia crystals and plated with Rhodium or 14K gold. The material is stainless steel, so the plating will last and stay beautiful for a very long time."
Maison & Objet,03/24/2022,2022,https://www.maison-objet.com/en/paris/exhibitors,DM,Louvre,D72,2,,,,,,France,,,VANERRA VANNERIE,"This small purse with a clean line will accompany you wherever you go. Handmade in our workshops with natural materials such as palm and lamb leather.
Diameter 25cm, closure on the front, holding the bag with a chain"
Maison & Objet,03/24/2022,2022,https://www.maison-objet.com/en/paris/exhibitors,DM,Koinobori Rainbow - Kids Deco,G88,2,,,,,,France,,,MADAME MO,"a “floating bridge in the sky”, as the Japanese would call it...
The beauty of the rainbow has always fascinated Madame Mo. So it was obvious that she created a koinobori on this theme. More symbolically, the Arc en Ciel, which often symbolizes the path or the bridge between two points, illustrates Madame Mo's desire to establish a strong link between French culture and Japanese culture. And then, in a more ground-to-earth way, the Rainbow koinobori wants to be a very joyful koinobori, after all, does the Rainbow not become annoxious of the good weather?"
Maison & Objet,03/24/2022,2022,https://www.maison-objet.com/en/paris/exhibitors,DM,Play Mats Foam,G102 - H101,2,,,,,,Belgium,,,HEBECO BV,"No assembly required! Our reversible play mats provide two looks in one – modern décor and playful artwork. Reversible mat for two looks in one – one
side modern décor and the other side fun, playful artwork. Perfect for living room and play room. One sheet of foam – no assembly required. Safe and comfortable place for baby to play. Rolls up for convenient and easy storage. Easy to wipe clean.
• PVC-free, Phthalate-free
• Mat dimensions: 86 x 52 in; 31 square feet
• Thickness: 11.5mm
• Ages 0+"
Maison & Objet,03/24/2022,2022,https://www.maison-objet.com/en/paris/exhibitors,DM,Ski Pyjamas - 1 piece or 2 pieces,G25,2,,,,,,France,,,CHANGE MA COUCHE,"For 1 piece: 6 months/12 months
For the 2 piece: 2yrs/3yrs
Organic Cotton"
Maison & Objet,03/24/2022,2022,https://www.maison-objet.com/en/paris/exhibitors,DM,Egg Buckles Seville,B28,2,,,,,,France,,,L'EGGSTRA OEUFFREZ DU BONHEUR,Genuine chicken egg containing a pair of gold-plated brass earrings
Maison & Objet,03/24/2022,2022,https://www.maison-objet.com/en/paris/exhibitors,DM,Small Leather Goods,E21,2,,,,,,Belgium,,,ESCUYER,"Nos wallets and cardholders are handcrafted in Portugal from the best Italian vegetable tanned leather.
Suggested retail price: from 69€ to 129€
Wholesale price: de 26€ to 49€

Our toilet bags are made in Italy.
Suggested retail price: from 95€ to 145€
Wholesale price: from 36€ to 55€"
Maison & Objet,03/24/2022,2022,https://www.maison-objet.com/en/paris/exhibitors,DM,TIMELESS BABY DOLL COLLECTION,F24,2,,,,,,France,,,BELLE MAIS PAS QUE,Woven and hand-crafted bracelets made from miyuki beads. Sliding knot.
Maison & Objet,03/24/2022,2022,https://www.maison-objet.com/en/paris/exhibitors,DM,Le Bandit,C27,2,,,,,,France,,,LE SOU FRANÇAIS,"Our bracelets are ""Made in France"", 100% handmade, elaborated and made by us in our workshop Landes Hossegor.

Our bracelet is composed of a real French coin ""Lindauer"" of 10 centimes, manufactured between the years 1917 and 1939. We restore each piece in our workshop, to give them all their splendor.
The bracelet is unique in its kind, as each of our wristbands fits female wrists and male wrists with its two sliding knots."
Maison & Objet,03/24/2022,2022,https://www.maison-objet.com/en/paris/exhibitors,DM,Tokyo,E22,2,,,,,,France,,,ATELIER ST EUSTACHE,"First collection of the brand, ""Tokyo"" get its inspiration from the areas of the city : Asakusa Culture Center, Ginza's high buildings, the sakura leaves on Nakameguro's canal, Shibuya pedestrian crossing, and Shinjuku's light."
Maison & Objet,03/24/2022,2022,https://www.maison-objet.com/en/paris/exhibitors,DM,Edgar Health Book Cover,G26,2,,,,,,France,,,MILINANE,"Our Edgar Healthy Book Cover will satisfy every taste, from tiger motif, rainbow to bucolic dream or owl. 
Made in Portugal and made of cotton canvas certified Oeko-Tex Standard 100, our notebook covers have a magnetic closure, easy to use."
Maison & Objet,03/24/2022,2022,https://www.maison-objet.com/en/paris/exhibitors,DM,"""Dashy"" biplane shelf",G28,2,,,,,,Poland,,,UP! WARSAW,"The Up! Warsaw „Dashy” biplane shelf is a real, all-round talent. Its young users can keep toys on the wings, pop a favourite teddy into the cockpit, drape things from the wheel axle and spin the propeller at will! The DASHY biplane shelf is supplied in large, easy-to assemble parts and includes all the necessary screws, along with the instructions. 
Assembled dimensions:
71 x 42 x 28 cm / 27.9 x 16.5 x 11.0 in
Boxed dimensions:
72 x 32 x 17 cm / 28.3 x 12.6 x 6.7 in
Weight: 4.0 kg
Accessories included: hooks, wall plugs, propeller, instructions
Available colors: mint, blue, natural"
Maison & Objet,03/24/2022,2022,https://www.maison-objet.com/en/paris/exhibitors,DM,BABYSHOWER MOSES BASKET,H33,2,,,,,,Spain,,,BABYSHOWER,"Light, practical and portable. Tha baby carrier basket is the perfect alternative to take with
you everywhere. This set includes: basket, mattress, fitted sheet, cot liner, cover and pillow
+ pillow case. Wood stand is also available in 2 models."
Maison & Objet,03/24/2022,2022,https://www.maison-objet.com/en/paris/exhibitors,DM,Les Mots Doux x Baubels,D18,2,,,,,,France,,,LES MOTS DOUX,"Les Mots Doux has teamed up with Baubels to offer you an inspiring and magical duo for the back to school season!

This little star and this pretty pencil will give you wings to follow your dreams.

Made with love in France.
Gold plated bracelet - Water resistant"
Maison & Objet,03/24/2022,2022,https://www.maison-objet.com/en/paris/exhibitors,DM,bijoux / sacs / étoles,F58,2,,,,,,France,,,DIAPERIS,bijoux galuchat serti pierres semi précieuses
Maison & Objet,03/24/2022,2022,https://www.maison-objet.com/en/paris/exhibitors,DM,Blue white braided belt,A6,2,,,,,,France,,,VERTICAL L ACCESSOIRE,"Blue white braided belt made in France

Best seller for 80% of our partner shops, this accessory is not to be missed ! 
Made in France (made near Lyon), one size (will fit from 38 to 44), affordable price (sold 38€ public price) 
Sold with its cotton pouch."
Maison & Objet,03/24/2022,2022,https://www.maison-objet.com/en/paris/exhibitors,DM,Scarf Wave - rouge,F11,2,,,,,,France,,,BOULBAR,"100% wool
Made in India. Fair Trade.
Hight-quality"
Maison & Objet,03/24/2022,2022,https://www.maison-objet.com/en/paris/exhibitors,DM,ROSE MARIE JEWELRY SILVER 925,F23,2,,,,,,France,,,ROSE MARIE,Silver 925
Maison & Objet,03/24/2022,2022,https://www.maison-objet.com/en/paris/exhibitors,DM,Cloud Play Mat - Pearl Grey,I97,2,,,,,,Belgium,,,QUUT TOYS,"The soothing and subtle colours, and the fun, poetic shape bring a playful, kid-friendly yet stylish accessory into your living space. Brighten up your play area while making it soft and safe. The playmat grows with your child thanks to its different functionalities. From a firm, yet comfortable surface for practicing tummy time as your toddler starts to crawl to a cosy reading nook or small theater setting. No matter what milestone, the Quut playmat is the perfect backdrop for creating precious memories.
Waterproof, it will be very easy to care for and will guarantee absolute hygiene."
Maison & Objet,03/24/2022,2022,https://www.maison-objet.com/en/paris/exhibitors,DM,Vehicles toy art and deco,H70,2,,,,,,France,,,NEOTILUS,"The Playforever story begins when 11-year-old Julian Meagher scums car parks on his bike in search of supercars hidden from prying eyes. This fascination for the beauty of these vehicles suggested the ambition of a lifetime: to create a collection of vehicles that would captivate future generations, both children and adults. 

Playforever draws inspiration from vintage industrial design icons combined with years of research, design studies and automotive design."
Maison & Objet,03/24/2022,2022,https://www.maison-objet.com/en/paris/exhibitors,DM,KIMI Baby Bed,G20,2,,,,,,France,,,CHARLIE CRANE,"The new Charlie Crane MUKA convertible bed includes no less than five positions, and also seven positions (with 150 cm extension) so you can use it from the birth of your baby until 6/7 years old. And even beyond, because it transforms into a sofa!

As it is likely that you will keep your MUKA bed for a long time, we wanted it to be beautiful! Composed of plywood birch veneered oak decor, its design is inspired by the movement of vegetal design and its slightly slanted feet give it an airy, levitating appearance."
Maison & Objet,03/24/2022,2022,https://www.maison-objet.com/en/paris/exhibitors,DM,brass bracelet,D54 - E53,2,,,,,,Italy,,,MONDO E COLORI SNC,brass bracelet
Maison & Objet,03/24/2022,2022,https://www.maison-objet.com/en/paris/exhibitors,DM,Glitter Leather Queen Purse,F6,2,,,,,,France,,,LA CARTABLIÈRE,"The purse Mini Queen from The cartablière is a small purse with a vintage look. Very practical, it fits into a pocket or small pouch and can hold coins and notes. It closes with a ball clasp like our grandmother's.
Made of cowhide suede Glitter
Made In France"
Maison & Objet,03/24/2022,2022,https://www.maison-objet.com/en/paris/exhibitors,DM,Vegetal ivory jewelry,E70,2,,,,,,France,,,TAGUA AND CO,"Vegetal ivory jewellery (Tagua)
Craftsmanship from Ecuador.
Sustainable development.
Eco Responsible"
Maison & Objet,03/24/2022,2022,https://www.maison-objet.com/en/paris/exhibitors,DM,BORA BORA,G36,2,,,,,,France,,,CARAMEL AU SUCRE,COLLIER EN ARGENT ET AMETHYSTE
Maison & Objet,03/24/2022,2022,https://www.maison-objet.com/en/paris/exhibitors,DM,The Scarf Edition,E6 - F5,2,,,,,,France,,,INOUI EDITIONS,"The scarf has been part of the French wardrobe since the 17th century. Inoui Editions, for whom the scarf is the founding accessory, reinvents it each season with style. It is declined on a variety of materials welcoming a colorful and abundant world. Let our universe inspire you."
Maison & Objet,03/24/2022,2022,https://www.maison-objet.com/en/paris/exhibitors,DM,Wizard range,H87,2,,,,,,France,,,TIM&PUCE FACTORY,A beautiful range illustrated with high attention
Maison & Objet,03/24/2022,2022,https://www.maison-objet.com/en/paris/exhibitors,DM,Headband in plated gold,E41,2,,,,,,France,,,SONINKÉ,"Headband in plated gold.
Possibility to make it in gold plated.
Headband ajustable by extension. 
Handmade in our Paris workshop
Shipping with handmade Lotta Djossou envelop"
Maison & Objet,03/24/2022,2022,https://www.maison-objet.com/en/paris/exhibitors,DM,Milla,I30,2,,,,,,Sweden,,,BUKOWSKI DESIGN AB,37cm colorful rabbit of cotton material
