ShowName,ShowDate,ShowYear,ShowWebsite,SubmittedBy,ExhibitorName,BoothNumber,HallLocation,Website,Email,Phone,Fax,Address,Country,Categories,Manufacturers,Brands,Description
Las Vegas Market - Summer,08/22/2021,2021,https://www.lasvegasmarket.com/,DM,Modway Furniture,"B722,H704","Building B,Market Square Suites",http://www.modway.com,lennon.c@modway.com,(609) 256-9000,(888) 490-7675,New Jersey - NJ 329 Wyckoff Mills Rd East Windsor,United States,"Accent Furniture | Dining, Outdoor | Lighting | Mattress Accessories | Mattresses | Rugs, Outdoor | Upholstery",,,"Modway supplies the furniture and design trade with over 8,000 SKUs stored in our strategically located east and west coast warehouses totaling more than 1 million sq ft of dedicated space. 

Modway accounts benefit from extensive in-stock color, size, and style options with no order minimums, full drop-shipping capabilities, real-time inventory counts, and an easy online ordering process, making this a wholesale program that works for you. 

Modway services every major furniture category, and we now carry an extensive line of boxed mattresses and area rugs. Catering to both modern indoor and outdoor furniture needs, we make it easy to find the perfect products for your next project."
Las Vegas Market - Summer,08/22/2021,2021,https://www.lasvegasmarket.com/,DM,The Resident Chef,C1112NN,Building C,http://www.theresidentchef.com,info@theresidentchef.com,(479) 347-7969,,Arkansas - AR 21754 Friendship View Dr. Springdale,United States,Gourmet Food & Beverages | Housewares,,,"Bringing you affordable, great tasting gourmet items that help to make you The Resident Chef of your home."
Las Vegas Market - Summer,08/22/2021,2021,https://www.lasvegasmarket.com/,DM,Three Birds Casual,"B166,2502","Building B,Market Square Suites",http://www.three-birds.com,tvarga@three-birds.com,(260) 244-4334,(260) 244-4634,Indiana - IN PO box 465 Columbia City,United States,"Accent Furniture | Benches | Chairs, Dining | Chairs, Upholstered | Chaise Lounges | Chaise Lounges, Outdoor | Outdoor/Casual Furniture | Upholstery",,,"Specializing in the design, manufacturing, and distribution of luxury grade casual living products around the globe. Three Birds Casual is the choice among, retailers, designers and architects for both residential and commercial projects."
Las Vegas Market - Summer,08/22/2021,2021,https://www.lasvegasmarket.com/,DM,Shifman Mattress Company,C1554,Building C,http://www.shifman.com,kylie.feldman@shifman.com,(973) 589-2400,(973) 589-7876,New Jersey - NJ 1 Mott St PO Box 5007 Newark,United States,Box Springs & Foundations | Mattresses | Mattresses,,,"Experience the Shifman Difference. Shifman’s luxurious, handcrafted mattresses are built with the same commitment to quality, integrity, and true craftsmanship that the company was founded on over 128 years ago. Thoughtful devotion to detail and selection of the world’s finest materials ensure that the beauty of a Shifman mattress goes beyond the surface."
Las Vegas Market - Summer,08/22/2021,2021,https://www.lasvegasmarket.com/,DM,The Mezzanine Shoppe,B854,Building B,http://www.buylateral.com,frances.lee@buylateral.com,(630) 784-1188,(630) 784-1185,Illinois - IL 146 Alexandra Way Carol Stream,United States,"Accent Furniture | Benches | Bookcases | Chairs, Dining | Chairs, Upholstered | Dinettes | Entertainment Centers | Ready to Assemble | Sofas | Upholstery",,,"Proficient in Drop Ship & Direct Import Programs, doing business in the USA since 1985, and located in the Mid-West"
Las Vegas Market - Summer,08/22/2021,2021,https://www.lasvegasmarket.com/,DM,Port 68,"A130,IH105 InterHall","Building A,Market Square Suites",http://www.port68.com,mark@port68.com,(866) 960-7930,(866) 960-5281,Illinois - IL 4201 W. Belmont Ave Chicago,United States,"Accent Furniture | Benches | Candles and Holders | Consoles | Decorative Accessories | Floor Lamps | Lampshades | Lighting | Pottery & Ceramics | Table Lamps | Tables, Accent | Upholstered Chairs, Dining | Vases | Wall Art | Wall Decor | Wall Sconces",,,"PORT 68 is a home decor company specializing in table lamps, pendants, accent furniture, upholstered benches, wall decor and home accessories. Designed by ARTS award winner, MARK ABRAMS, our collections feature traditional, modern and transitional furnishings in a timeless, classic style. We offer hand-painted porcelain lamps, oriental porcelain and designer accessories. Our accent benches are upholstered in Chicago in a multiple of imported fabrics and finishes. 

PORT 68 has licensed collections of lighting and decor with SCALAMANDRE, and the COLONIAL WILLIAMSBURG FOUNDATION. Scalamandre Maison for PORT 68 celebrates America's foremost textile houses' archives of fabric and wallpaper. Chinoise Exotique, Greystone, Arcadia, and Baldwin Bamboo are dramatically interpreted into embellished porcelain accessories, lighting, upholstered benches and accent decor. 

WILLIAMSBURG tells the story of ""Trend Meets Tradition"" in home furnishings. The patterned collection of lamps, accessories and wall decor with PORT 68 is inspired by the archives and rich history of the American homes from the 18th century in Colonial Williamsburg, Virginia. Braganza, Charlotte, Palace Fret, Lamerie and Portsmouth Pineapple all are interpretations of the historic district and archives of the Williamsburg museums. The framed artwork features giclee prints of the Governor's Palace, Garden Parterre's and Gardens, and Captain John Smith's historical Map of Virginia."
Las Vegas Market - Summer,08/22/2021,2021,https://www.lasvegasmarket.com/,DM,Loloi Rugs,"A224-04,B462,B471,B480,B482,D320","Building A,Building B,Building B,Building B,Building B,Market Square Suites",http://www.loloirugs.com,cloloi@loloirugs.com,(972) 503-5656,(972) 387-0436,Texas - TX 4501 Spring Valley Rd Dallas,United States,"Blankets & Throws | Home Textiles | Outdoor/Casual Furniture | Pillows | Rug / Floor Coverings | Rugs, Outdoor | Tapestries | Wall Art | Wall Decor",,,"Loloi designs and creates rugs, pillows, throws and wall art for the thoughtfully layered home. | Winners of 6 ARTS Awards for “Best Rug Manufacturer” | Explore our collaborations with Magnolia Home by Joanna Gaines, ED Ellen DeGeneres, Rifle Paper Co. and Justina Blakeney."
Las Vegas Market - Summer,08/22/2021,2021,https://www.lasvegasmarket.com/,DM,VIG Furniture,B680,Building B,http://www.vigfurniture.com,andrew@vigfurniture.com,(323) 588-7434,(323) 588-7441,California - CA 3251 E. Slauson Ave. Vernon,United States,"Accent Furniture | Chairs, Accent | Chairs, Dining | Decorative Accessories | Lighting | Mirrors | Outdoor/Casual Furniture | Rug / Floor Coverings | Wall Decor",,,"VIG Furniture is a dynamic wholesaler, distributing mid to high end contemporary, modern & transitional home furnishings. VIG focuses on providing our clients with the hottest designs, exclusive models, and impeccable quality at unbeatable prices."
Las Vegas Market - Summer,08/22/2021,2021,https://www.lasvegasmarket.com/,DM,Technogel,C1584,Building C,http://www.technogelworld.com,d.levinger@technogel.us,(412) 722-0030,(412) 722-0050,Pennsylvania - PA 730 Holiday Dr. Suite 330 Pittsburgh,United States,,,,"Since 1990, Technogel has been transforming experiences with cool comfort and superior ergonomic support. Pioneering mattresses and pillows with a thick layer of (non-toxic) gel, Technogel promotes better rest in the home, office and while traveling."
Las Vegas Market - Summer,08/22/2021,2021,https://www.lasvegasmarket.com/,DM,Phillips Collection,"A202,C202","Building A,Market Square Suites",http://www.phillipscollection.com,mandy@phillipscollection.com,(336) 882-7400,(336) 882-7405,North Carolina - NC 916 Finch Ave High Point,United States,"Accent Furniture | Chandeliers | Decorative Accessories | Floor Lamps | Lighting | Table Lamps | Tables, Accent | Tabletop | Wall Decor",,,"For over 35 years, Phillips Collection has been bringing to market award-winning designs that are organic, eco-chic, and a great value. See truly unique, fun pieces that are designed by artists and artisans from around the world."
Las Vegas Market - Summer,08/22/2021,2021,https://www.lasvegasmarket.com/,DM,South Bay International,B962,Building B,http://www.southbayinternational.com,dserven@southbayinternational.com,(909) 718-5000,(909) 718-5001,"California - CA 13169 Slover Ave, Suite B Fontana",United States,Adjustable Beds | Home Textiles | Mattresses | Mattresses | Pillows,,,"SBI was one of the originators of the aEoebed in the boxaE concept. Our business model focus is to develop customized specialty bedding solutions for our retail, ecommerce and OEM partners that help them meet their business objectives.A"
Las Vegas Market - Summer,08/22/2021,2021,https://www.lasvegasmarket.com/,DM,Norwalk Furniture,"A214,A225,M108","Building A,Building A,Market Square Suites",https://www.norwalkfurniture.com,mfdevincenzo@verizon.net,(419) 744-3200,,Ohio - OH 100 Furniture Parkway Norwalk,United States,"Accent Furniture | Chairs, Accent | Chairs, Dining | Chairs, Upholstered | Chaise Lounges | Headboards | Home Textiles | Pillows | Sofas | Upholstered Beds | Upholstery",,,"Norwalk is a manufacturer of custom upholstery with over 850 fabrics & leathers to choose from and the ability to use COM. 
Built in the USA - Inspired by the World."
Las Vegas Market - Summer,08/22/2021,2021,https://www.lasvegasmarket.com/,DM,Kaleen Rugs,"C407,2345","Building C,Market Square Suites",http://www.kaleen.com,monty.rathi@kaleen.com,(888) 452-5336,(706) 529-9491,Georgia - GA 1013 Bonny Oaks Drive P.O. Box 1053 Dalton,United States,"Bath | Decor, Baby & Kids | Home Textiles | Outdoor/Casual Furniture | Rug / Floor Coverings",,,"For more than 50 years, the Kaleen family has built a reputation as a leading manufacturer, importer, and distributor of multi-category resources in today’s floor covering market, working with designers and retailers to provide beautiful, top-quality rugs, carpets, and home accessories for homes around the world. 

Kaleen is headquartered in Mumbai, India, and has three manufacturing units in Bikaner, Mirzapur, and Panipat where yarn rugs and broadloom are produced and shipped, using various international operations, and our United States office and distribution center in Dalton, Georgia. Kaleen’s point of pride and commitment to customer satisfaction reflects the proven success for over 50 years within the textile industry. The strength of Kaleen’s skilled artisans allows for many opportunities no matter the size or complexity of the project. Kaleen’s new and existing manufacturing plants are certified as “GREEN ENERGY,” i.e. solar power and recycling water plants.

The Kaleen brand is more than rugs and broadloom; it is a lifestyle. We put our skills and resources to the best possible use with fashion-forward designs and constantly evolving qualities. Because of our attention to detail, we repeatedly hear from the customer…”It’s perfect.”

High-quality rugs with a luxurious feel is synonymous with Kaleen. Day after day, year after year, we leave no stone unturned to provide long-lasting quality, timeless classics, or high-fashion décor for all your needs.

All Kaleen facilities are eco-friendly and certified by the ISO 9000 & SA8000 International Organization for Standardization that defines, establishes, and maintains an effective quality assurance system for manufacturing and service industries. ISO 9000 & SA8000 deals with the fundamentals of quality management systems, including eight management principles which family of standards are based and certifies all requirements have been met."
Las Vegas Market - Summer,08/22/2021,2021,https://www.lasvegasmarket.com/,DM,OLY Studio,"C584,C596K","Building C,Building C",http://www.olystudio.com,FrankL@olystudio.com,(775) 336-2100,(775) 284-4430,California - CA 2200 Central St. Suite D Richmond,United States,"Accent Furniture | Armoires | Bookcases | Chairs, Accent | Chandeliers | Daybeds | Decorative Accessories | Decorative Tabletop | Entertainment Centers | Lighting | Mirrors | Table Lamps | Tabletop | Wall Art | Wall Decor",,,"Oly: award-winning design to create livable, organic & timeless environments"
Las Vegas Market - Summer,08/22/2021,2021,https://www.lasvegasmarket.com/,DM,RENWIL Inc.,A425,Building A,http://www.renwil.com,jenniferh@renwil.com,(514) 367-1741,(514) 363-4753,Quebec - QC 9181 Rue Boivin Lasalle (Montreal),Canada,Accent Furniture | Chandeliers | Decorative Accessories | Decorative Tabletop | Fixtures | Floor Lamps | Lighting | Mirrors | Rug / Floor Coverings | Table Lamps | Tabletop | Wall Art | Wall Decor,,,"Renwil was founded over 50 years ago in a small studio in Montreal, with one artist and two assistants. The idea was simple: to have in-house artists create genuine works of art for the world of interior design. 

Since then, Renwil has grown to include lighting, mirrors, accessories, accent furniture, rug art, and pillows. At the heart of our organization is a 3,500 sq. ft. art studio, where our twelve in-house artists, designers and product development experts collaborate to create beautiful original product.

At Renwil, we combine the expertise and professional service that come from doing business for more than half a century, with a fresh and vibrant approach to design that values innovation and creativity. 

Our main strength is bridging the gap between the prestige of the art world and the universality of the commercial marketplace, making well-designed products accessible to all."
Las Vegas Market - Summer,08/22/2021,2021,https://www.lasvegasmarket.com/,DM,"Risk Assurance Partners, LLC","B1050,1-538","Building B,Market Square Suites",http://www.raptns.com,dwright@raptns.com,(561) 450-7200,(561) 665-6313,Florida - FL 1615 S. Congress Avenue Suite 104 Delray Beach,United States,,,,"We offer a wide range of turnkey warranty programs designed to fit your needs: Traditional, Reinsurance or Hybrid Programs that support furniture retailers with financial, technology and business intelligence solutions to double profits and stabilize your program."
Las Vegas Market - Summer,08/22/2021,2021,https://www.lasvegasmarket.com/,DM,Cosmos Furniture,"A754,W800","Building A,Market Square Suites",http://www.cosmosfurniture.com,paul@cosmosfurniture.com,(905) 790-2676,,New Jersey - NJ 2300 aE US 1 NORTH North Brunswick,United States,,,,"Bedroom, kitchen, family, dining and living room furniture."
Las Vegas Market - Summer,08/22/2021,2021,https://www.lasvegasmarket.com/,DM,Trans-Ocean Import Co. Inc.,"C475,H412","Building C,Market Square Suites",http://transocean.com,dean@transocean.com,(914) 949-5656,(914) 949-5694,New York - NY 10 Midland Ave. Suite M00 Port Chester,United States,Decorative Accessories | Fireplace & Accessories | Housewares | Kitchen Textiles | Outdoor/Casual Furniture | Rug / Floor Coverings,,,"Trans-ocean manufactueres and distributes the unique designs and constructions created by award winning Designer Liora Manne, which includes area rugs (both indoor only and indoor/outdoor) as well as indoor/outdoor decorative pillows."
Las Vegas Market - Summer,08/22/2021,2021,https://www.lasvegasmarket.com/,DM,Uniters & Furniture Solutions Network,"B1050,1-611","Building B,Market Square Suites",http://www.uniters.com,michaelb@unitersna.com,(877) 336-3041,(561) 313-1232,Florida - FL 1700 Palm Beach Lakes Blvd Suite 1100 West Palm Beach,United States,"Chaise Lounges, Outdoor | Dining, Outdoor | Mattress Accessories | Mattresses | Mattresses | Outdoor/Casual Furniture | Rugs, Outdoor | Upholstery",,,"Trusted for over 30 years as the worldwide leader in furniture protection, UNITERS provides retailers, wholesalers, manufacturers, and their customers the highest quality customer service, value, and innovation in service plans, care products, and support."
Las Vegas Market - Summer,08/22/2021,2021,https://www.lasvegasmarket.com/,DM,Omnia Leather,"A256,C1003","Building A,Market Square Suites",http://www.omnialeather.com,anita@omnialeather.com,(909)393-4400,(909) 393-4401,California - CA 4900 Edison Ave Chino,United States,"Accent Furniture | Chairs, Accent | Chairs, Upholstered | Decorative Accessories | Home Theater Furniture | Sofas | Upholstery",,,"Omnia Leather is the premier source for American Made leather and fabric upholstery. All furniture is designed, manufactured and shipped from our factory in Southern California. We are a family owned business that prides itself in quality workmanship"
Las Vegas Market - Summer,08/22/2021,2021,https://www.lasvegasmarket.com/,DM,Wendover Art Group,"A114,C378,C215","Building A,Building C,Market Square Suites",http://www.wendoverart.com,stuart.spencer@wendoverart.com,(727) 573-1417,(727) 573-1130,Florida - FL 6465 126th Ave North Largo,United States,Decorative Accessories | Mirrors | Picture Frames & Custom Framing | Wall Art | Wall Decor,,,"Wendover Art Group, located in Largo, Florida is a customer-centric domestic creator and manufacturer of distinctive wall decor serving the retail (large and independent), interior design (commercial and residential), hospitality and healthcare industry."
Las Vegas Market - Summer,08/22/2021,2021,https://www.lasvegasmarket.com/,DM,Delta Children,"A735,H714","Building A,Market Square Suites",http://www.deltachildren.com,cwesterman@deltachildren.com,(212) 736-7000,(212) 736-7228,New York - NY 114 W. 26th St. New York,United States,"Cribs | Decor, Baby & Kids | Headboards | Mattresses | Mattresses | Sofas | Upholstery",,,Delta Children  has strived to offer the finest quality baby products for all families a concept that began at the very beginning with the desire to help new parents choose the most fundamental of products for their new babies.
Las Vegas Market - Summer,08/22/2021,2021,https://www.lasvegasmarket.com/,DM,County Road,"C538D,C538F,C538L,M-8031","Building C,Building C,Building C,Market Square Suites",http://www.countyroadusa.com,bryan@countyroadusa.com,(201) 984-2113,,New Jersey - NJ 35-2512 Hudson Street Jersey City,United States,Blankets & Throws | Linens & Bedding | Pillows | Window Treatments,,,"County Road is a destination for all things beautiful, familiar, and unexpected for the home. We create bedding, window treatments, pillows, lamp shades, and table linens.  All of our items are produced proudly in the USA. The brand is timeless and classic while being updated and fresh. Each collection has its own personality.  Domestic and international travels inspire and influence our design aesthetic.  Familiar fabrics of  cotton sateen, linen, and velvet are the foundation, while added touches of embroidery, and cut and sew details complete each collection. All fabrics are of natural fibers.  Our passion is to deliver great product that you will cherish."
Las Vegas Market - Summer,08/22/2021,2021,https://www.lasvegasmarket.com/,DM,Mood Dekor,"B365,H341","Building B,Market Square Suites",http://www.mooddekor.com,info@mooddekor.com,(877) 881-2005,,Alberta - AB 204 1728 35 Ave SW Calgary,Canada,Decorative Accessories | Fixtures | Lighting | Pottery & Ceramics | Vases | Wall Art | Wall Decor,,,"Products made with passion & imagination. Our aim is to introduce inspiring, handcrafted wares at a reasonable price."
Las Vegas Market - Summer,08/22/2021,2021,https://www.lasvegasmarket.com/,DM,Tufan Rugs,"A330,H421","Building A,Market Square Suites",http://www.tufanrugs.com,sina@tufanrugs.com,(713) 988-7779,(214) 377-9376,Texas - TX 10877 Sanden Drive Dallas,United States,Clocks | Decorative Accessories | Home Textiles | Pillows | Rug / Floor Coverings,,,Tufan Rugs offers contemporary and modern rugs.
Las Vegas Market - Summer,08/22/2021,2021,https://www.lasvegasmarket.com/,DM,Modus Furniture International,"B570,C806","Building B,Market Square Suites",http://www.modusfurniture.com,natalie@modusfurniture.com,(310) 827-2129,(310) 827-7972,California - CA 5410 McConnell Avenue Los Angeles,United States,"Accent Furniture | Armoires | Benches | Chairs, Dining | Consoles | Headboards | Sofas | Tables, Accent | Upholstered Beds | Upholstery",,,"Founded over 25 years ago, Modus Furniture is a family-run business built on an uncompromising commitment to quality and style. With our extensive supply network, direct manufacturing capabilities, and a proven track record of delivering premium products to leading retailers, we are rooted in providing you with the comfort of home."
Las Vegas Market - Summer,08/22/2021,2021,https://www.lasvegasmarket.com/,DM,Luna Bella,"C596B,IH210 InterHall","Building C,Market Square Suites",http://www.lunabella.com,Tere@lunabella.com,(305) 696-0310,(305) 696-0763,Florida - FL 3650 East 10th Court Hialeah,United States,Accent Furniture | Chandeliers | Clocks | Decorative Accessories | Fixtures | Floor Lamps | Headboards | Lighting | Mirrors | Outdoor/Casual Furniture | Table Lamps | Upholstered Beds | Wall Art | Wall Decor,,,"Artful and unique, Luna Bella continues to manufacture in the U.S.A. by hand. Since 1996, designer/owner Teresa Costa has established a reputation, creating singular designs mixing classical and artful."
Las Vegas Market - Summer,08/22/2021,2021,https://www.lasvegasmarket.com/,DM,Sagebrook Home,"A427,A429,H324","Building A,Building A,Market Square Suites",http://www.SagebrookHome.com,brianna@sagebh.com,(323) 720-8881,(323) 720-8868,California - CA 6315 Bandini Blvd Commerce,United States,"Baskets | Benches | Candles and Holders | Chairs, Accent | Consoles | Decorative Accessories | Floor Lamps | Mirrors | Pottery & Ceramics | Table Lamps | Tables, Accent | Vases",,,"Sagebrook Home, was founded as a way to bring something new and fresh into the home decor market. In only five years, our brand has led the industry with design creativity, featuring emerging and global trends, and manufacturing over 10,000 + unique and innovative collections with exceptional quality and value. 

Featuring flexible B2B buying options that range from ordering direct containers to full truckloads. Case pack ordering and individual decor items for immediate delivery all over the world.
 
Using state-of-the-art technology, Sagebrook Home has quickly become a leader in ecommerce fulfillment and excels at providing drop ship capabilities, and international logistics solutions. Celebrating a milestone for delivering to trade businesses in every single US state and with distribution to 60 countries around the world. 

Sagebrook Home’s customers consist of Brick & Mortar Retailers and Etailers, National online brands, Gift Stores and Boutiques, Real Estate Agents and Stagers. Featuring both a Designer Trade Program and a Hospitality Division."
Las Vegas Market - Summer,08/22/2021,2021,https://www.lasvegasmarket.com/,DM,Martin Svensson Home,"A700,H721","Building A,Market Square Suites",https://mshome.co/,joe.flores@mshome.co,(323) 582-0711,(323) 589-5507,California - CA 5705 Alcoa Ave Los Angeles,United States,Headboards | Mirrors | Upholstered Beds | Wall Decor,,,"Sandberg Family has been in the furniture business since 1918. We import Furniture with Quality, Style and Value for the everyday Consumer."
Las Vegas Market - Summer,08/22/2021,2021,https://www.lasvegasmarket.com/,DM,BEDGEAR Performance Bedding,"B1100,S1-500,S1-601","Building B,Market Square Suites,Market Square Suites",http://www.bedgear.com,wkeaten@bedgear.com,(631) 414-7758,(631) 414-7766,"New York - NY 110 Bi-County Blvd, Suite #101 Farmingdale",United States,"Adjustable Beds | Blankets & Throws | Home Textiles | Linens & Bedding | Mattress Accessories | Mattress, Juvenile | Mattresses | Mattresses | Pillows",,,"BEDGEAR® is the fast-growth global lifestyle brand of PERFORMANCE® bedding for people who want to achieve more. An innovator of the industry, BEDGEAR has changed the way people buy pillows, mattresses and more, with personalized products and patented fabric technologies. Having introduced personalized fit pillows to the world in 2011, BEDGEAR recently expanded into the mattress category to provide consumers with 100% of their sleep comfort with the only Performance® Sleep System. Visit BEDGEAR to experience interactive in-store displays, an omnichannel retail approach and our unique sales process. Only boring retail is dead — let us show you how to engage today’s millennial and active lifestyle customers. Sleep Fuels Everything®!"
Las Vegas Market - Summer,08/22/2021,2021,https://www.lasvegasmarket.com/,DM,Lagoon,"C1268,M-1043","Building C,Market Square Suites",http://www.lagoonconcept.com,delhi@lagoonconceptstore.com,(619) 267-0345,(619) 267-0348,California - CA 4689 Convoy St San Diego,United States,"Chairs, Dining | Chairs, Upholstered | Home Textiles | Outdoor/Casual Furniture | Pillows | Upholstery",,,Mytek has been in San Diego for over 20 years. We have large factory facility in Mexico and our furniture products are made in Mexico with brand name Lagoon.
Las Vegas Market - Summer,08/22/2021,2021,https://www.lasvegasmarket.com/,DM,Alder & Tweed Furniture,"B158,1BC,1C,1F","Building B,Market Square Suites,Market Square Suites,Market Square Suites",http://www.alderandtweedfurniture.com,ryan@alderandtweedfurniture.com,(801) 384-1243,,Utah - UT 6440 North Business Park Loop Rd # M Park City,United States,,,,"Our curated designs make high-end style available to everyone. We pay attention to the latest trends and every last detail, because success is in the details. Only high quality materials are selected to create our impressive yet affordable products."
