ShowName,ShowDate,ShowYear,ShowWebsite,SubmittedBy,ExhibitorName,BoothNumber,HallLocation,Website,Email,Phone,Fax,Address,Country,Categories,Manufacturers,Brands,Description
Las Vegas Market - Summer,08/22/2021,2021,https://www.lasvegasmarket.com/,DM,Alexander Taron,C995,Building C,http://www.taroncollection.com,ataron@taroncollection.com,(805) 650-8615,(805) 650-7811,California - CA 1834 Palma Dr Ste K Ventura,United States,Antique/Vintage | Candles and Holders | Clocks | Decorative Accessories | Decorative Tabletop | Holiday/Seasonal | Ornaments | Tabletop,,,"Alexander Taron has been importing traditional European gifts and decorations since 1949. The Taron Company is a parent company that oversees and imports from multiple manufacturers including Christian Ulbricht, Josef Engstler, Richard Glasser and more. Our products include the highest of quality German nutcrackers, smokers, cuckoo clocks, snow globes, Christmas pyramids, and much more."
Las Vegas Market - Summer,08/22/2021,2021,https://www.lasvegasmarket.com/,DM,Linon Home Decor,A753,Building A,http://www.linon.com,info@linon.com,516-699-1000,(516) 280-6418,New York - NY 22 Jericho Turnpike S-200 Mineola,United States,"Accent Furniture | Armoires | Bar Furniture | Benches | Bookcases | Chairs, Upholstered | Headboards | Ready to Assemble | Rug / Floor Coverings | Sofas | Upholstery",,,"LINON HOME DÉCOR PRODUCTS has established a reputation in the market for providing the best trend-right products at the right price, while offering excellent quality, style and functional furnishing to every room in the home."
Las Vegas Market - Summer,08/22/2021,2021,https://www.lasvegasmarket.com/,DM,E.S. Kluft & Company,"C1501,C1562","Building C,Building C",http://www.MarshallMattress.com,sonja.tolmack@eskluft.com,(909) 373-4211,(909) 373-4212,California - CA 11096 Jersey Blvd Ste 101 Rancho Cucamonga,United States,Mattresses | Mattresses,,,"Based in Rancho Cucamonga, California, E.S. Kluft & Company’s two brands are Aireloom and Kluft. Kluft is its most premium brand available through Bloomingdale’s and other prestigious retailers. Aireloom® is celebrating its 80th anniversary in 2020 and offers artisanal quality and legacy features such as hand-tied coils and hand side-stitching in the best-in-class category. These quality designs feature cutting edge, patented production methods. 
                                                                                                           
E.S. Kluft & Company is owned by The Flex Group from Madrid, Spain. Founded in 1912, The Flex Group is the world’s top 10 global sleep products producer. It commands market leadership positions in Spain, Portugal, Brazil, Chile, the United Kingdom, Canada, and the United States."
Las Vegas Market - Summer,08/22/2021,2021,https://www.lasvegasmarket.com/,DM,"Transpac, Everyday is a Holiday",C664,Building C,http://www.shoptii.com,info@shoptii.com,(707) 452-0600,(707) 452-0800,California - CA 1050 Aviator Drive Vacaville,United States,Accent Furniture | Clocks | Decorative Accessories | Fashion Accessories/Jewelry | Holiday/Seasonal | Outdoor/Casual Furniture | Serveware | Tabletop | Wall Decor,,,"Celebrate 25 years of memories and success with Transpac!
In 1995, Transpac began as a small company selling floral designs. Over two decades later, it has become a premier provider of gifts, home décor, garden accents and seasonal decor and gifts.
Stop by our showroom to see creative new designs for Holiday 2020 and join our celebration!"
Las Vegas Market - Summer,08/22/2021,2021,https://www.lasvegasmarket.com/,DM,BODRUM,C101,Building C,http://www.bodrumlinens.com,info@bodrumlinens.com,(212) 524-2505,(212) 524-2509,"New York - NY 119 W 23rd St, Suite 704 New York",United States,Home Textiles | Housewares | Kitchen Textiles | Table Linens,,,High end table linens at affordable prices
Las Vegas Market - Summer,08/22/2021,2021,https://www.lasvegasmarket.com/,DM,Eric Silva Design,E-1307,The EXPO at World Market Center,,,,,California - CA 14407 Tedford Dr Whittier,United States,,,,
Las Vegas Market - Summer,08/22/2021,2021,https://www.lasvegasmarket.com/,DM,CorLiving Distribution,A547,Building A,http://www.corliving.com,dtoth@corliving.com,(604) 542-7650,(604) 542-7651,British Columbia - BC 2252 190th Street Surrey,Canada,Accent Furniture | Fashion Accessories/Jewelry | Hammocks | Mattresses | Outdoor/Casual Furniture | Ready to Assemble | Tabletop | Upholstery,,,"Our products are designed, developed and manufactured with this thoughtful consideration and we pride ourselves in offering you, our customer, a unparalleled customer service experience."
Las Vegas Market - Summer,08/22/2021,2021,https://www.lasvegasmarket.com/,DM,Hester & Cook,C107,Building C,http://wholesale.hesterandcook.com,ginny@hesterandcook.com,(615) 736-2892,(615) 250-4995,"Tennessee - TN 2728 Eugenia Ave, Suite 106 Nashville",United States,Bar Accessories | Chandeliers | Decorative Tabletop | Greeting Cards | Home Textiles | Housewares | Lighting | Serveware | Stationery/Paper Goods | Table Linens | Tabletop,,,"At Hester & Cook, we believe that quality comes first. All of our items are designed right here in the USA. Our product categories include Kitchen Papers, Stationery and & Lighting."
Las Vegas Market - Summer,08/22/2021,2021,https://www.lasvegasmarket.com/,DM,MEPRA,C163,Building C,http://www.mepra.it,mepra@mepra.it,39-0-308921441,39-0-308925075,Via Montini 176 Lumezzane,Italy,Antique/Vintage | Baskets | Cookware & Bakeware | Decorative Accessories | Flatware | Housewares | Serveware | Tabletop,,,"MEPRA, leading Italian manufacturer of professional and unique table top products, is a family owned factory, founded in 1947 by the Prandelli family in Lumezzane, near the Italian Alps, where the manufacturing plant is still located.
At MEPRA we strongly believe everyone is different. In Everything we do, our goal is to offer our partners the chance to distinguish themselves. 
Through our history, our craftsmanship and our technology, thanks to our creativity and flexibility, we produce unique and customized professional tools for your culinary art."
Las Vegas Market - Summer,08/22/2021,2021,https://www.lasvegasmarket.com/,DM,Diamond Mattress,B950,Building B,https://www.diamondmattress.com,p.wolf@diamondmattress.com,(310) 638-0363,(310) 638-2005,California - CA 3112 E. Las Hermanas St Rancho Dominguez,United States,Adjustable Beds | Adjustable Beds | Box Springs & Foundations | Home Textiles | Linens & Bedding | Mattress Accessories | Mattresses | Mattresses | Pillows | Wellness Accessories,,,"Diamond Mattress is a 4th generation family-owned and operated company. Integrity is the foundation of all that we do. For 80 years we've been a trusted creator of sleep wellness products. We've kept true to our roots and continue to produce high-quality products at a great value. 
We believe that sleep has the power to change lives. A restful nights sleep leads to higher fulfillment and a deeper connection to the beauty of life. More than just making mattresses we are creating happier lives by perfecting the art of sleep wellness."
Las Vegas Market - Summer,08/22/2021,2021,https://www.lasvegasmarket.com/,DM,Mary Hada,E-507,The EXPO at World Market Center,,,(415) 552-8720,(877) 464-1109,California - CA 680 8th St. #161 San Francisco,United States,Fashion Accessories/Jewelry | Stationery/Paper Goods,,,
Las Vegas Market - Summer,08/22/2021,2021,https://www.lasvegasmarket.com/,DM,Windrift Hill Goat Milk Soaps & Bodycare,C1112W,Building C,http://www.windrifthill.com,info@windrifthill.com,(406) 278-5872,(406) 278-9187,Montana - MT PO Box 592 Conrad,United States,Body & Bath Products | Holiday/Seasonal | Personal Care / Spa | Wellness Accessories,,,"With the Rocky Mountain Front as our beautiful backdrop, Windrift Hill raises about 40 Nubian goats that are hand-milked twice daily. The kids are bottled to ensure their health and attachment to us. We raise our own dairy goats to guarantee that the milk being used in our products is the highest quality and fresh from our farm. 
Goat Milk hydrates and restores balance to the skin, leaving it soft and supple, not tight and thirsty like commercial products. Our family works hard making all of the Windrift Hill goat milk products. So treat your skin to the best products it has ever experienced. 
Think of using our soaps, lotions and butters as a little slice of Montana's wholesome family goodness - from our family (goats included) to yours. Enjoy!"
Las Vegas Market - Summer,08/22/2021,2021,https://www.lasvegasmarket.com/,DM,ABBIAMO TUTTO,C109,Building C,http://www.e-abbiamotutto.com,donna@e-abbiamotutto.com,(703) 790-0172,,Virginia - VA PO Box 6624 McLean,United States,Bar Accessories | Decorative Accessories | Decorative Tabletop | Holiday/Seasonal | Housewares | Kitchen Textiles | Pottery & Ceramics | Serveware | Tabletop | Vases | Wall Decor,,,"Abbiamo tutto, (meaning, we have all, in Italian) is devoted to designing and importing Italian artistry in ceramics and kitchen towels. Each treasure is created entirely in Italy using traditional methods of manufacturing and craftsmanship. Designed in America but made in bella Italia!"
Las Vegas Market - Summer,08/22/2021,2021,https://www.lasvegasmarket.com/,DM,Specialty Sleep Association,C1565,Building C,http://www.sleepinformation.org,ssadirector2013@gmail.com,(559) 868-4187,,California - CA PO Box 432 Friant,United States,"Adjustable Beds | Adjustable Beds | Futons | Headboards | Mattress, Juvenile | Mattresses | Mattresses | Wall Beds",,,Our showroom in LAS VEGAS in Building C1565 is a co-op venue for manufacturers and distributors introducing product to retail bedding stores/departments. Our showroom is always one of the busiest in Las Vegas during the Furniture Market. Background
Las Vegas Market - Summer,08/22/2021,2021,https://www.lasvegasmarket.com/,DM,"Baltica Natural Products, LLC",C1565,Building C,http://www.balticanatural.com/,plaurens@balticanatural.com,(917) 828-1919,,New York - NY 45 Rockefeller Plaza Suite 2000 New York,United States,"Box Springs & Foundations | Mattress Accessories | Mattress, Juvenile | Mattresses | Mattresses | Upholstery",,,"We promote only the finest quality natural and organic products from Europe. With Arcus Medius, our European export partners, we are now marketing Arcusbeds luxury mattresses--supremely comfortable, robust and affordable, handmade of certified organic materials--to discerning customers in North America."
Las Vegas Market - Summer,08/22/2021,2021,https://www.lasvegasmarket.com/,DM,Reverie,B949,Building B,http://www.reverie.com,john.wanat@reverie.com,7164678367,(248) 409-5657,Michigan - MI 2066 Franklin Rd Bloomfield Hills,United States,Adjustable Beds | Adjustable Beds | Mattresses | Mattresses | Ready to Assemble | Upholstered Beds,,,"Reverie is a revolutionary sleep technology company dedicated to helping people sleep better so they can live better lives. 

Rooted in its mastery of sleep science, Reverie believes everybody is unique and needs customized sleep solutions that fit their individual needs. 

As a result, the company has become known for its award-winning adjustable bases. 

For more information visit B-925 or reverie.com"
Las Vegas Market - Summer,08/22/2021,2021,https://www.lasvegasmarket.com/,DM,The Futon Shop / TFS Sleep,C1565,Building C,http://www.tfsleep.com,suzylucy@gmail.com,(415) 920-6806,,California - CA 2150 Cesar Chavez San Francisco,United States,"Daybeds | Futons | Home Textiles | Mattress Accessories | Mattress, Juvenile | Mattresses | Mattresses | Pillows | Sofas | Upholstery",,,"Handmade mattresses, toppers, futons & pillows in the USA with GOLS GOTS & USDA certified organic ingredients. The most affordable, and comfortable lineup of organic based mattresses ever made at prices that canaEt be beat. Container, Stock Warehous"
Las Vegas Market - Summer,08/22/2021,2021,https://www.lasvegasmarket.com/,DM,Elite Home Theater Seating,A238,Building A,https://www.elitehts.com,bobby@elitehts.com,(604) 575-8310,(604) 575-8329,British Columbia - BC Unit 406 - 17665 66A Ave Surrey,Canada,"Chairs, Upholstered | Chaise Lounges | Entertainment Centers | Home Theater Furniture | Sofas | Upholstery",,,Manufacturer Specializing in Custom Home Theater Seating for Residential and Commercial Applications.
Las Vegas Market - Summer,08/22/2021,2021,https://www.lasvegasmarket.com/,DM,Magniflex,C1532,Building C,http://www.magniflex.com,sales@magniflex.us,(786) 233-8805,(786) 221-1800,Florida - FL 3050 Biscayne Blvd. #200 Miami,United States,Adjustable Beds | Adjustable Beds | Mattress Accessories | Mattresses | Mattresses | Pillows,,,"Magniflex is at the forefront of responsible mattress manufacturing, using proprietary materials and technologies to offer healthy sleep to over 50 million people every night."
Las Vegas Market - Summer,08/22/2021,2021,https://www.lasvegasmarket.com/,DM,"Willow Creek Press, Inc.",C865,Building C,http://www.wcpretail.com,lmatis@willowcreekpress.com,(800) 850-9453,(715) 358-2807,Wisconsin - WI 9931 Highway 70 West P.O. Box 147 Minocqua,United States,Books & Publications | Calendars & Planners | Stationery/Paper Goods,,,"Willow Creek Press is an award-winning publisher of high-quality calendars, gift books and jigsaw puzzles."
Las Vegas Market - Summer,08/22/2021,2021,https://www.lasvegasmarket.com/,DM,Paragon,"B301,C203","Building B,Market Square Suites",http://www.paragonpg.com,lglassco@paragonpg.com,(256) 593-4700,(256) 593-4773,"Alabama - AL 195 Paragon Dr, PO Box 1187 Albertville",United States,Clocks | Decorative Accessories | Lighting | Mirrors | Table Lamps | Wall Art | Wall Decor,,,"Paragon of Albertville, AL, is a leading supplier of framed wall decor. Paragon's products are sold through leading home furnishings retailers and interior designers throughout the United States. Paragon is a six-time ARTS Award winner and ARTS Hall of Fame inductee. Paragon features a diverse product line with 2,000 skus and includes framed art, as well as mirrors, canvases, decorative plaques, wrought iron, shadow boxes and outdoor art. Paragon also features The Studio which includes high end exclusive hand painted art and lamps. After more than 40 years in business, Paragon has built an expert team that truly understands the subtleties, complexities and challenges of selling wall decor at retail. Paragon's vast selection of expertly designed wall decor gives customers just the right look, image and price point. Superior product, great customer service and open, honest communication at all levels are the cornerstones of Paragon.

Paragon features a diverse product line of framed art, canvases, mirrors and exclusive hand painted art."
Las Vegas Market - Summer,08/22/2021,2021,https://www.lasvegasmarket.com/,DM,Northern Lights,C1003,Building C,https://northernlightswholesale.com,Tori@northernlightscandles.com,(585) 593-1200,(585) 593-6481,New York - NY 3474 Andover Road Wellsville,United States,Candles and Holders | Decorative Tabletop | Fragrances,,,"We're celebrating 41 years of brightening the world and beautifying homes with the warmth of candlelight.  Our strong roots in the ""art of candle making"" have earned us a reputation as a leading designer of luxury candles and artisan-made accessories. Our candles are hand poured in New York using fine fragrances that include essential oils and natural based waxes like soy, coconut and beeswax.  Through careful engineering of quality components, our artisan-made candles maintain a clean burn and superior fragrance throw."
Las Vegas Market - Summer,08/22/2021,2021,https://www.lasvegasmarket.com/,DM,Palladium Inc.,C1126,Building C,http://www.palladiumincjewelry.com,greta@palladiumincjewelry.com,(503) 452-1011,,Oregon - OR PO Box 80486 Portland,United States,"Apothecary | Body & Bath Products | Cosmetics, Perfumes | Costume Jewelry | Decorative Tabletop | Fashion Accessories/Jewelry | Fine Jewelry",,,"Palladium Inc is a sales representation company focusing on artisans who create handmade jewelry exclusively. Materials used include sterling silver, resin, handblown glass, gemstones, crystals, textiles and gold. Product development available."
Las Vegas Market - Summer,08/22/2021,2021,https://www.lasvegasmarket.com/,DM,Sea Stones Inc.,C1106,Building C,"http://www.sea-stones.com, http://www.americanmadecollective.com",anne@sea-stones.com,(206) 202-1092,(206) 203-4347,New Hampshire - NH 16 Washington Road Windham,United States,Bar Accessories | Decorative Accessories | Glassware | Outdoor/Casual Furniture | Serveware | Stemware | Tabletop | Wall Decor,,,"The collection of Wine Bottle Stoppers, Stone Stemmed Wine Glasses, Coast Hooks, Cabinet Pulls and barware brings natures small masterpieces into the home, blending eye-catching stones, hardwood, natural granite, stainless steel and aluminum."
Las Vegas Market - Summer,08/22/2021,2021,https://www.lasvegasmarket.com/,DM,XSENSOR Technology Corporation,C1579,Building C,http://www.revealbyxsensor.com,bruce.malkinson@xsensor.com,(403) 266-6612,(403) 205-4013,Alberta - AB 133 12 Ave SE Calgary,Canada,Mattresses,,,"The REVEAL Mattress Recommendation System increases operational income with pressure imaging technology, providing a personalized customer experience that finds the right mattress for your customer's unique body needs."
Las Vegas Market - Summer,08/22/2021,2021,https://www.lasvegasmarket.com/,DM,Primitive Collections,"B128,D440","Building B,Market Square Suites",https://www.primitivecollections.com/,Marketing.Primitive@gmail.com,(805) 604-5840,,"California - CA 3151 W 5th, Ste B Oxnard",United States,"Accent Furniture | Antique & Reproduction Furniture | Chairs, Accent | Consoles | Decorative Accessories | Home Office | Tables, Accent | Upholstery",,,"WE GO TO GREAT LENGTHS TO HAND SELECT THE MOST BEAUTIFUL AND UNIQUE WOOD, IRON AND OTHER MATERIALS FROM AGED BARNS, AND OTHER OLD STRUCTURES BEFORE WE TURN THEM INTO ONE-OF-A-KIND ACCENTS FOR YOUR HOME, RESTAURANT, BUSINESS, OR OFFICE BUILDING.

RECLAIMED WOOD FURNITURE IS NOT ONLY BEAUTIFUL BUT HAS MANY MORE ADVANTAGES THAT ARE OFTEN OVERLOOKED.  THE MAIN REASONS PEOPLE LIKE THIS STYLE OF FURNITURE IS THAT THEY ARE LOOKING FOR A UNIQUE, NATURAL, RUSTIC LOOK OR A VINTAGE, INDUSTRIAL FEEL. SOMETIMES PEOPLE ARE JUST MAKING A WISE CHOICE FOR THE ENVIRONMENT BY CHOOSING A PRODUCT FOR THEIR HOME THAT DOES NOT CONTRIBUTE TO DEFORESTATION."
Las Vegas Market - Summer,08/22/2021,2021,https://www.lasvegasmarket.com/,DM,Cohasset Gifts & Garden,C838,Building C,http://www.cohassetgifts.com,diane@cohassetgifts.com,(253) 565-1144,(253) 564-0474,Washington - WA 9623 32nd Ave Court S Lakewood,United States,"Decorative Accessories | Outdoor/Casual Furniture | Statuary, Pottery & Planters | Vases",,,Cohasset Gifts & Garden designs and manufactures garden and home décor gift items. Our wooden wind chimes are designed for a more N. American patio/porch or to decorate within the home. Our Molten Glass Sculptures are truly a one of a kind art piece
Las Vegas Market - Summer,08/22/2021,2021,https://www.lasvegasmarket.com/,DM,Pacific Merchants Trading Company,C1112R,Building C,http://www.pacificmerchants.com,bruce@pacificmerchants.com,(818) 988-8999,(818) 988-6999,"California - CA 149 S. Barrington Avenue, #507 Los Angeles",United States,appliances/cooking equipment | Housewares | Outdoor/Casual Furniture | Serveware | Tabletop,,,"Pacific Merchants is the leading wholesaler of Acaciaware™ high quality wooden serveware, designer &restaurant-quality placemats, hand-crafted French Wood utensils, and aromatic natural soy candles."
Las Vegas Market - Summer,08/22/2021,2021,https://www.lasvegasmarket.com/,DM,"Import Collection, The",A454,Building A,http://www.importcollection.com,Bryan@ImportCollection.com,(818) 782-3060,(818) 779-4963,California - CA 7885 Nelson Rd Panorama City,United States,Accent Furniture | Candles and Holders | Clocks | Decorative Accessories | Lighting | Mirrors | Picture Frames & Custom Framing | Pottery & Ceramics | Table Lamps | Wall Art | Wall Decor,,,"Import Collection has been in business for more than 40 years; providing quality home accessories, lighting, and wall decor that range from the timeless classics to the fashion forward."
Las Vegas Market - Summer,08/22/2021,2021,https://www.lasvegasmarket.com/,DM,nora fleming,C185,Building C,http://www.norafleming.com,janice@norafleming.com,(630) 231-2500,(630) 231-5031,Illinois - IL 3 Grant Square #104 Hinsdale,United States,Decorative Tabletop | Serveware,,,"the nora fleming collection pairs traditional serving platters and home décor pieces with unique, decorative inserts, ""minis"", that represent holidays and themes. each stoneware, melamine, or walnut piece has a small hole on the rim to place a ""mini"" that enhances the event or occasion. nora fleming's unmatched, distinctive collection also includes over 80 minis which cover seasons, sports, hobbies, and holidays."
Las Vegas Market - Summer,08/22/2021,2021,https://www.lasvegasmarket.com/,DM,"Wooded River, Inc.",A347,Building A,http://www.woodedriver.com,jill@firesidelodgefurniture.com,(208) 468-0297,(208) 442-5226,Idaho - ID 3521 Arthur Street Caldwell,United States,Blankets & Throws | Headboards | Home Textiles | Linens & Bedding | Sofas | Upholstered Beds | Upholstery | Window Treatments,,,"Wooded River is your premier source for lodge, western, and southwestern bedding, upholstered headboards, and upholstered furniture. From rustic elegance to more transitional looks, Wooded River can help to create an inspired design. Made in the USA."
Las Vegas Market - Summer,08/22/2021,2021,https://www.lasvegasmarket.com/,DM,"Honey and Me, Inc.",C739,Building C,http://www.honeyandme.com,lliffick@honeyandme.com,(877) 837-8838,(317) 300-8769,Indiana - IN 2908 N Graham Rd Franklin,United States,Accent Furniture | Antique/Vintage | Baskets | Decorative Accessories | Fashion Accessories/Jewelry | Floral & Foliage | Handbags | Holiday/Seasonal | Home Textiles | Housewares | Kitchen Textiles | Picture Frames & Custom Framing | Pillows | Pottery & Ceramics,,,"Everyday & Seasonal Home Decor, Including Country, Primitive and Rustic Chic"
Las Vegas Market - Summer,08/22/2021,2021,https://www.lasvegasmarket.com/,DM,METcolors,C352,Building C,http://www.metcolors.com,info@metcolors.com,(405) 606-7878,(405) 606-7888,Oklahoma - OK 3601 S. Moulton Drive Oklahoma City,United States,Pillows | Tapestries | Wall Art,,,"Wall Decor & Pillows Wholesaler, Manufacturer & Artist Licensing"
Las Vegas Market - Summer,08/22/2021,2021,https://www.lasvegasmarket.com/,DM,Harvest Green Mattress and Fusion Blue,A950,Building A,https://www.harvestgreenmattress.com/,Sales@harvestgreenmattress.com,1-773-893-4675,(773) 927-8886,Illinois - IL 3535 W. 47th Street Chicago,United States,Box Springs & Foundations | Mattress Accessories | Mattresses,,,"Harvest Green Mattresses were designed and are handmade in Chicagoland in one of the Midwest's largest Mattress Factories. At Harvest Green Mattress we are proud to say that all of our mattresses are constructed using only organic, natural, non-toxic raw materials. Our business model represents a process that is good for our customers and the planet. We don't compromise on our standards. Our reason why? You. We want to provide the highest quality in the most sustainable way in everything we do so we can offer pure products our Customers can trust."
Las Vegas Market - Summer,08/22/2021,2021,https://www.lasvegasmarket.com/,DM,Saro,C499,Building C,http://www.saro.com,admin@saro.com,(818) 846-3314,(818) 846-3327,California - CA 3333 West Pacific Avenue Burbank,United States,"Blankets & Throws | Botanicals | Christmas | Decorative Tabletop | Fashion Accessories/Jewelry | Flatware | Handbags | Hats, Scarves & Gloves | Holiday/Seasonal | Home Textiles | Pillows | Serveware | Table Linens | Tabletop | Wall Art",,,"SARO focuses on sophisticated and affordable home décor products with traditional and contemporary designs in a wide range of categories ranging from table linens to accent pillows and throws, satisfying a lifestyle of interior decorative design."
Las Vegas Market - Summer,08/22/2021,2021,https://www.lasvegasmarket.com/,DM,Primeware,C982,Building C,http://www.primewareinc.com,tony@primewareinc.com,(714) 556-1588,(800) 603-3196,California - CA 17331 Newhope Street Fountain Valley,United States,Bar Accessories | Baskets | Blankets & Throws | Decorative Accessories | Fashion Accessories/Jewelry | Handbags | Holiday/Seasonal | Home Textiles | Housewares | Personal Care / Spa | Tabletop | Wellness Accessories,,,"Innovative, fun, fashionable and functional wine purses, clutches and Accessories for the wine and travels enthusiast."
Las Vegas Market - Summer,08/22/2021,2021,https://www.lasvegasmarket.com/,DM,Handy Living,A614,Building A,http://www.handyliving.com,bfarris@handyliving.com,(847) 229-8800,(847) 459-0902,Illinois - IL 29 E. Hintz Rd Wheeling,United States,Accent Furniture | Outdoor/Casual Furniture | Ready to Assemble | Upholstery,,,Handy Living believes your sense of style should not be dictated by the size of your living space. So we design our furniture specifically for the way people live today.
