ShowName,ShowDate,ShowYear,ShowWebsite,SubmittedBy,ExhibitorName,BoothNumber,HallLocation,Website,Email,Phone,Fax,Address,Country,Categories,Manufacturers,Brands,Description
Las Vegas Market - Summer,08/22/2021,2021,https://www.lasvegasmarket.com/,DM,Coast to Coast Imports,"A316,C1103,H1142","Building A,Market Square Suites,Market Square Suites",http://www.coasttocoastaccents.com,mmarsh@ctoconline.com,(901) 946-8990,(901) 946-8997,Tennessee - TN P.O. Box 2157 Memphis,United States,"Bar Furniture | Benches | Bookcases | Chairs, Dining | Consoles | Entertainment Centers | Kitchen Islands & Bar Carts | Sideboards & Buffets | Tables, Accent | Tables, Dining | Trunks | TV Consoles",,,"We put the accent on furniture! Whether you are looking for Traditional, Industrial or Modern - you will find all that and more. Featuring Quality products, value packed offerings and quick shipping."
Las Vegas Market - Summer,08/22/2021,2021,https://www.lasvegasmarket.com/,DM,Flexsteel Industries,"A529,A530,C558,C602A","Building A,Building A,Market Square Suites,Market Square Suites",http://www.flexsteel.com,bamurphy@flexsteel.com,(563) 585-8265,(563) 556-8345,Iowa - IA 385 Bell Street Dubuque,United States,"Bookcases | Chairs, Dining | Chairs, Upholstered | Chaise Lounges | Headboards | Upholstered Beds | Upholstery",,,"Strength on the inside. Lasting beauty on the outside. With more than 100 years of United States manufacturing experience, Flexsteel Industries, Inc. is committed to making wood and upholstered furniture that is built for life."
Las Vegas Market - Summer,08/22/2021,2021,https://www.lasvegasmarket.com/,DM,"International Furniture Direct, LLC","A826,C607","Building A,Market Square Suites",https://www.int-furndirect.com/,dianaz@int-furndirect.com,(602) 442-7177,(602) 442-7168,Texas - TX 22735 NW Lake Dr. Houston,United States,"Accent Furniture | Antique/Vintage | Benches | Bookcases | Dinettes | Entertainment Centers | Tables, Accent | Trunks",,,"IFD is a solid wood case-good furniture manufacturer with production plants in Guadalajara and Puebla, Mexico. Specializing in traditional craftsmanship and joinery with complete collections covering Bedroom, Dining, Entertainment, Bar and Occasional categories. Multiple domestic U.S. distribution centers/ warehouse locations strategically located in Atlanta, GA, Chicago, IL, Houston, TX and Phoenix, AZ offering LTL orders service the U.S mainland and Canada. IFD is a complete supply chain solution with dedicated and specialized staff covering logistics, imports, customer service, engineering and more for a seamless and hassle-free product.
Over the last eight years, our factories have become more vertically integrated by adding several automatic mills and ten Italian kiln dryers, being able to offer a variety of local wood species, keeping a unique, fresh and eco-oriented product line.
IFD environmental efforts include using mango wood from of dozens of acres of mango tree farms, turning the lumber into beautiful furniture pieces.  IFD is also currently running a company-funded reforestation private project launched since 2016 to lower deforestation impact. Hired local experts’ plant around 45,000 trees per year in company-owned land and will do so for at least the next 14 years.  This will allow for trees to be harvested in 8 years and every year after that. Tree species planted include Parota, Mahogany, Habillo, Rosewood, and Primavera."
Las Vegas Market - Summer,08/22/2021,2021,https://www.lasvegasmarket.com/,DM,Klaussner Home Furnishings,"A800,A801,100","Building A,Building A,Market Square Suites",http://www.klaussner.com,lburke@klaussner.com,(336) 625-6174,(336) 626-0905,North Carolina - NC 405 Lewallen Rd Asheboro,United States,Accent Furniture | Home Theater Furniture | Mattresses | Outdoor/Casual Furniture | Sofas | Upholstery,,,"From upholstery (fabric and leather), reclining furniture, bedroom, dining room, occasional tables, memory foam bedding and now our new Klaussner Outdoor line"
Las Vegas Market - Summer,08/22/2021,2021,https://www.lasvegasmarket.com/,DM,"England, Inc.","B555,S100","Building B,Market Square Suites",http://www.englandfurniture.com,terry.england@englandfurniture.com,(423) 626-5211,,Tennessee - TN 145 England Drive New Tazewell,United States,"Accent Furniture | Chairs, Accent | Chairs, Upholstered | Love seats | Ottomans & Poufs | Sectionals | Sofas | Upholstery",,,"Since 1964, England has been building quality upholstered furniture in the foothills of East Tennessee. From humble beginnings, England has grown to employ over 1,350 people in multiple factories in Tennessee and Virginia. England is a custom order upholstery manufacturer who provides delivery across North America in as few as 21 days. Because of this England attracted the attention of La-Z-Boy Inc. and in 1995 England was integrated into the La-Z-Boy family of companies."
Las Vegas Market - Summer,08/22/2021,2021,https://www.lasvegasmarket.com/,DM,American Made Collective,C1106,Building C,http://www.americanmadecollective.com/,anne@sea-stones.com,(206) 202-1092,(206) 203-4347,New Hampshire - NH 16 Washington Road Windham,United States,"Accent Furniture | Bar Accessories | Clocks | Decorative Accessories | Fashion Accessories/Jewelry | Pottery & Ceramics | Serveware | Tables, Accent | Tabletop | Vases | Wall Decor",,,"The American Made Collective is a group of makers that exhibit at some of the nations largest trade shows. From American made gifts to high-end home decor, we make buying American made easy. Shop 20+ US artists in Atlanta & Las Vegas."
Las Vegas Market - Summer,08/22/2021,2021,https://www.lasvegasmarket.com/,DM,Quilling Card,C1058,Building C,http://www.quillingcard.com,rafe@quillingcard.com,(508) 405-2888,,Massachusetts - MA 47 Mellen Street Framingham,United States,Greeting Cards | Holiday/Seasonal | Imprintable & Custom | Judaica | Notecards | Wall Art,,,"Quilling Card is the premier manufacturer and distributor of greeting cards, gifts and jewelry all handcrafted using the ancient art form of quilling. Fair Trade Federation Member."
Las Vegas Market - Summer,08/22/2021,2021,https://www.lasvegasmarket.com/,DM,Pacific Coast Lighting,"A301,H203","Building A,Market Square Suites",http://www.pacificcoastlighting.com,rsevilla@pacificcoastlighting.com,(800) 709-9004,(818) 886-5751,California - CA 20238 Plummer Street Chatsworth,United States,Floor Lamps | Lighting | Table Lamps,,,"Founded in 1979, Pacific Coast® Lighting is one of the nation's leading manufacturers of decorative lighting. Exclusive distributor of the kathy ireland® HOME Collection."
Las Vegas Market - Summer,08/22/2021,2021,https://www.lasvegasmarket.com/,DM,F.T. Renner Company,C777,Building C,http://www.ftrenner.com,sales@ftrenner.com,(831) 642-9000,(831) 642-9100,"California - CA 546 Hartnell Street, Suite D Monterey",United States,"Clocks | Decorative Accessories | Holiday/Seasonal | Mirrors | Outdoor/Casual Furniture | Picture Frames & Custom Framing | Statuary, Pottery & Planters | Wall Decor",,,The F.T. Renner Company specializes in handcrafted home and garden decor. All products are made from recycled or sustainable materials from around the world and in the United States.
Las Vegas Market - Summer,08/22/2021,2021,https://www.lasvegasmarket.com/,DM,Collective Home,C507,Building C,http://www.collectivehomereps.com,susan.thoen@collectivehomereps.com,(678) 215-4571,,"Nevada - NV 455 S. Grand Central Parkway, Suite C507 Las Vegas",United States,Antique/Vintage | Blankets & Throws | Body & Bath Products | Candles and Holders | Clocks | Decorative Accessories | Fashion Accessories/Jewelry | Flatware | Floral & Foliage | Glassware | Home Textiles | Linens & Bedding | Personal Care / Spa | Picture Frames & Custom Framing | Pottery & Ceramics | Stemware | Table Linens | Tabletop,,,"We represent some of the finest Vendors of Artisan quality products for your Home, Gift & Garden shops, and for the Design Trade. We cater to Retailers and provide Custom producs for Events, Weddings and Corporate Buyers. At your service!"
Las Vegas Market - Summer,08/22/2021,2021,https://www.lasvegasmarket.com/,DM,"Frieling USA, Inc.",C1155,Building C,http://www.frieling.com,Yul210@frieling.com,(803) 548-2000,(803) 548-2060,South Carolina - SC 398 York Southern Road Fort Mill,United States,Bar Accessories | Cookware & Bakeware | Housewares | Serveware | Tabletop,,,"Get the Frieling Feeling with our fresh solutions from around the World: Cookware, Coffee & Tea, Small Electrics, Gadgets, Food storage & Organization, Bakeware, Insulated Servers and so much more!"
Las Vegas Market - Summer,08/22/2021,2021,https://www.lasvegasmarket.com/,DM,"Sales Producers, Inc.",C1044,Building C,http://www.salesproducersinc.com,bonnieg@salesproducersinc.com,(800) 346-9613,(800) 750-0944,California - CA 860 South Los Angeles Street Suite 209 Los Angeles,United States,Childrens Apparel & Access. | Decorative Accessories | Fashion Accessories/Jewelry | Fine Jewelry | Holiday/Seasonal | Home Office | Home Textiles | Outdoor/Garden Gift | Outdoor/Patio accessories & décor | Personal Care / Spa | Pet | Souvenir / Novelties | Stationery/Paper Goods | Toys / Games / Plush | Youth & Baby Lifestyle & Gifts,,,"Proudly representing many premier, well-known and respected brands with a wide variety of products and categories including Paper & Stationery, Fashion Accessories, Home Decor, Baby & Kids, & Personal Care."
Las Vegas Market - Summer,08/22/2021,2021,https://www.lasvegasmarket.com/,DM,New Spec,B251-10,Building B,http://www.newspec.net/,newspec@aol.com,732-248-6300,(732) 248-6300,New Jersey - NJ 45 EXECUTIVE AVE EDISON,United States,"Bar Furniture | Chairs, Dining | Chairs, Upholstered | Sofas",,,"New Spec Inc., founded and headquartered in the United States with a purchasing office overseas, has always been a quality provider of KD furniture and cased goods. In business since 1990, we recently expanded to include ergonomic, chic, SOHO furniture for bedrooms, dining rooms, living rooms, or anywhere in your home. In addition, we provide many miscellaneous items as well. Our main goals are to provide unparalleled service to our distributors and customers, to develop close business relations with our clients, and to continue being innovators in the industry.
    Due to our broad spectrum of clientele, which encompasses retail and chain stores, wholesale distributors, and mail-order or internet-based companies, our company has grown, expanded, and transformed into a national wholesaler corporation with competitive prices. We continue to successfully maintain our status as a strong merchant with high-quality residential and commercial products that are manufactured by state of the art machines and molds.
    Since a quick delivery is our promise and commitment, all orders of our current inventory are shipped via UPS or common carrier from either our central New Jersey or southern California warehouse. Our own fleet, however, covers nearby metropolitan areas. Furthermore, we also offer an FOB container load package and a drop-ship program.
    As always, New Spec Inc. strives to deliver on high expectations each and every time. We have achieved our goals and are proudly serving our customers who look to us for great quality and incredible service."
Las Vegas Market - Summer,08/22/2021,2021,https://www.lasvegasmarket.com/,DM,Sweet Shop USA,C1125,Building C,http://www.sweetshopusa.com,mandy@sweetshopusa.com,(800) 222-2269,(903) 575-0050,Texas - TX 1316 Industrial Rd. Mt. Pleasant,United States,Gourmet Food & Beverages | Holiday/Seasonal | Housewares,,,"Sweet Shop USA has received national recognition for creating over 100 varieties of handmade pieces including various Truffles, Famous Brags®, Nuts and Chewies, and our signature Fudge Love®.  All-natural handmade products are distributed to approximately 7000 retailers nationwide, including gourmet, gift, coffee, floral, and specialty retailers as well as major department stores.  Branded Collections include Sweet Shop USA label, Mrs. Weinstein’s Gourmet Toffee, Price’s Fine Chocolates, and  Big Little Fudge. Price’s Fine Chocolates was founded in Kansas City, Missouri in 1919 and was known for its most popular creation: Annaclair’s®."
Las Vegas Market - Summer,08/22/2021,2021,https://www.lasvegasmarket.com/,DM,Lite Source Inc.,A310,Building A,http://www.lite-source.com,tony@lite-source.com,(909) 597-8892,(909) 393-4161,California - CA 4980 Eucalyptus Avenue Chino,United States,Chandeliers | Fixtures | Floor Lamps | Lampshades | Lighting | Outdoor Lighting | Table Lamps | Track Lighting | Wall Sconces,,,"Industry leading supplier of fashion forward lighting products designed for today's modern lifestyle at value prices! Products include table, floor, arch, LED lamps, chandeliers, pendants, vanity & sconces. We're your modern light source!"
Las Vegas Market - Summer,08/22/2021,2021,https://www.lasvegasmarket.com/,DM,"Honey House Naturals, Inc.",E-438,The EXPO at World Market Center,http://www.honeyhousenaturals.com,Tradeshow@Honeyhousenaturals.com,253-926-8193,(253) 922-6762,Washington - WA PO Box 1348 Milton,United States,aromatherapy | Body & Bath Products | General Gift | Personal Care / Spa,,,"Honey House Naturals products contain the highest quality ingredients from the best sources. They are filled with nutrient-rich Shea, Jojoba, Kukui Nut Oil, Beeswax, and Honey. Our biodegradable products do not contain petroleum, parabens, or artificial colors and have not been tested on animals. Experience the most remarkable natural products you have ever used.  Created in the Pacific Northwest, all Honey House Naturals products are manufactured in Washington State. Our natural lotions, creams, lip butters, foot bars, beard care, and soaps are created to nourish and heal. These products represent our core values of integrity, purity and beauty. Our Signature product is the Bee Bar solid lotion, which contains a unique blend of natural oils and emollients to moisturize and relieve chronically dry skin on hands, elbows and feet. Beeswax acts as a natural barrier to seal in the emollients allowing several hand-washings before reapplication. All Honey House Naturals products combine practicality with beauty for a truly unique experience."
Las Vegas Market - Summer,08/22/2021,2021,https://www.lasvegasmarket.com/,DM,Foster's Point,"A340,D441","Building A,Market Square Suites",http://www.fosterspoint.com,dfoster@fosterspoint.com,(281) 353-6696,,Texas - TX 23810 FM 2978 Tomball,United States,Decorative Accessories | Floral & Foliage,,,"Luxury Faux Florals, Custom Centerpieces and Faux Plants"
Las Vegas Market - Summer,08/22/2021,2021,https://www.lasvegasmarket.com/,DM,Rescued Wine,E-1312,The EXPO at World Market Center,http://www.rescuedwinecandles.com,info@rescuedwinecandles.com,(530) 587-7947,,California - CA 10607 W. River Street Suite 3A Truckee,United States,Apothecary | aromatherapy | Bar Accessories | Body & Bath Products | Candles and Holders | Decorative Accessories | Fragrances | General Gift | Holiday/Seasonal | Personal Care / Spa | Pet | Spa/Wellness | Wellness Accessories | Wine Products | Yoga Accessories,,,"Over the years, we have grown by sticking to our roots, quality, and care in everything we make. These beliefs ultimately guide us in producing a high-quality, one-of-a-kind candle with a greater purpose.

Our candles are not manufactured by the thousands in a factory but are hand-poured in small batches in our California studio using artisanal techniques.

GIVING BACK
Our mission is to give back to animal rescue groups and better our environment one recycled bottle at a time. In addition to bringing the finest quality candles into your home. 10% of our annual profits go towards animal rescue."
Las Vegas Market - Summer,08/22/2021,2021,https://www.lasvegasmarket.com/,DM,"Montana Woodworks, Inc.",B201-26,Building B,http://www.montanawoodworks.com,derrick@montanawoodworks.com,(406) 889-3728,(406) 889-3811,Montana - MT 76 Whitetail Dr Rexford,United States,"Accent Furniture | Armoires | Bar Furniture | Benches | Bookcases | Chairs, Dining | Daybeds | Dressers | Futons | Home Office | Nightstands | Outdoor/Casual Furniture | Tables, Accent | Tables, Dining | Trunks",,,"Montana Woodworks is the single largest, most trusted manufacturer of heirloom quality rustic furnishings in the U.S. Hand crafted in Montana using solid, U.S. grown wood. 20-Year Limited Warranty. 1500+ SKU's in three product collections."
Las Vegas Market - Summer,08/22/2021,2021,https://www.lasvegasmarket.com/,DM,Picture Depot,B349,Building B,http://www.picturedepot.com,ashkan@picturedepot.com,(416) 398-2333,(416) 398-2229,Ontario - ON 20 Toro Road Toronto,Canada,"Antique/Vintage | Clocks | Decor, Baby & Kids | Decorative Accessories | Mirrors | Picture Frames & Custom Framing | Rug / Floor Coverings | Wall Art | Wall Coverings | Wall Decor",,,"We deliver superior quality Wall Décor products and services to our customers through leadership, innovation and value."
Las Vegas Market - Summer,08/22/2021,2021,https://www.lasvegasmarket.com/,DM,CMA,C691,Building C,http://www.cmagifts.com,maggie@cmagifts.com,(800) 874-6716,(213) 452-7010,"Nevada - NV 455 S. Grand Central Parkway Building C, Showroom 691 Las Vegas",United States,Books & Publications | Calendars & Planners | Decorative Accessories | Greeting Cards | Handbags | Outdoor/Casual Furniture | Personal Care / Spa | Rug / Floor Coverings | Tabletop | Wall Decor,,,"CMA was founded in 1981 as a way to offer our valued customers a complete buying experience for all their fashion, gift, and home décor needs. 
Our Lines compliment unique styles, casual moods, and independent tastes. We understand the retail market is constantly evolving and we welcome changing trends as an opportunity to bring new and exciting products, as well as tried-and-true best sellers, to our retail customers. 
 Let CMA show you more than you imagined…"
Las Vegas Market - Summer,08/22/2021,2021,https://www.lasvegasmarket.com/,DM,Kendrick Inc,E-1807,The EXPO at World Market Center,https://www.kendrickhome.net/,cory@kendrickinc.com,5639286433,,Iowa - IA 200 N. Locust St. Edgewood,United States,"Collegiate | Decor, Baby & Kids | Decorative Signs | Decorative Tabletop | General Gift | Home Office | Kitchen Textiles | Ornaments | Pet | Tea Towels | Wall Art | Wall Coverings",,,"Kendrick Home is a family-owned and operated business that manufactures high-quality, hardwood signs in Edgewood, Iowa. All signs are made to order with our 2-week production turnaround time. The talented design staff stays on top of the latest trends and produces new designs weekly which are available wholesale at www.kendrickhome.net.
Quality is what sets Kendrick Home apart from any other wood sign manufacturer. Each piece is built from solid sustainably harvested North American hardwood, hand-painted, printed, and framed with a solid walnut frame."
Las Vegas Market - Summer,08/22/2021,2021,https://www.lasvegasmarket.com/,DM,Luin Living,E-1517,The EXPO at World Market Center,http://www.luinlivingusa.com,mmarotta@luxinliv.com,7206263127,,Pennsylvania - PA 303 W Lancaster Ave Ste 336 Wayne,United States,Baskets | Bath | Body & Bath Products | Candles and Holders | Childrens Apparel & Access. | Decorative Accessories | Fragrances | Home Textiles | Personal Care / Spa | Rug / Floor Coverings | Wellness Accessories | Yoga Accessories,,,"Out of the serene forests and lakes of Finland, our mission of bringing natural joy to
people’s lives was born. Luin Living is committed to bringing you home and lifestyle
products that delight you year after year. We are dedicated to ecological and
ethical practices throughout the entire product lifecycle, with a strong belief that
thoughtfully designed, sustainable products are what add indulgence to everyday
moments. We don’t believe in trends but rather collections and colors that are
never out of fashion, never out of season - collections that you can count to stay in
the market for seasons to come. Recently expanding into the US, we are looking
for Retail Partners who are ready to break the typical retail cycle and take a chance
on a fresh, new brand."
Las Vegas Market - Summer,08/22/2021,2021,https://www.lasvegasmarket.com/,DM,Scrub-Wow,E-812,The EXPO at World Market Center,http://www.scrub-wow.ca,info@scrub-wow.ca,(289) 771-2155,,Ontario - ON PO Box 1261 Sitrling,Canada,cleaning supplies,,,"Scrub-wow scrubbers are the most unique multi-purpose household scrubbers made with 100% cotton fibre. 
Long lasting, replacing over 20 synthetic scrubbers. you can use them to clean just about anything, in the kitchen, bath, car boats pool liners and so much more.
Oslo, you will find our new Euro-mop (patent pending), a floor cleaning toll like no other! Clean dust scrub & wipe all your floor surfaces with our new Euro-mop! Three in one floor cleaning tool!"
Las Vegas Market - Summer,08/22/2021,2021,https://www.lasvegasmarket.com/,DM,Flash Furniture,B1200,Building B,http://www.flashfurniture.com,angiecrane@flashfurniture.com,(770) 721-8391,(770) 721-8373,Georgia - GA 4350 Ball Ground Highway Canton,United States,"Accent Furniture | Chairs, Accent | Chairs, Dining | Chairs, Upholstered | Home Theater Furniture | Mattresses | Outdoor/Casual Furniture | Ready to Assemble | Sofas | Tables, Accent | Upholstery",,,"The Flash Furniture difference is price, selection and availability. Flash catalogs has over 7,500 SKU'S. Extensive FREE FREIGHT PROGRAM of $1,000+ on select new & existing items. Flash also provides Website Template Support."
Las Vegas Market - Summer,08/22/2021,2021,https://www.lasvegasmarket.com/,DM,Braid & Wood Design Studio,E-1419,The EXPO at World Market Center,https://braidandwood.com/wholesale,jenn@braidandwood.com,(619) 507-1475,,California - CA 13350 Pacific Place Unit 2102 San Diego,United States,Botanicals | Decorative Accessories | Floral & Foliage | Wall Decor,,,BRAID & WOOD Design Studio creates indoor plant hangers for the modern minimalist. Suspended and wall mounted designs allow plant lovers to showcase their green-thumbs while still being conscious of space.
Las Vegas Market - Summer,08/22/2021,2021,https://www.lasvegasmarket.com/,DM,Flexsteel Industries,"A529,A530,C558,C602A","Building A,Building A,Market Square Suites,Market Square Suites",http://www.flexsteel.com,bamurphy@flexsteel.com,(563) 585-8265,(563) 556-8345,Iowa - IA 385 Bell Street Dubuque,United States,"Bookcases | Chairs, Dining | Chairs, Upholstered | Chaise Lounges | Headboards | Upholstered Beds | Upholstery",,,"Strength on the inside. Lasting beauty on the outside. With more than 100 years of United States manufacturing experience, Flexsteel Industries, Inc. is committed to making wood and upholstered furniture that is built for life."
Las Vegas Market - Summer,08/22/2021,2021,https://www.lasvegasmarket.com/,DM,New Classic Furniture,A854,Building A,http://www.newclassicfurniture.com,rob@newclassicfurniture.com,(909) 484-7676,(909) 484-2840,California - CA 7351 Mcguire Ave Fontana,United States,"Accent Furniture | Bunk Beds | Chairs, Dining | Chairs, Upholstered | Entertainment Centers | Headboards | Upholstery",,,"Broad, value packed selection of Master & Youth Bedrooms, Occasional, Entertainment, Dining, Motion Upholstery and Leather. Mixed Container or FOB our 3 U.S. Warehouses. Popular mid price points with in demand quality features."
Las Vegas Market - Summer,08/22/2021,2021,https://www.lasvegasmarket.com/,DM,Blue Link Ink,E-2015,The EXPO at World Market Center,http://www.bluelinkink.com,info@bluelinkink.com,6304709421,,New York - NY 185 Zandhoek Rd Hurley,United States,Art | Wall Art,,,"BlueLinkInk makes the critical difference to your prints, fine art ideas, and projects."
Las Vegas Market - Summer,08/22/2021,2021,https://www.lasvegasmarket.com/,DM,"American Furniture Alliance, Inc",B250-10,Building B,http://www.afa3.com,judychang@vft.com,(909) 204-6077,(909) 256-5959,California - CA 9141 Arrow Route Rancho Cucamonga,United States,"Accent Furniture | Bunk Beds | Chairs, Accent | Chaise Lounges | Futons | Home Textiles | Mattress, Juvenile | Personal Care / Spa | Pillows | Sofas | Upholstery | Yoga Accessories",,,"AFA is a world class innovative manufacturer of trend-setting preferred consumer products that provide a competitive edge by utilizing industry disrupting methods, ecologically safe materials and strategic standardized logistics."
