ShowName,ShowDate,ShowYear,ShowWebsite,SubmittedBy,ExhibitorName,BoothNumber,HallLocation,Website,Email,Phone,Fax,Address,Country,Categories,Manufacturers,Brands,Description
Made in Canada,11/10/2021,2021,https://madeinca.ca/blog,DM,EXCEL Premium Chimney and Venting Systems,,,http://icc-chimney.com/,,,,,,Chimney and venting systems,,,"Industrial Chimney Company (ICC) manufactures EXCEL premium chimney and venting systems in a 120,000 square foot factory in Saint-Jérôme, Quebec. ICC’s innovative engineering and superior construction enables safer installations while using fewer parts, thereby improving installation efficiency. EXCEL premium chimney and venting systems are available exclusively through specialty retailers who specialize in fireplaces and chimney systems. Specialty hearth retailers understand the unique nature of their industry and are qualified to provide both technical support and certified installations."
Made in Canada,11/10/2021,2021,https://madeinca.ca/blog,DM,Bamboobino,,,http://www.bamboobino.com/,,,,,,"Baby and children’s hooded towels, clothing and accessories",,,"Bamboobino is an award-winning line of baby and toddler clothing, bedding and bath time accessories made from soft, eco-friendly bamboo and organic cotton."
Made in Canada,11/10/2021,2021,https://madeinca.ca/blog,DM,Coco Karamel,,,http://www.cocokaramel.com/,,,,,,Alfajores,,,"We’ll let Coco Karamel speak for themselves in describing their alfajores: “An amazing cookie-pie, with two thin cookies that give the creamy and rich dulce de leche (milk caramel) the center stage. Alfajores are very sweet and for those that have a sweet tooth they are perfect. It is almost like having a box of chocolates in a cookie-pie form. They are amazing and are a staple treat in Argentinian culture. For our alfajores we use only one of the best dulce de leches sourced right from Argentina but they are made fresh here in Canada, so all can discover how amazing they really are. Alfajores pair well with coffee, tea, mate (yerba) or simply as an after work snack.”"
Made in Canada,11/10/2021,2021,https://madeinca.ca/blog,DM,GTP,,,http://www.genetimer.com/,,,,,,Scrabble game boards & game timers,,,Canadian Owned: Yes
Made in Canada,11/10/2021,2021,https://madeinca.ca/blog,DM,Total Cleanse,,,http://www.totalcleanse.ca/,,,,,,"Cold-pressed juices, soups, salads",,,"Total Cleanse is primarily a juice cleanse delivery service, providing you with a unique variety of fresh, high quality juices, but they also make and deliver salads, soups and snacks designed to help you live your best life."
Made in Canada,11/10/2021,2021,https://madeinca.ca/blog,DM,Biovert,,,https://www.bio-vert.com,,,,,,"Household cleaning products, laundry, hand soap, dish wash",,,Biovert makes a wide range of products that are ecologically friendly and EcoLogo certified.
Made in Canada,11/10/2021,2021,https://madeinca.ca/blog,DM,MacAusland’s Woolen Mills,,,http://www.macauslandswoollenmills.com,,,,,,Wool blankets and yarn,,,"MacAusland’s Woolen Mills is one of the Island’s oldest businesses, having started as a saw and grist mill in 1870, before converting to yarn production in 1902. It remains family owned by the 4th generation of MacAuslands."
Made in Canada,11/10/2021,2021,https://madeinca.ca/blog,DM,Instruments: Daddy Mojo Stringed Instruments 🍁,,,https://daddy-mojo.com/,,,,,,Cigar box guitars,,,"Daddy Mojo continues an old tradition, making cigar box guitars that were built by creative but impoverished guitarists, making guitars out of cigar boxes, broomsticks and whatever was available."
Made in Canada,11/10/2021,2021,https://madeinca.ca/blog,DM,Clothing/Footwear/Accessories: Hides in Hand 🍁,,,http://www.hidesinhand.com/,,,,,,"Footwear, bags, gloves, mittens, hats and accessories for women, men & children",,,"Hides in Hand is located near Acton, where there used to be a significant leather industry (“It’s worth the drive to Acton!”). Much of the leather production in Acton has now moved off-shore, but Hides in Hand is there making top-quality product out of deer, buffalo and moose hides provided by local hunters as a by-product of food hunting."
Made in Canada,11/10/2021,2021,https://madeinca.ca/blog,DM,Accessories: Opelle 🍁,,,http://www.opellecanada.com/,,,,,,Leather handbags,,,"Opelle sources their leathers in Italy, Germany and Spain, and has a permanent collection of classic pieces that are always available, and two seasonal collections each year. Each bag is handmade in their Toronto atelier."
Made in Canada,11/10/2021,2021,https://madeinca.ca/blog,DM,Fraser Valley Gourmet,,,https://www.fraservalleygourmet.com/,,,,,,Almond Butter Crunch,,,"Fraser Valley Gourmet makes delicious almond butter crunch in milk chocolate, dark chocolate, coconut lemon chai, and dark chocolate with espresso. Ontario retailers get on this, I want to try it!"
Made in Canada,11/10/2021,2021,https://madeinca.ca/blog,DM,Name:,,,,,,,,,"Products: Jams, jellies, marmalades, syrups | Products are available at many independent retailers in and around Winnipeg and other locations in rural Southern Manitoba (and online if you Google it).",,,Name: Crampton‘s Manitoba Maid
Made in Canada,11/10/2021,2021,https://madeinca.ca/blog,DM,Organic Body Shop Factory,,,http://www.organicbodyshop.ca/,,,,,,Organic bath and body products,,,"Organic Body Shop Factory is run by 4 female staff growing herbs and plants on a 5 acre farm in Barrie. From there, they extract essential oils and use those oils to create over 400 bath and beauty products, made to order."
Made in Canada,11/10/2021,2021,https://madeinca.ca/blog,DM,Syfilco Ltd.,,,https://www.syfilco.on.ca/,,,,,,"Drainage Filter, Bale Net Wrap, Trellis Netting, Bird Netting",,,Syfilco Ltd. is a Canadian owned and operated business that has manufactured industrial knitted fabrics and netting products for over 40 years. Their ability to customize designs of knitted products and adapt to current technologies has allowed them to diversify into a variety of textile markets all over the world.
Made in Canada,11/10/2021,2021,https://madeinca.ca/blog,DM,Bow Valley Straws,,,http://www.bowvalleystraws.ca/,,,,,,Resuable borosilicate glass drinking straws & handmade upcycled straw cases,,,"Bow Valley Straws creates unique reusable drinking straws from kiln annealed borosilicate glass. As we all know, the world’s oceans and landfills are overflowing with plastic, and single-use plastic straws are a  culprit. Some restaurants have started using paper straws (which just aren’t the same) while the typical reusable option is metal, and you can’t see inside it to see if it’s clean or not."
Made in Canada,11/10/2021,2021,https://madeinca.ca/blog,DM,Biscuits Leclerc Ltée,,,http://leclerc.ca/,,,,,,"Cookies, snack bars and crackers under the brands Celebration, Vital, Choco, Praeventia, Tradition, Choco Max, Muffin Max and Gopure",,,"Family-owned since 1905, Leclerc employs approximately 1,100 people in total across all its facilities (3 of which are located in the USA). They recently purchased a building in Cornwall and are expanding their Canadian production capacity."
Made in Canada,11/10/2021,2021,https://madeinca.ca/blog,DM,Communauto,,,https://www.communauto.com/,,,,,,Car sharing,,,"The only Canadian-owned alternative to US-based Zipcar or Maven.
The service is also available in Toronto as Communauto Flex, with a different website: https://toronto.communauto.com"
Made in Canada,11/10/2021,2021,https://madeinca.ca/blog,DM,Safeblend,,,http://www.safeblend.com,,,,,,"Cleaning product assortment includes floor care, cleaners and degreasers, disinfectants and sanitizers, bathroom cleaners, odour control, window cleaners, carpet care, hand soaps, laundry detergents and a complete line for foodservice.",,,"Safeblend is produced by Chemotec PM Inc., a Quebec-based company manufacturing advanced cleaning solutions that are safe for people and for our planet. They have been around since 1955, primarily targeting commercial and foodservice customers."
Made in Canada,11/10/2021,2021,https://madeinca.ca/blog,DM,Little & Lively,,,https://shareasale.com/r.cfm?b=1845707&u=1831463&m=115073&urllink=&afftrack=,,,,,,Children’s clothing,,,"Little &amp; Lively is a clothing line produced by The Kindred Studio, a family-run enterprise located in Abbotsford, BC. They focus on ethical manufacturing of clothing and are extremely transparent about where their products are made and where they source their fabrics (China). They go so far as to hire a third party auditors to ensure that their fabrics are produced ethically in China, with good working conditions and no sweatshop situations. Cutting, sewing and finishing is all done locally in BC."
Made in Canada,11/10/2021,2021,https://madeinca.ca/blog,DM,Perlae Couture,,,http://www.perlaecouture.com/,,,,,,Women’s clothing,,,Perlae Couture is a family-owned and operated luxury fashion label made in Nova Scotia. They are very passionate about providing fashion for all women and have sections on their website dedicated to cancer survivors.
Made in Canada,11/10/2021,2021,https://madeinca.ca/blog,DM,Accessories: LOWELL 🍁,,,https://www.lowellmtl.ca/,,,,,,Leather bags and accessories,,,"LOWELL’s online store and their retail outlets appear to carry a variety of lines, not simply their own leather goods, and it’s not clear what of the other lines are made in Canada. Their leather goods are made in Montreal."
Made in Canada,11/10/2021,2021,https://madeinca.ca/blog,DM,Walter Craft Caesar,,,https://waltercaesar.com/,,,,,,Caesar mix,,,"So, Walter Craft Caesar Mix is not in itself alcohol, but is intended to be mixed with alcohol to make Canada’s alleged favourite cocktail, so close enough. Walter was launched as an alternative to the US-made mix which contains a bunch of sugar, MSG, and general unpleasantness."
Made in Canada,11/10/2021,2021,https://madeinca.ca/blog,DM,Footwear: Brave New Soles 🍁,,,http://bravenewsoles.com/,,,,,,Handmade | shoes,,,"Brave New Soles offers handmade soft soles crib shoes and sneakers for the whole family using rescued leather offcuts from the theatrical and design industries. This sustainable approach allows for truly unique, limited run styles as singular as their wearer."
Made in Canada,11/10/2021,2021,https://madeinca.ca/blog,DM,Pela,,,https://pelacase.com/,,,,,,"Cell phone case, screen protector",,,"Pela makes unique cell phone cases out of “Flaxstic”, which are fully compostable, 45% plant-based (including from flax by-products that are normally wasted). They also make the Canopy liquid screen protector."
Made in Canada,11/10/2021,2021,https://madeinca.ca/blog,DM,Blue Wonder,,,http://www.bluewondercloth.com/,,,,,,"Microfiber cleaning products, microfiber personal care products, microfiber pet products and PURE all natural cleaner concentrate",,,"Blue Wonder has been in business for over 20 years, manufacturing and distributing microfiber cleaning products. Their products work for people with chemical sensitivities or those that want a greener cleaning solution. All their products are made in BC with the exception of a commercial grade microfiber mopping system manufactured in Sweden."
Made in Canada,11/10/2021,2021,https://madeinca.ca/blog,DM,BRAVE Leather,,,https://www.braveleather.com/,,,,,,"Leather belts, wallets, other leather goods",,,"BRAVE started as a street vendor in Toronto in 1992, and in the time since has sold more than 2 million leather pieces. All their products are handmade in Toronto with vegetable-tanned leather. The leather is sourced as a byproduct of the food industry, so as BRAVE notes, no animal has ever died to make their their goods."
Made in Canada,11/10/2021,2021,https://madeinca.ca/blog,DM,TEAMCO Sportswear Inc.,,,http://teamcosportswear.com/,,,,,,Team uniforms,,,They appear to be related to the folks at Jerico.
Made in Canada,11/10/2021,2021,https://madeinca.ca/blog,DM,Yum Yum Chips,,,http://yum-yum.com/,,,,,,"Potato chips, veggie chips, veggie sticks, onion rings, cheese sticks",,,"Yum Yum Chips is a 100% homegrown, third generation family business from Quebec, specialized in the production and distribution of potato chips and snack foods since 1959. It transforms and distributes more than 200 products under the following brand names: Yum Yum, Viva, State Line and Champion."
Made in Canada,11/10/2021,2021,https://madeinca.ca/blog,DM,Pet Products: RC Pets 🍁,,,http://www.rcpets.com/,,,,,,"Dog and cat leashes, collars, harnesses, travel products, raincoats, socks, etc.",,,The company reports that the following products are made in Canada:
Made in Canada,11/10/2021,2021,https://madeinca.ca/blog,DM,Elite Sofa Designs,,,https://www.elitesofas.com,,,,,,"Sofas, love seats, chairs, beds, ottomans",,,"Founded in 1987, Elite Sofa Designs makes a wide variety of furniture, with many custom options and the best turnaround time in the industry. Here at MiC HQ, we’ve added one of these chairs and we’re very impressed thus far!"
Made in Canada,11/10/2021,2021,https://madeinca.ca/blog,DM,Left Field Cider,,,http://www.leftfieldcider.com/,,,,,,Cider,,,"Family owned by sisters Theresa and Kate, they make award winning, small batch artisanal ciders."
Made in Canada,11/10/2021,2021,https://madeinca.ca/blog,DM,Outdoors: Vann-Winn Woodcraft 🍁,,,http://www.vannwinn.ca/,,,,,,"Wooden garden labels, pot labels, plot stakes, tree stakes",,,"Vann-Winn offers pot labels, garden labels, plot stakes, tree stakes, and tree labels made from high quality pine. The labels are available in various sizes, and plain or painted in colors such as white, yellow, orange, red, blue and green. The pot labels and garden labels can also be packaged in resealable plastic bags in quantities of 100 for retail sale."
Made in Canada,11/10/2021,2021,https://madeinca.ca/blog,DM,Islander Reels,,,http://islander.com/,,,,,,Precision fishing reels,,,"Islander has been manufacturing precision fishing reels since 1990, as a division of J.S. Foster Corporation, a family-owned machine shop in Victoria. In addition to their reels, it appears that most/all of their clothing is made in Canada as well."
Made in Canada,11/10/2021,2021,https://madeinca.ca/blog,DM,Tree-Free Greetings Canada,,,http://www.tree-free.ca/,,,,,,Greeting cards,,,"Tree-Free Greetings is a subsidiary of MapArt publishing, 100% Canadian owned and operated.  All cards are printed in Canada and the company is always interested in licensing art from Canadian artisans and photographers."
Made in Canada,11/10/2021,2021,https://madeinca.ca/blog,DM,Uprising Bread,,,https://uprisingbreads.com/,,,,,,"Breads, buns, desserts",,,"Thanks to a submission from Chardon, who says Uprising is the only bread she’ll buy in the Vancouver area."
Made in Canada,11/10/2021,2021,https://madeinca.ca/blog,DM,OSC Seeds – Ontario Seed Company,,,https://www.oscseeds.com/,,,,,,"Seeds for flowers, herbs, vegetables",,,"OSC Seeds is the largest wholly Canadian-owned and operated seed packet company, offering a full line of products including over 30 herbs, 250 vegetables, 240 annuals, and 100 perennials and biennials suitable for Canada’s various climates. They are a 5th generation family-owned business."
Made in Canada,11/10/2021,2021,https://madeinca.ca/blog,DM,Gallant Manufacturing,,,http://www.gallantmanufacturing.com/,,,,,,Pedestal-mounted grinders,,,"Gallant makes 8 different kinds of pedestal grinders, and also have a variety of custom options."
Made in Canada,11/10/2021,2021,https://madeinca.ca/blog,DM,Leisure Travel Vans,,,https://leisurevans.com/,,,,,,Class B and C recreational vehicles,,,"Leisure Travel Vans is a brand of Triple E Recreational Vehicles, which has been manufacturing RVs in Manitoba since 1965. They use Mercedes Sprinter or Ford Transit chassis and build three different models of RVs with the latest technologies and innovations."
Made in Canada,11/10/2021,2021,https://madeinca.ca/blog,DM,Food: Crosby’s Molasses 🍁,,,https://crosbysmolasses.com,,,,,,Molasses,,,"Crosby’s is a 5th generation family-owned business, making molasses and other foodservice products. Their molasses is made from sugarcane, as fancy molasses must be to legitimately hold that name. However, some competitive manufacturers mix other sweeteners into their products as a form of “food fraud”."
Made in Canada,11/10/2021,2021,https://madeinca.ca/blog,DM,She Devil Delights,,,http://shedevildelights.com/,,,,,,Hellish Relish,,,"Sweet, sassy, and a little bad-assy! Hellish Relish is a moreish mixture of fresh
seasonal chili peppers and onions, cooked up with mustard seed, vinegar, salt
and a sprinkle of sugar to create a sweet and sassy taste sensation that you can enjoy on almost anything OR straight out of the jar!"
Made in Canada,11/10/2021,2021,https://madeinca.ca/blog,DM,Aqua+ Skincare,,,http://aquaskincare.ca/,,,,,,Skincare and beauty,,,"Aqua+ Skincare is a Canadian cosmetic company specializing in health and skin care products. Founded in 2014 and headquartered in Alberta, Canada, its main focus is research, development and innovation concentrating mainly on skin care products and protection and prevention against harmful air pollutants."
Made in Canada,11/10/2021,2021,https://madeinca.ca/blog,DM,Impact Poly Hammers,,,http://impactpolyhammers.com/,,,,,,Dead blow mallets including sledgehammers,,,
Made in Canada,11/10/2021,2021,https://madeinca.ca/blog,DM,Elmira Stove Works,,,https://www.elmirastoveworks.com,,,,,,Retro and antique designed ranges and stoves,,,"Elmira Stove Works offers two lines of appliances, with retro 1950s or 1890s looks. They manufacture their stoves in Canada, but it appears that for their other appliances they take models by manufacturers such as Whirlpool and Kitchenaid and apply the retro designs to create a consistent look across all their appliances."
Made in Canada,11/10/2021,2021,https://madeinca.ca/blog,DM,Pasta Tavola,,,http://www.pastatavola.ca/,,,,,,"Natural, Ontario Foodland-certified pastas and sauces",,,"Pasta Tavola is an artisanal food manufacturer with an extensive range of all-natural specialty pasta, sauces and oven-ready meals, thoughtfully crafted with premium local Canadian ingredients, like 100% Ontario milled wheat flour, award-winning Ontario cheeses and Ontario and Canadian-grown vegetables."
Made in Canada,11/10/2021,2021,https://madeinca.ca/blog,DM,Baby Clothing: Itty Bitty Baby Clothing Company 🍁,,,http://www.ittybittybabyboutique.com/,,,,,,Baby clothes and accessories,,,
Made in Canada,11/10/2021,2021,https://madeinca.ca/blog,DM,Fiveleft Leather,,,https://fiveleft.ca/,,,,,,Leather goods,,,"Formed in 2006 by US transplant Lincoln Heller (thus our theory that the business is not Canadian-owned), Fiveleft makes incredible vegetable-tanned leather products. Their products are seriously beautiful."
Made in Canada,11/10/2021,2021,https://madeinca.ca/blog,DM,Kuvu,,,https://www.thekuvu.com/,,,,,,Storage cords,,,"You should probably look at pictures of the Kuvu in action to really understand what it does. The Kuvu can be used in hundreds of ways to hang, wrap, hold, loop, grab, organize &amp; store almost anything you can think of."
Made in Canada,11/10/2021,2021,https://madeinca.ca/blog,DM,Shrugging Doctor Beverage Company,,,http://www.shrugdoc.com/,,,,,,Wine,,,"Shrugging Doctor is Manitoba’s largest winery, and uses 100% Canadian ingredients for all their wines. They offer one-hour delivery to your door in Winnipeg from 6 PM to midnight every day."
Made in Canada,11/10/2021,2021,https://madeinca.ca/blog,DM,Cuban Lunch,,,https://cubanlunch.ca/,,,,,,"Cuban Lunch chocolate bar, Rum & Butter chocolate bar",,,"As an Ontarian, I had no idea of the existence of these products, but before the Winnipeg manufacturer went out of business in 1991, Cuban Lunch was apparently huge in the West. In 2018 the product was resurrected by an Alberta couple who wanted to re-create the classic experience for Crystal Regehr-Westergard’s elderly mother."
Made in Canada,11/10/2021,2021,https://madeinca.ca/blog,DM,Name: Inniskillin,,,http://www.inniskillin.com/,,,,,,Products: Wine,,,Name: Inniskillin
Made in Canada,11/10/2021,2021,https://madeinca.ca/blog,DM,Makk Design Inc.,,,http://www.pavlok.com/,,,,,,"Pavlok 2, Shock Clock",,,"The Pavlok 2 is an interesting device – think of it as a mean version of the Fitbit, that shocks you to help break bad habits. Makk Design designed and manufactures Pavlok wearable training devices for Behavioral Technology Group, a USA-based company. This high-tech consumer product is exported to the USA, Europe, China and Japan."
Made in Canada,11/10/2021,2021,https://madeinca.ca/blog,DM,Outdoor Survival Canada,,,http://outdoorsurvivalcanada.com/,,,,,,"Parkas, winter coats, outdoor pants, sleeping bags",,,"Outdoor Survival Canada (OSC) is an entrant in the healthy Canadian-made high-quality coat market. You’ll find high performance gear for combating our cold winters, not for a discount price – but you’re paying for quality."
Made in Canada,11/10/2021,2021,https://madeinca.ca/blog,DM,Spread ’em Kitchen,,,https://spreademkitchen.com,,,,,,Cashew-based dips,,,"Spread’em started making these spreads because they wanted to eat more whole foods, more vegetables and they wanted them to be honest, without preservatives and thickeners. Only real food ingredients. Something they could use everyday and know that it was genuinely good stuff that would make them feel good physically and mentally."
Made in Canada,11/10/2021,2021,https://madeinca.ca/blog,DM,Pet Products: Kettle Craft 🍁,,,http://www.kettlecraftpetproducts.com/,,,,,,Cat and dog treats,,,"Since 1996, Wolf &amp; Colleen Thoma have been practicing the art of cooking fine pet treats in a special kettle cooking process they adopted from the European culinary arts."
Made in Canada,11/10/2021,2021,https://madeinca.ca/blog,DM,Coffee: Bridgehead 🍁,,,https://www.bridgehead.ca/,,,,,,Coffee (and other coffee shop stuff),,,"Bridgehead roasts about 6,000 pounds of coffee a week that is used in its coffeehouses throughout Ottawa and shipped to wholesale and online customers around the country. Their beans are sourced from co-ops around the world."
Made in Canada,11/10/2021,2021,https://madeinca.ca/blog,DM,3C Underwear,,,https://www.3cunderwear.ca/,,,,,,Men’s underwear,,,"3C Underwear makes three different styles of underwear – Cool, Comfortable and Confident (thus the 3C name). They also offer a 21 day full refund guarantee, even if you’ve worn the underwear, so it’s tough to go wrong trying these out."
Made in Canada,11/10/2021,2021,https://madeinca.ca/blog,DM,Sea of Wolves,,,http://www.seaofwolves.ca/,,,,,,Handmade bamboo clothing printed with original art,,,Sea of Wolves makes original handmade clothing designed and produced by Catherine Gaudreault featuring thoughtful and inspiring work by Nathan Stewart. They are a family business.
Made in Canada,11/10/2021,2021,https://madeinca.ca/blog,DM,Flexmaster Canada Inc,,,http://www.flexmaster.com/,,,,,,Commercial HVAC and residential and commercial venting,,,"Flexmaster is part of the NovaFlex Group, which also has facilities in the USA and UK through acquisitions they’ve made. However, they’re a privately-owned Canadian company!"
Made in Canada,11/10/2021,2021,https://madeinca.ca/blog,DM,49th Apparel,,,https://www.49thapparel.com,,,,,,Nightshirts and pajama sets,,,"49th Apparel (which comes from the founder’s mom mishearing the original name, “49th Parallel”) is a Canadian company in Sault Ste. Marie, Ontario that designs and produces high quality, simple and straightforward sleepwear – mainly pajama sets and nightshirts for men and women. They’ve been making pajamas since 1992, and the majority of their product is made in northern Ontario, with some in Toronto."
Made in Canada,11/10/2021,2021,https://madeinca.ca/blog,DM,Breakfast Foods: Sunny Boy Foods 🍁,,,http://www.sunnyboyfoods.com/,,,,,,Hot cereal and pancake mixes,,,"Sunny Boy Foods started in 1926, milling grain from nearby farmers. They introduced hot cereals in 1929, and have since added pancake mixes. They continue to buy their grains from nearby farmers."
Made in Canada,11/10/2021,2021,https://madeinca.ca/blog,DM,Northern Light Technologies,,,http://www.northernlighttechnologies.ca/,,,,,,Light Therapy,,,"If you suffer from seasonal affective disorder, Northern Light Technologies has Bright Light Therapy products offering 10,000 Lux. They make a variety of desk, floor and ceiling lamps. Note that they also distribute products from other manufacturers not based in Canada, but have clearly marked their own products as made in Canada."
Made in Canada,11/10/2021,2021,https://madeinca.ca/blog,DM,Seagull,,,https://seagullpewter.com/,,,,,,"Giftware: jewellery, picture frames, book marks, Christmas ornaments, and many, many more items",,,"Seagull Pewter products are created, designed and handcrafted in the tiny fishing village of Pugwash on Nova Scotia’s northern shore. Pewter is an alloy metal made of at least 92% tin. Seagull Pewter exceeds the minimum tin content, which makes for a better quality pewter."
Made in Canada,11/10/2021,2021,https://madeinca.ca/blog,DM,Kathite Industries Inc,,,http://www.kathite.ca/,,,,,,Kathite Chimney Cleaner,,,"Kathite is safe to use in all wood and pellet stoves, and helps reduce the buildup of soot and creosote in chimneys."
Made in Canada,11/10/2021,2021,https://madeinca.ca/blog,DM,Driving Force,,,http://www.drivingforce.ca/,,,,,,Vehicle rental,,,"Driving Force provides an alternative to the big chain rental companies, and has some unique options you won’t find elsewhere."
