ShowName,ShowDate,ShowYear,ShowWebsite,SubmittedBy,ExhibitorName,BoothNumber,HallLocation,Website,Email,Phone,Fax,Address,Country,Categories,Manufacturers,Brands,Description
Made in Canada,11/10/2021,2021,https://madeinca.ca/blog,DM,Nelson Naturals,,,https://nelsonnaturals.com,,,,,,Natural toothpaste,,,"If anyone knows anything about Nelson Naturals, please let us know. What we’ve been able to determine is that they make several kinds of well-regarded natural toothpastes in BC. Beyond that, we haven’t found out if they are Canadian-owned or not."
Made in Canada,11/10/2021,2021,https://madeinca.ca/blog,DM,Personal Care: Hairy Face 🍁,,,https://www.hairyfacebeardoils.com/,,,,,,Beard & grooming products,,,"Crafted for the true gentleman, Hairy Face is there from your morning wake up, to a day at work or a night out, offering personal care and grooming products for every adventure you can take on. They take pride in caring for your skin, your beards, and more."
Made in Canada,11/10/2021,2021,https://madeinca.ca/blog,DM,Blue World Treasures,,,https://blueworldtreasures.com/,,,,,,Handcrafted Gemstone,,,"Blue World Treasures offers handcrafted custom jewellery for any occasion using genuine gemstones, pure copper, sterling silver, 14k gold and 12k rose gold.  They also incorporate natural elements such as birch bark, dried flowers, driftwood and more, which is boho/Aboriginal in style."
Made in Canada,11/10/2021,2021,https://madeinca.ca/blog,DM,Shirley Park,,,http://shirleypark.ca/,,,,,,,,,"Shirley Park Jewellery creates pieces inspired by nature and Eastern philosophy, resonating with a sense of balance, harmony and elegant simplicity."
Made in Canada,11/10/2021,2021,https://madeinca.ca/blog,DM,Bellezza Moda,,,http://www.bellezzamoda.net/,,,,,,,,,"Bellezza Moda was created in March of 2014 by Jasmine Gemmell. Bellezza Moda means Beauty and Fashion in Italian, inspired by the beauty in the language, and the beauty in their jewellery."
Made in Canada,11/10/2021,2021,https://madeinca.ca/blog,DM,Ursula Ungerleider Designs,,,http://www.ursulaungerleiderdesigns.com/,,,,,,,,,"One-of-a-kind, hand-made, custom cut cabochons &amp; gemstones and jewellery."
Made in Canada,11/10/2021,2021,https://madeinca.ca/blog,DM,Hillberg & Berk,,,https://hillbergandberk.com,,,,,,"Earrings, necklaces, bracelets, rings",,,"From humble beginnings making jewellery at a kitchen table, to a successful appearance on Dragon’s Den, to a $15 million company with 150 employees, Hillberg &amp; Berk is a Canadian success story."
Made in Canada,11/10/2021,2021,https://madeinca.ca/blog,DM,Van Raay,,,http://www.vanraay.etsy.com/,,,,,,Engagement and wedding rings,,,"Van Raay uses recycled precious metals, and ethical alternatives to diamonds. Their focus is on quality work that will last a lifetime."
Made in Canada,11/10/2021,2021,https://madeinca.ca/blog,DM,Jewlr.ca,,,http://www.kqzyfj.com/click-8880957-13051741,,,,,,Fine (affordable),,,"At MiC we freely admit we know nothing about jewellery, but these guys seem pretty cool. They’ve built an online platform where you can choose your design, metal and stones and they will hand-make the piece to your specifications. The pieces are designed in Canada, made in Canada, and they offer free shipping in Canada."
Made in Canada,11/10/2021,2021,https://madeinca.ca/blog,DM,Metalsmiths Sterling,,,https://metalsmiths.ca,,,,,,,,,"While Metalsmiths Sterling does not manufacture their products in Canada, they do have a retail store network employing Canadians, and they are Canadian owned, so they make the list."
Made in Canada,11/10/2021,2021,https://madeinca.ca/blog,DM,Freckle Face,,,http://www.frecklefacejewellery.com/,,,,,,Fashion,,,Freckle Face Jewellery designs and makes fashion jewellery at an affordable price for women.  Their goal is to make their customers feel as confident and amazing about themselves as possible.
Made in Canada,11/10/2021,2021,https://madeinca.ca/blog,DM,Restaurants: Panago 🍁,,,http://www.panago.com/,,,,,,"Pizza, chicken wings/bites, salads, cheese bread, desserts",,,"Takeout/delivery pizza place, founded in Abbotsford BC, and is a Canadian owned and operated chain. They offer vegan, vegetarian and gluten-free options."
Made in Canada,11/10/2021,2021,https://madeinca.ca/blog,DM,Tinker Guitars,,,http://tinkerguitars.com,,,,,,Fine handmade acoustic guitars,,,Acoustic handmade guitars from Vancouver.
Made in Canada,11/10/2021,2021,https://madeinca.ca/blog,DM,Electronics: Ecobee,,,http://www.ecobee.com/,,,,,,Smart thermostat,,,"Ecobee, a Toronto-based company with approximately 300 Canadian employees, offers a smart thermostat in a similar vein to competitors Nest and Honeywell. On November 1, 2021, it was announced that the company had been acquired by US-based Generac. Given their continuing strong Canadian presence, MiC believes Ecobee is still a worthwhile smart thermostat, as there are no other remotely Canadian options we’re aware of."
Made in Canada,11/10/2021,2021,https://madeinca.ca/blog,DM,Iel-Lachance,,,https://www.iel-lachance.com,,,,,,Solar chair,,,The Solair chair (aka Motel chair or basket chair) has been made in Canada since 1972.
Made in Canada,11/10/2021,2021,https://madeinca.ca/blog,DM,Confectionery: Kerr’s Candy 🍁,,,http://www.kerrs.com/,,,,,,All products under the “ | ‘s” brand are made exclusively in Canada,,,"Kerr‘s is one of Canada’s oldest confectionery companies, making traditional Canadian candy since 1895. It was started by two Scottish brothers who emigrated to Canada and started making candy in St. Thomas, Ontario."
Made in Canada,11/10/2021,2021,https://madeinca.ca/blog,DM,Restaurants: Topper’s Pizza 🍁,,,http://www.toppers.ca/,,,,,,Pizza and other take-out items,,,"If you’re paying attention, you might have noticed that there’s a lot of pizza chains in Ontario. Topper’s started as a family business in Sudbury, Ontario, and now has franchises throughout Ontario."
Made in Canada,11/10/2021,2021,https://madeinca.ca/blog,DM,Hives For Humanity,,,http://hivesforhumanity.com/,,,,,,"Honey, candles and lip balm",,,Hives for Humanity offers honey that is raw and  unpasteurized and has been harvested in the lower mainland. All proceeds support innovative programming that builds inclusive community through the culture of the (bee)hive. Hives for Humanity is a non-profit organization that encourages community connections through beekeeping and works to create flexible opportunities for people to engage in the therapeutic culture that surrounds the hive.
Made in Canada,11/10/2021,2021,https://madeinca.ca/blog,DM,Furniture: Palliser Furniture 🍁,,,https://www.palliser.com/,,,,,,Furniture,,,"Palliser, a family owned company founded in 1944, manufactures a wide variety of furniture. They own a plant in Winnipeg and 4 plants in Mexico, employing 2,000 people. They are also the parent company of EQ3 furniture."
Made in Canada,11/10/2021,2021,https://madeinca.ca/blog,DM,Maritime Madness,,,https://maritimemadness.com/,,,,,,Hot Sauce,,,"A small family business, Canadian owned. They grow peppers and make all  sauces in house. In business since 2002. Check out their website. They have plenty of products available."
Made in Canada,11/10/2021,2021,https://madeinca.ca/blog,DM,Playmore Tables & Games,,,http://playmoregames.ca/,,,,,,Pool Tables,,,"Playmore has been building beautiful pool tables in Alberta for over 25 years. They offer the ability to do custom designs on all types of materials, as well as custom finishes to fit decor. Their pool tables are made in Alberta and can be shipped across the country."
Made in Canada,11/10/2021,2021,https://madeinca.ca/blog,DM,Maritime Naturals,,,http://www.maritimenaturals.com/,,,,,,"Personal care, skin care, beauty",,,"Certified organic. A company from Nova Scotia, Canada and very proud of that. Their products are tested by family members to ensure the best possible products are available to the public."
Made in Canada,11/10/2021,2021,https://madeinca.ca/blog,DM,Holy Crap,,,https://holycrap.com/,,,,,,Cereal,,,This is a Dragons Den success story. They have more then one brand of cereal. It is safe for celiacs and other specialty diets. gluten-free + organic + kosher + plant-based + non-GMO project verified
Made in Canada,11/10/2021,2021,https://madeinca.ca/blog,DM,BC Tree Fruits,,,http://www.bctree.com/,,,,,,Fruit,,,"A Co-operative operating in British Columbia since 1936, comprised of more than 430 local grower families."
Made in Canada,11/10/2021,2021,https://madeinca.ca/blog,DM,Nickel City Beard Blends,,,https://nickelcitybeardblends.com,,,,,,Beard & body care products,,,"Now, here at MiC we don’t really get the beard thing. But there are enough fans out there that beard care is a pretty big thing, so while it’s not in the cards for us, check out Nickel City Beard Blends. Most of their products are all-natural and their beard blends are proudly made in Canada."
Made in Canada,11/10/2021,2021,https://madeinca.ca/blog,DM,CMFR,,,https://www.cmfrcanada.com/,,,,,,"Cold jackets, parkas, clothing and hats",,,"CMFR manufactures high-end parkas designed to withstand Canada’s harsh cold climates. Our research suggests that they are all made in Canada, but exactly where is not clear. We’ve reached out to the company for more information."
Made in Canada,11/10/2021,2021,https://madeinca.ca/blog,DM,Mercury Games Inc.,,,http://www.mercurygames.com/,,,,,,Board Games,,,"Formed in 2012, Mercury Games Inc is a Canadian company that publishes high-quality board games.  Mercury Games is proud to feature many games by Canadian game designers."
Made in Canada,11/10/2021,2021,https://madeinca.ca/blog,DM,Ukustic,,,https://ukustic.com/,,,,,,Ukulele Strings,,,Looking for Uke strings? Try ukustic.com.
Made in Canada,11/10/2021,2021,https://madeinca.ca/blog,DM,Salus Marine,,,http://www.salusmarine.com,,,,,,"Lifejackets, PFDs, coats/suits",,,Salus Marine is a designer and manufacturer of PFD’s/lifejackets. On their about page they talk about the benefits and difficulties of being a Canadian manufacturer. They say “almost all” of their PFD”s are made in Kitchener.
Made in Canada,11/10/2021,2021,https://madeinca.ca/blog,DM,Caframo,,,http://www.caframo.com,,,,,,"Fans, heaters, lamps",,,
Made in Canada,11/10/2021,2021,https://madeinca.ca/blog,DM,Jennifer Glasgow,,,https://www.jenniferglasgowdesign.com/,,,,,,Women’s clothing,,,A socially conscious Montreal-based slow fashion clothing label by Jennifer Glasgow. Sustainable and fair. Thoughtfully made and beautifully designed.
Made in Canada,11/10/2021,2021,https://madeinca.ca/blog,DM,HiSO,,,http://hiso.ca/,,,,,,Men’s and Women’s Outerwear,,,"Founded in 1975, HiSO is a second generation family company with over 40 years of experience in every garment. HiSO is a Canadian heritage company specializing in sophisticated, premium outerwear. HiSO uses shearling, cashmere, leather, and fur to create timeless garments."
Made in Canada,11/10/2021,2021,https://madeinca.ca/blog,DM,John,,,https://www.fluevog.com/,,,,,,Footwear,,,"Since 1970, John Fluevog has been creating iconic, creative shoes. Though they are not made in Canada, they are included on MiC because the company is located in BC, the shoes are designed in Canada and they have stores and retailers across the country."
Made in Canada,11/10/2021,2021,https://madeinca.ca/blog,DM,&,,,https://mattandnat.com/,,,,,,Sustainable vegan hand bags,,,"This family-owned business, based in Montreal, is a bit of a sensation for their vegan hand bags. Not only do they use no animal products, their bag linings are made of recycled plastic bottles. However, it’s worth noting that their production appears to be entirely outside of Canada. We chose to list them as they are headquartered in Canada and operate a retail network employing Canadians."
Made in Canada,11/10/2021,2021,https://madeinca.ca/blog,DM,Footwear: Padraig Cottage 🍁,,,https://www.padraigcottage.com/,,,,,,Slippers,,,"Padraig Cottage makes colourful crocheted slippers with a sheepskin sole. From humble beginnings at local craft markets, the slippers are now available at boutiques across North America and Europe. Despite the growth of the company over the years, they still manufacture their slippers in North Vancouver."
Made in Canada,11/10/2021,2021,https://madeinca.ca/blog,DM,Mr Mikes SteakhouseCasual,,,http://mrmikes.ca/,,,,,,Restaurant chain,,,Mr. Mikes is a company based in Canada which opened its first location in BC in 1960 and has been serving steaks and burgers to Canadians since then. The Mr. Mikes brand once numbered 89 restaurants across the west before shrinking and being reborn as Mr. Mikes SteakhouseCasual. They are growing rapidly in the west with eyes on Eastern Canada (they have one location in Ontario). They source and serve AAA Canadian beef in their restaurants.
Made in Canada,11/10/2021,2021,https://madeinca.ca/blog,DM,Garant,,,http://www.garant.com/,,,,,,"Gardening tools, shovels, snow shovels, hammers, carts",,,"Garant manufactures 11 million tools per year and employs 400 people at their facilities in Quebec and New Brunswick. They are very clear about the Canadian content involved in their manufacturing process, with a detailed page about what each symbol means."
Made in Canada,11/10/2021,2021,https://madeinca.ca/blog,DM,Clothing: Ezze Wear 🍁,,,https://www.ezzewearstore.ca,,,,,,Women’s clothing,,,"Ezze Wear has been producing 100% cotton clothing since 1991. They have added sateen stretch and knit fabrics as well but primarily focus on cotton. They do all their manufacturing in Ontario, and offer a wide variety of items across three different brands which also include Pretty and Krisztina Nagy Designer Collection."
Made in Canada,11/10/2021,2021,https://madeinca.ca/blog,DM,Footwear: Kamik 🍁,,,https://www.kamik.com/,,,,,,Boots,,,"Kamik notes on their website that they make 73% of their products in North America – the split between Canada and the US isn’t clear, but you can select Made in Canada as an option with several of their collections to identify the Canadian products."
Made in Canada,11/10/2021,2021,https://madeinca.ca/blog,DM,Eco-Max,,,https://store.eco-max.ca/,,,,,,"Laundry, dish soaps, dishwasher pods, toilet bowl cleaners, carpet cleaners, much more",,,"The Eco-Max brand is produced by the Prism Care Corporation. It was launched in 2006 to consumers after the success of their commercially-focused cleaning products. Their goal is to produce the best-performing, natural, non-toxic products on the market."
Made in Canada,11/10/2021,2021,https://madeinca.ca/blog,DM,Pizza Pizza,,,,,,,,,"Pizza, pasta, fries, etc",,,"Pizza Pizza is ubiquitous throughout Ontario and is an expanding presence in the rest of Eastern Canada. They also own Pizza 73, which has many restaurants in Western Canada. Pizza Pizza pioneered the use of a consistent phone number in their markets, -1111."
Made in Canada,11/10/2021,2021,https://madeinca.ca/blog,DM,Old Dutch Foods,,,http://www.olddutchfoods.com/,,,,,,"Chips, corn chips and other snacks",,,"Old Dutch makes the list because they have a variety of production facilities across Canada. They make a variety of products in the US, as well, so keep an eye on the labeling."
Made in Canada,11/10/2021,2021,https://madeinca.ca/blog,DM,Prairie Sticks Bat Company,,,https://www.prairiesticks.com/,,,,,,"Baseball bats, accessories, apparel",,,"Prairie Sticks makes bats from ash, maple and birch, sourced from the same suppliers who supply companies making bats for MLB. That means it’s good quality lumber but isn’t an indication of where the wood is sourced – it seems that bat companies are very protective of where their wood comes from. Prairie Sticks also offers customization options with logos and signatures, and free shipping for orders over $150."
Made in Canada,11/10/2021,2021,https://madeinca.ca/blog,DM,Breezewood Floors,,,http://breezewoodfloors.ca/,,,,,,Hardwood flooring,,,"Breezewood Floors is the flooring division of Canadian lumber yard, Townsend Lumber.  Townsend Lumber is a Canadian lumber company that processes wood on site for many needs, including its Breezewood Flooring. It is not clear if their products can be purchased outside of their retail locations."
Made in Canada,11/10/2021,2021,https://madeinca.ca/blog,DM,Natalex Manufacturing Limited,,,http://natalexmfg.com,,,,,,Office furniture,,,"Though the information on their website is not bountiful, Natalex has been building office furniture in Cambridge for over 40 years. Contact information is listed on their website for ordering, and it appears that there are dealers selling their furniture as well, per a Google search."
Made in Canada,11/10/2021,2021,https://madeinca.ca/blog,DM,Footwear: Manitobah Mukluks 🍁,,,,,,,,,,,,"Manitobah Mukluks is an Indigenous-owned company, with the vision of building a vibrant, global brand that makes a significant impact in Indigenous communities. They manufacture the finest indigenous footwear in the world. 20% of their products are made in Canada – on their website,  you can sort by collection, and choose Made in Canada, and it will filter down to the strictly made in Canada products."
Made in Canada,11/10/2021,2021,https://madeinca.ca/blog,DM,Pizzavile,,,https://www.pizzaville.ca,,,,,,"Pizza, panzerotti, chicken",,,"From its beginnings in 1963, Pizzaville has grown to 79 restaurants in Ontario with more planned. If you have ever lived in Ontario, you’ve probably heard their infamous commercials that begin with “It was a rainy day in Pizzaville…”. Their niche, as they claim, is using higher quality ingredients than the competition."
Made in Canada,11/10/2021,2021,https://madeinca.ca/blog,DM,Michaud Toys,,,http://www.michaudtoys.org/,,,,,,Wooden game boards,,,"The Michaud family has been handcrafting items out of wood since 1984. Now, they are producing a surprisingly wide variety of board games, from checkers to chess to crokinole to baseball (!?), with beautiful quality and detail."
Made in Canada,11/10/2021,2021,https://madeinca.ca/blog,DM,Nicecream,,,https://www.chimptreats.com/,,,,,,Ice cream-like dessert made only from fruit,,,"Started by Trent University student Brooke Hammer in 2016, Nicecream has gained distribution across the country. It’s an ice cream-like frozen dessert made entirely from fruit. That’s right – the strawberry banana flavour is made strictly from strawberries and bananas."
Made in Canada,11/10/2021,2021,https://madeinca.ca/blog,DM,Laiterie de,,,http://laiteriedecoaticook.com/,,,,,,"Cheese, Ice Cream, Ice Milk",,,"Submitted by several people, many of whom raved about the quality of Coaticook ice cream. Laiterie de Coaticook traces its roots back to 1940, and has focused primarily on the production of ice cream and ice milk since 1976. Currently they employ 110 people at their production facility in Coaticook."
Made in Canada,11/10/2021,2021,https://madeinca.ca/blog,DM,Chromag Bikes,,,http://www.chromagbikes.com/,,,,,,Mountain bikes and accessories,,,"Started in 2003, Chromag is based in Whistler, BC, which seems like a pretty good place to be making mountain bikes. They are very clear on their website about who is making their bikes – if you check out their Primer line, it states “Hand made by Mike Truelove in British Columbia, Canada”."
Made in Canada,11/10/2021,2021,https://madeinca.ca/blog,DM,Bee Purified,,,http://www.beepurified.ca,,,,,,"Candles, food wraps, soaps, perfumes,",,,"Bee Purified is a company that hand makes natural home, bath, and beauty products. Their candles use 100% Canadian beeswax collected from around Ontario, and their soaps are infused with Canadian honey and local herbs. They are eco-friendly products and are made in small batches to preserve freshness."
Made in Canada,11/10/2021,2021,https://madeinca.ca/blog,DM,Mitchell’s Soup Co.,,,https://www.mitchellssoupco.com/,,,,,,Easy to prepare dried goods and meals,,,"Mitchell’s Soup Co specializes in making delicious soup mixes in a bag. Submissions suggest that their mixes are amazing. Shipping is free on orders over $40. Along with soup, they also have a couple rice dishes and a quinoa salad."
Made in Canada,11/10/2021,2021,https://madeinca.ca/blog,DM,Lassonde Industries,,,http://www.lassonde.com,,,,,,"Juices under a variety of brands, wine, cider, specialty food products",,,"Lassonde Industries was founded in 1918, and has since grown into an employer of 1,500 people at their Canadian production facilities, and a buyer of 40,000 – 50,000 tonnes of apples each year from growers in Ontario, Quebec and the Maritimes. You have surely heard of their juice brands:"
Made in Canada,11/10/2021,2021,https://madeinca.ca/blog,DM,Parkland Fuels,,,https://www.parkland.ca,,,,,,Gasoline,,,"Parkland is the largest independently owned fuel retailer in Canada. You won’t see their name on any gas stations, but you will recognize their brands. They purchase their gasoline from a variety of different refiners, but also own the refinery in Burnaby, BC."
Made in Canada,11/10/2021,2021,https://madeinca.ca/blog,DM,Pinty’s,,,http://www.pintys.com,,,,,,"Frozen chicken products, frozen burgers, sauces",,,"Pinty’s makes a wide variety of frozen poultry products and recently introduced frozen burgers to their product range. They have been acquired by Olymel L.P. of Quebec, which itself is owned by La Coop fédérée."
Made in Canada,11/10/2021,2021,https://madeinca.ca/blog,DM,Pet Products: Global Pet Foods 🍁,,,http://globalpetfoods.ca/,,,,,, | Foods,,,"Global Pet Foods is the largest Canadian-owned pet specialty retailer. They sell a variety of products made in Canada, listed below. It’s not clear if the provinces listed with the products are where they are made or only where they are sold – but you can be comfortable that these are Canadian-made brands:"
Made in Canada,11/10/2021,2021,https://madeinca.ca/blog,DM,Toy Maker of,,,https://toymakeroflunenburg.ca/,,,,,,"Hand made wooden children’s toys, adult brain teasers and outdoor play equipment",,,"Since 1979, The Toy Maker of Lunenburg has designed and manufactured safe, durable, eco-friendly, Canadian made toys, games and brain teasers that inspire imaginations and creativity. Their toys are not only brilliant but timeless and built to last – you’ll want to pass them down through generations."
Made in Canada,11/10/2021,2021,https://madeinca.ca/blog,DM,Purex,,,http://purex.ca/,,,,,,Toliet Paper,,,"Purex is a brand of Quebec-based Kruger Inc., and is mainly available in Western Canada. Thumbs up to 3-ply!"
Made in Canada,11/10/2021,2021,https://madeinca.ca/blog,DM,Federated Co-operatives Limited (FCL),,,,,,,,,,,,"FCL is owned by about 190 smaller member co-operatives across Western Canada (which are themselves owned by more than 1.8 million people). They employ around 23,000 people and are hugely popular, based on the number of submissions we received to this site."
Made in Canada,11/10/2021,2021,https://madeinca.ca/blog,DM,North Bound Expeditions,,,http://www.nbexpeditions.com,,,,,,"Fabric products for off-road vehicles: spare tire trash bags, chainsaw bags, cargo nets, fire extinguisher mounts, seat covers, apparel, visor panel organizers",,,"North Bound Expeditions is a veteran owned and operated company that makes hand made fabric items for offroad vehicles, in New Brunswick. They purchase their raw materials from an Ontario textile company."
Made in Canada,11/10/2021,2021,https://madeinca.ca/blog,DM,Coffee: Kicking Horse Coffee,,,https://www.kickinghorsecoffee.com,,,,,,,,,Name: Kicking Horse Coffee
Made in Canada,11/10/2021,2021,https://madeinca.ca/blog,DM,String Theory,,,http://www.stringtheoryscarves.com,,,,,,"Scarves, shawls, toques, headwear",,,"String Theory is a Montreal based producer of woolen accessories. Their fabrics are sourced from mills in Quebec and North Carolina, their yarns are Peruvian baby alpaca, Italian merino, and cashmere, and their products are then hand finished in Montreal and Toronto."
Made in Canada,11/10/2021,2021,https://madeinca.ca/blog,DM,Mrs. Whyte’s Pickles,,,http://whytes.ca/mrs-whytes/,,,,,,Dill pickles,,,"Another brand of Whyte Foods, the Quebec food company that also owns the Strub’s pickle brand. Historically these pickles have primarily been available in Ontario and Quebec, so you might not be able to get them elsewhere. These pickles are kosher certified."
Made in Canada,11/10/2021,2021,https://madeinca.ca/blog,DM,Shaw’s Ice Cream,,,http://www.shawsicecream.com,,,,,,Ice cream,,,Shaw’s Ice Cream is an ice cream company working out of St. Thomas. They use 100% Canadian Dairy in their ice cream. They can be found at various ice cream shops and their own “dairy bar” in St. Thomas.
Made in Canada,11/10/2021,2021,https://madeinca.ca/blog,DM,Dayton Boots,,,http://daytonboots.com/,,,,,,"Leather Boots, Biker Boots, Forestry Boots, Work Boots, Dress Shoes",,,"Dayton Boots have been a mainstay in Vancouver since 1946. Allegedly bars used to have signs stating “no guns, no knives, no Daytons” as the boots were associated with bikers and other toughs who would baptize their boots by stomping on various unfortunate souls. In any case, the brand today is associated with high quality footwear hand-made in their original factory in Vancouver."
Made in Canada,11/10/2021,2021,https://madeinca.ca/blog,DM,Jamieson Vitamins,,,,,,,,,"Vitamins, supplements",,,"Jamieson Vitamins is a popular producer of vitamins and supplements. I’ve used their Vitamin C and D supplements myself. They make the majority of their products in Windsor, though some of their products are made by other companies."
