ShowName,ShowDate,ShowYear,ShowWebsite,SubmittedBy,ExhibitorName,BoothNumber,HallLocation,Website,Email,Phone,Fax,Address,Country,Categories,Manufacturers,Brands,Description
Made in Canada,11/10/2021,2021,https://madeinca.ca/blog,DM,Jardinique,,,http://www.jardinique.com/,,,,,,Outdoor chairs,,,"Ian and Sandy Mackie produce a variety of classic outdoor chairs, such as The Classic Westport Chair, Mid-century Modern Adirondack Chair, Beautiful Breadloaf Chair, Roundback Lodge Chair, and Rietveld-inspired Garden Chair."
Made in Canada,11/10/2021,2021,https://madeinca.ca/blog,DM,N&N Trailers,,,https://nnremorques.ca,,,,,,Trailers for various purposes,,,"Since 1996, N&amp;N has been making high quality trailers out of hot dipped galvanized steel. They have a trailer for almost any need."
Made in Canada,11/10/2021,2021,https://madeinca.ca/blog,DM,Beattie’s Distillers,,,http://www.beattiesdistillers.com/,,,,,,"Vodka, gin",,,"When you’ve been growing potatoes since 1876, a change of pace might seem like a good idea. Such as opening a distillery to make vodka and gin from those potatoes! Beattie’s now has the 5th generation working on the farm with a successful side business at the distillery."
Made in Canada,11/10/2021,2021,https://madeinca.ca/blog,DM,Chocolate Signatures,,,http://www.chocolatesignaturesinc.com/,,,,,,Dufflet Small Indulgences and C.H. Ocolate brands,,,"Chocolate Signatures has been making chocolate confections since 1991. Everything is produced in-house at their facility in Toronto. They are a part of Dufflet Pastries, a Canadian owned and operated business."
Made in Canada,11/10/2021,2021,https://madeinca.ca/blog,DM,The Great Canadian Soap Co.,,,https://www.greatcanadiansoap.com/,,,,,,Hand crafted goat milk soap and body care products,,,"Made from the milk of their own herd of goats, the Great Canadian Soap Co grew from a shed in 2003 to a retail location on Brackley Beach and shipping their soaps across the country. A great PEI success story!"
Made in Canada,11/10/2021,2021,https://madeinca.ca/blog,DM,Denjay,,,http://www.denjay.ca/,,,,,,Clothing,,,"Denjay was started by an 18 year old entrepreneur in Williams Lake. All of the ordering, printing, tag application, marketing, managing, and designing is done by that young gentleman."
Made in Canada,11/10/2021,2021,https://madeinca.ca/blog,DM,Wild Prairie Soap Company,,,http://www.wildprairiesoap.ca/,,,,,,"Hand and body soap, lip balms lotions, body scrubs",,,"Wild Prairie makes all-natural soaps made of 50% olive oil, in small batches. They claim that many eczema or dermatitis suffers have reversed or resolved their skin conditions by using Wild Prairie soap."
Made in Canada,11/10/2021,2021,https://madeinca.ca/blog,DM,Bakery,,,http://www.dimpflmeierbakery.com/,,,,,,Various breads,,,"For nearly 60 years, Dimpflmeier has made bread using German techniques in Canada. They make bread in wooden baskets rather than loaves or pans, and use natural spring water for superior taste. They are still a family-owned, Canadian business!"
Made in Canada,11/10/2021,2021,https://madeinca.ca/blog,DM,Fiasco Gelato,,,http://www.fiascogelato.ca/work,,,,,,"Gelato, sorbetto",,,"Here at MiC HQ we can attest to the quality of Fiasco Gelato products, having found them at our local Zehrs. They are a certified B Corporation, a certified Great Place to Work, use Bullfrog power, pay living wages and much more."
Made in Canada,11/10/2021,2021,https://madeinca.ca/blog,DM,Reno/Builders: BOND 🍁,,,https://www.bondbuild.ca,,,,,,"Facades and feature walls | BOND designs and manufactures unique architectural products for interior and exterior finishes.  Products include a simulation of an existing product built to suit, new fabrication, new prototype of a concept, and new creations.",,,"BOND designs and manufactures unique architectural products for interior and exterior finishes.  Products include a simulation of an existing product built to suit, new fabrication, new prototype of a concept, and new creations."
Made in Canada,11/10/2021,2021,https://madeinca.ca/blog,DM,Inscape,,,https://myinscape.com/,,,,,,Commercial Office Furniture,,,"Founded in 1888, and moved to Canada from the USA in 1905. Now based in Holland Landing, Ontario, but they also have manufacturing facilities in New York. It’s not clear what products are built where – check with your dealer to ensure you’re getting Canadian made!"
Made in Canada,11/10/2021,2021,https://madeinca.ca/blog,DM,BMKC Canada (Big Mama’s Kitchen Creations),,,http://www.bmkccanada.wix.com/bmkc,,,,,,"Artisan Gourmet BBQ sauces, dry rubs, West Indian style hot sauces, Indian curry pastes",,,"Big Mama is a seasoned chef with over 24 years of experience. A Toronto native, she moved to Grey County in December of 2014 where her idea of a company took shape and flight. Using mostly locally sourced ingredients, her line includes vegan and gluten free options and are now available in approx. 40 stores including Foodland and Sobey’s."
Made in Canada,11/10/2021,2021,https://madeinca.ca/blog,DM,Nettle’s Tale,,,https://nettlestale.com,,,,,,Women’s bathing suits,,,Nettle’s Tale makes honest swimwear for the everyday woman. They began with a crowdfunding campaign that reached 7x their target.
Made in Canada,11/10/2021,2021,https://madeinca.ca/blog,DM,Smart Office Solutions,,,http://www.smartofficefurniture.ca/,,,,,,Refurbished office furniture/stations,,,"Smart Office Solutions is the innovator in the industry of recycled and refurbished office furniture. They have been solving problems and reducing waste for more than 20 years, proudly refurbishing over 30,000 workstations and keeping 9,000,000 lbs of waste out of our landfills. They will ship and install across Canada."
Made in Canada,11/10/2021,2021,https://madeinca.ca/blog,DM,The Escape Movement,,,https://theescapemovement.com/,,,,,,Clothing,,,"There’s not a lot of specific information about this company, but the submission we received says they make their clothing in northern Ontario. They clearly mark on their website the made in Canada items – most seem to be Canadian-made (though the baseball caps don’t seem to be – why does nobody make baseball caps in Canada?)"
Made in Canada,11/10/2021,2021,https://madeinca.ca/blog,DM,Daniel Christian Tang,,,https://www.danielchristiantang.com/,,,,,,Jewellery,,,"Innovative, award-winning jewellery made using 3D printing techniques."
Made in Canada,11/10/2021,2021,https://madeinca.ca/blog,DM,Springwall Sleep Products,,,http://www.springwall.com/,,,,,,Mattresses | Springwall Sleep Products is the largest 100% owned and operated Canadian mattress manufacturer in the country. The same Canadian family has proudly been running the operation since 1949. They specialize in great quality mattresses for an affordable price point.,,,Springwall Sleep Products is the largest 100% owned and operated Canadian mattress manufacturer in the country. The same Canadian family has proudly been running the operation since 1949. They specialize in great quality mattresses for an affordable price point.
Made in Canada,11/10/2021,2021,https://madeinca.ca/blog,DM,Sonora Foods,,,https://www.sonorafoods.com/,,,,,,"Tortilla shells and chips, spices, seasonings",,,"Sonora Foods started in 1993 and the goal was simple: offer Canadian Restaurants a true taste of Southwest cuisine. From tortillas to spices and seasonings, it meant bringing together the finest ingredients that deliver an authentic dining experience in every bite."
Made in Canada,11/10/2021,2021,https://madeinca.ca/blog,DM,SavvyArt Market,,,http://www.savvyartmarket.com/,,,,,,"Original Art, Photography and Art Prints",,,"Canadian owned and operated art gallery and art agent, featuring made in Canada original art, photography and art prints. The original art is created and produced by Canadian artists."
Made in Canada,11/10/2021,2021,https://madeinca.ca/blog,DM,ArtFoamies,,,http://www.artfoamies.com/,,,,,,Foam stamps,,,"ArtFoamies manufactures, packages and distributes foam stamps world-wide."
Made in Canada,11/10/2021,2021,https://madeinca.ca/blog,DM,IDEAL Industries,,,http://www.idealindustries.ca/,,,,,,"Can-Twist Wire Connectors, Canadian WireTwist Wire Connectors, Yellow 77 Wire & Cable Lubricant, Leather Tool Bags & Pouches",,,"IDEAL was founded in the US in 1916, and is now an international concern, supplying  a huge variety of electrical wiring products and supplies."
Made in Canada,11/10/2021,2021,https://madeinca.ca/blog,DM,Coco & Tini,,,http://cocoandtini.com/,,,,,,Baby Skin Care,,,"Certified natural baby products – shampoo, body wash, detangler, bubble bath."
Made in Canada,11/10/2021,2021,https://madeinca.ca/blog,DM,Food: Cheemo Perogies 🍁,,,https://www.cheemo.com/,,,,,,Perogies,,,"All varieties of perogies, manufactured in Edmonton, Alberta and sold across the prairies. Family owned company that uses products from local farmers."
Made in Canada,11/10/2021,2021,https://madeinca.ca/blog,DM,LIGHTVU,,,http://www.lightvu.com/,,,,,,LED displays,,,"LIGHTVU is a Canadian-based manufacturer of custom LED solutions. They work with medium to large-sized companies to bring their visions to life through creative, one-of-a-kind LED displays. Working within both new and old spaces, they help brands create memorable experiences for their employees, customers, partners, and stakeholders."
Made in Canada,11/10/2021,2021,https://madeinca.ca/blog,DM,Que Pasa Foods,,,https://www.quepasafoods.com,,,,,,"Tortilla shells and chips, salsas",,,"Que Pasa started out as a street-front deli in Vancouver in 1983. In 2012, Que Pasa joined the Nature’s Path Foods family. Both were independent and family-owned companies with a deep social and environmental commitment to organics and sustainability. You might say Que Pasa and Nature’s Path went together like chips and salsa."
Made in Canada,11/10/2021,2021,https://madeinca.ca/blog,DM,Prairie West Ice Cream,,,http://www.prairiewesticecream.ca/,,,,,,Ice cream,,,"Prairie West Ice Cream is a family owned and operated company that was started in Winnipeg, in 2005. They continue to grow in the market place with co-packing initiatives, and the launch of their own private brand of Prairie West Ice Cream available in 4 litre pails, and their CanAsian series of flavours available in 1 litre tubs."
Made in Canada,11/10/2021,2021,https://madeinca.ca/blog,DM,Atlantic Windows,,,http://www.atlanticwindows.com/,,,,,,Windows and doors,,,"Though they acknowledge they don’t compete on price with imports, Atlantic Windows touts German design and Canadian engineering that create lasting quality. They source their materials locally and offer lifetime warranties."
Made in Canada,11/10/2021,2021,https://madeinca.ca/blog,DM,FoodiePages,,,https://www.foodiepages.ca/,,,,,,Craft food & drink,,,"FoodiePages curates craft food &amp; drink made in Canada, helping you discover and support the country’s most exciting independent makers."
Made in Canada,11/10/2021,2021,https://madeinca.ca/blog,DM,F1 Tech Inc,,,http://f1tech.ca/,,,,,,"Business computers, laptops, servers and firewalls",,,"F1 Tech is an I.T. sales and service company based in Oshawa, Ontario. Their F1 business computers, laptops, servers and firewalls are all designed, assembled and supported proudly by their in-house technical team in Oshawa. The components of the products they assemble are not made in Canada, but there aren’t any companies manufacturing computers in Canada, so you take what you can get!"
Made in Canada,11/10/2021,2021,https://madeinca.ca/blog,DM,Interna Furniture Design,,,http://www.interna.ca/,,,,,,"Chairs, Armchairs, Couches, Sofas, Sleepers, Recliners, Ottomans, Tables, Pillows, Collaborative Seating",,,"Interna Furniture Design Ltd. has remained a family-owned business since its beginning in 1963.  When founder Joe Kubecka first started out, his passion for quality manufacturing and furniture design gave him the inspiration to start his own contemporary furniture manufacturing enterprise."
Made in Canada,11/10/2021,2021,https://madeinca.ca/blog,DM,Name: Three H,,,http://www.three-h.com/,,,,,,Products: Office and Home desks,,,Name: Three H
Made in Canada,11/10/2021,2021,https://madeinca.ca/blog,DM,Retailers: Roots,,,https://www.roots.com/,,,,,,"Clothing, leather goods, accessories",,,"Roots is seen as a quintessentially Canadian chain, and employs somewhere around 2,000 people across Canada, including at their factory in Toronto where they manufacture leather goods. They are not Canadian-owned, however,  much to our surprise here at MiC."
Made in Canada,11/10/2021,2021,https://madeinca.ca/blog,DM,TiliaLime,,,https://www.tilialime.com/,,,,,,"Lip balm, lip scrub, body care, cosmetics",,,"TiliaLime’s products are 100% natural with many fruit and botanical ingredients, perfect for pampering yourself in the healthiest way. Most of their products are for the lips, but they offer massage and lotion bars as well."
Made in Canada,11/10/2021,2021,https://madeinca.ca/blog,DM,Vergers Paul Jodoin,,,http://www.vpj.ca/,,,,,,Tradition brand fruit juices,,,"Family owned since 1901, Vergers Paul Jodoin is now owned by 3 brothers who own 7 apple orchards covering 600 acres, as well as pressing and bottling facilities. They also make cranberry juice!"
Made in Canada,11/10/2021,2021,https://madeinca.ca/blog,DM,Saltwreck,,,http://saltwreck.com/,,,,,,Map Art Prints,,,"Saltwreck is a company founded in Yarmouth, Nova Scotia. Their modern map art prints combine iconic symbols, places and shapes that embody the spirit and rich heritage of Canada."
Made in Canada,11/10/2021,2021,https://madeinca.ca/blog,DM,Made in Canada Gifts,,,https://www.madeincanadagifts.ca/,,,,,,Gifts,,,"Made in Canada Gifts is an Ottawa based boutique located in The Rideau Centre in downtown Ottawa. For the last 8 years they have been exclusively dedicated to gifts and products that are made in Canada. They feature unique Canadian home accent decor, fashion accessories, contemporary jewellery, and decorative art as well as tasty artisan foods and personal care products such as soaps and body lotions."
Made in Canada,11/10/2021,2021,https://madeinca.ca/blog,DM,Noctex,,,https://www.shopnoctex.com/,,,,,,Women’s and unisex clothing,,,"All apparel is made in Vancouver, BC, with a mix of handmade by the designer and small production run pieces. The majority of the fabrics used are deadstock fabrics, each hand picked as extra bolts, instead of being ordered new from mills."
Made in Canada,11/10/2021,2021,https://madeinca.ca/blog,DM,Barbel Smith Gallery,,,http://www.barbelsmith.com/,,,,,,Original stylized Canadian landscapes,,,"All of Barbel Smith’s landscapes are Canadian scenes using only the finest pigments, frames, canvas, and archival finishes which are all 100% Canadian sourced."
Made in Canada,11/10/2021,2021,https://madeinca.ca/blog,DM,Nimbus Publishing,,,https://www.nimbus.ca/,,,,,,Books,,,Nimbus Publishing is the largest English-language publisher east of Toronto.
Made in Canada,11/10/2021,2021,https://madeinca.ca/blog,DM,Name: Mark It Proud,,,https://www.markitproud.com/,,,,,,Products: LGBTQ inclusive cards and gifts,,,Name: Mark It Proud
Made in Canada,11/10/2021,2021,https://madeinca.ca/blog,DM,Booster Juice,,,https://boosterjuice.com/,,,,,,"Fresh juice, smoothies, and lunch items",,,"Founded in 1999 in Sherwood Park, Alberta, Booster Juice set a Canadian record by opening 50 stores in its first two years; the restaurant is Canada’s largest chain of juice and smoothie bars and has recently expanded into India, the US, and Dubai."
Made in Canada,11/10/2021,2021,https://madeinca.ca/blog,DM,Canadian Naturals,,,http://canadiannaturals.com,,,,,,Dog and cat foods,,,"Canadian Naturals is a brand of Canadian Supreme Pet Foods. It appears that it might be manufactured by OmniPet, a contract manufacturing company."
Made in Canada,11/10/2021,2021,https://madeinca.ca/blog,DM,MacEwen Fuels,,,https://macewen.ca,,,,,,Gas stations and County Line convenience stores,,,"MacEwen is a family-owned business that started in 1976. They do not own their own gasoline refinery, but seem to purchase their gas from Canadian refineries."
Made in Canada,11/10/2021,2021,https://madeinca.ca/blog,DM,Botanus,,,http://www.botanus.com/,,,,,,Canada’s top catalogue & online supplier of high quality horticultural products,,,"Starting out 18 years ago as a mail-order business, Botanus is now your Canadian online source for horticultural products."
Made in Canada,11/10/2021,2021,https://madeinca.ca/blog,DM,Ashanti Coffee,,,https://www.ashanticoffee.com/,,,,,,Coffee,,,"Ashanti sources their coffee beans from Zimbabwe, and appear to have exclusivity in Canada for Zimbabwe beans. Founded by a former member of the Canadian Olympic equestrian team."
Made in Canada,11/10/2021,2021,https://madeinca.ca/blog,DM,Accessories: inkbox Tattoos 🍁,,,https://click.linksynergy.com/fs-bin/click?id=*NawnzHXNc8&offerid=610844.10&type=3&subid=0,,,,,,Semi-permanent tattoos,,,"inkbox has grown explosively since being launched by two Toronto-based brothers. The tattoos last 8-18 days, have a variety of cool designs and won’t damage your skin. Note, it looks like pricing is in USD."
Made in Canada,11/10/2021,2021,https://madeinca.ca/blog,DM,’s Coffee Roasters,,,http://www.balzacs.com/,,,,,,Coffee,,,The first Balzac’s cafe opened in Stratford in 1996. You may remember the chain from their successful appearance on the 6th season of Dragon’s Den.
Made in Canada,11/10/2021,2021,https://madeinca.ca/blog,DM,Eagle Print Letterpress,,,http://eagleprint.ca/,,,,,,Letterpress Invitations,,,Canadian Owned: Yes
Made in Canada,11/10/2021,2021,https://madeinca.ca/blog,DM,Kiwi Kayaks,,,http://www.kiwikayak.com/,,,,,,Kayaks,,,The company makes six types of polyethylene kayaks.
Made in Canada,11/10/2021,2021,https://madeinca.ca/blog,DM,Granville Island Brewing,,,http://www.gib.ca/,,,,,,Beers,,,"Granville billed itself as Canada’s first microbrewery, opening in 1984. Currently, they are owned by international giant Molson Coors and most of their beer is brewed in Molson’s Vancouver plant."
Made in Canada,11/10/2021,2021,https://madeinca.ca/blog,DM,Projected Lighting Designs Inc.,,,http://www.projectedlighting.com/,,,,,,"Garden Lighting, Landscape Lights",,,"Projected Lighting Designs manufactures a unique collection of durable landscape lights that are great for accenting gardens, pathways, and patios. Their products are made with Canadian aluminum and use low-energy LED bulbs."
Made in Canada,11/10/2021,2021,https://madeinca.ca/blog,DM,Bicycles: Mariposa 🍁,,,https://mariposabicycles.ca/,,,,,,Custom-built bikes,,,"Mariposa Bicycles traces their heritage back to 1969, though the more modern incarnation dates to 2014, when Michael Barry Jr., former pro rider, Olympian and Tour de France cyclist, teamed with his wife Dede and original Mariposa founder Michael Barry Sr. to relaunch the brand."
Made in Canada,11/10/2021,2021,https://madeinca.ca/blog,DM,Seed to Sausage,,,https://www.seedtosausage.ca/,,,,,,"Cured meat, sausages, hot dogs",,,"Meat. Delicious meat. Seed to Sausage takes great pride in locally sourcing their materials and hand-crafting every cut. They’ve recently opened a retail outlet in Newmarket, Ontario in Market &amp; Co at the Upper Canada Mall. (Newsflash: Market &amp; Co is awesome. Go check it out.)"
Made in Canada,11/10/2021,2021,https://madeinca.ca/blog,DM,Instruments: Backun Musical Services 🍁,,,https://backunmusical.com/,,,,,,Clarinets and clarinet parts,,,"Founded in 2000, Backun Musical is dedicated to advancing the art of woodwinds. Known worldwide as one of the top woodwind manufacturers, they boast a roster of Backun Artists who proudly use their clarinets."
Made in Canada,11/10/2021,2021,https://madeinca.ca/blog,DM,JoJo Cajons Drums and Percussion,,,http://www.jojocajons.com/,,,,,,Cajons and Percussion Instruments,,,"JoJo Cajons has been very active in bringing quality instruments to the percussion community, whether you are a beginner or a professional… They have a Cajon for you.  They are involved in every aspect of the Cajon business including: design, manufacturing, distribution and retail of Cajon products."
Made in Canada,11/10/2021,2021,https://madeinca.ca/blog,DM,Kirkland Signature Bath Tissue,,,https://www.costco.ca/,,,,,,Toilet Paper,,,Costco’s Kirkland toilet paper is made in Canada (we’re not sure by who). Their paper towels are made in the USA.
Made in Canada,11/10/2021,2021,https://madeinca.ca/blog,DM,Name: PolarPiece,,,http://www.polarpiece.com/,,,,,,Products: Unisex clothing,,,Name: PolarPiece
Made in Canada,11/10/2021,2021,https://madeinca.ca/blog,DM,Barrymore Furniture,,,https://barrymorefurniture.com,,,,,,High-end home furniture,,,Barrymore traces its heritage back nearly 100 years to 1919. They continue to make ultra-luxury furniture mostly by hand in Toronto. You can find their products at their boutique in North York (along with some other brands) and at select dealers across the country.
Made in Canada,11/10/2021,2021,https://madeinca.ca/blog,DM,Royal Canadian Stone,,,http://www.royalcanadianstone.ca/,,,,,,Manufactured veneer stone,,,"Proudly made in Canada at a better price than stones imported from the US. Very nice selection, and locally-sourced materials."
Made in Canada,11/10/2021,2021,https://madeinca.ca/blog,DM,New World Technologies,,,http://www.radtorque.com/,,,,,,RAD Torque Systems tools,,,"New World Technologies is a leading Canadian manufacturer of pneumatic, battery powered, and electronic pistol grip torque wrenches which are marketed under the RAD trademark. RAD products have proven to be successful all over the world in such industries as oil &amp; gas, petrochemical, mining, aerospace, power generation and manufacturing."
Made in Canada,11/10/2021,2021,https://madeinca.ca/blog,DM,Patriarch Supply,,,https://patriarchsupply.com/,,,,,,"Shirts, sweaters and tank tops",,,"If you’re not from Toronto, maybe stop reading now. Patriarch Supply is urban apparel created from a shared feeling of love for the city."
Made in Canada,11/10/2021,2021,https://madeinca.ca/blog,DM,Adrem Brands,,,https://www.lissahealth.com/,,,,,,"Lissa Gelatine, Wake-Ups Caffeine Tablets",,,"Trusted since 1967, Lissa gelatine helps strengthen nails. Their
capsules are made with just two ingredients: Canadian-sourced gelatine powder and vegetable-grade magnesium stearate.  That’s it."
Made in Canada,11/10/2021,2021,https://madeinca.ca/blog,DM,Sparkle Tattoo,,,https://www.sparkletattoo.ca,,,,,,Temporary glitter tattoos and supplies,,,Glitter tattoo product was once only supplied by overseas manufacturers. Some product was not safe and others were low quality due to lack of regulation on the import of this item. Sparkle Tattoo wanted to offer the highest quality and safest product that their customers could trust. They have have been in business for 7 years.
Made in Canada,11/10/2021,2021,https://madeinca.ca/blog,DM,Cutler Kitchen and Bath,,,https://www.cutlerkitchenandbath.com/,,,,,,Kitchen and bath cabinetry,,,"Cutler manufactures kitchen and bath cabinets with a focus on design and quality. If you are looking for modern, stylish cabinets, check them out."
Made in Canada,11/10/2021,2021,https://madeinca.ca/blog,DM,Pause&Sleep,,,https://www.pauseandsleep.ca/,,,,,,Memory foam mattress,,,"Here at MiC, we seem to have made it our mission to document every Canadian mattress manufacturer. Pause&amp;Sleep is a relatively new entrant (as far as we can tell) into the market. They offer a 100 night sleep trial, free shipping and a unique design to their foam layers. Check them out!"
Made in Canada,11/10/2021,2021,https://madeinca.ca/blog,DM,Women’s Clothing: Comrags 🍁,,,http://www.comrags.com/,,,,,,Women’s clothing,,,"Since 1983, the team of Joyce Gunhouse and Judy Cornish have built Comrags into one of Canada’s best known independent clothing brands. They make their their clothing above their boutique in Toronto."
Made in Canada,11/10/2021,2021,https://madeinca.ca/blog,DM,monte & coe,,,http://www.monteandcoe.com/,,,,,,Luggage and Accessories,,,"monte &amp; coe’s mission is to elevate traditional products with a fashion-forward perspective while being as eco-conscious and socially responsible as possible. All of their products are handmade in Canada by expert craftsmen who work in fair-wage, labor-friendly environments."
Made in Canada,11/10/2021,2021,https://madeinca.ca/blog,DM,Name: Mark’s,,,http://www.anrdoezrs.net/click-8880957-12639407,,,,,,Products: Clothing,,,Name: Mark’s
Made in Canada,11/10/2021,2021,https://madeinca.ca/blog,DM,Northern Biscuit Bakery,,,https://www.northernbiscuit.ca,,,,,,Limited ingredient dog treats,,,"Founded in 1992, Northern Biscuit Bakery has been baking premium, natural dog treats using local, fresh Canadian ingredients, and eco-friendly packaging."
Made in Canada,11/10/2021,2021,https://madeinca.ca/blog,DM,Men’s Clothing: Jack Victor 🍁,,,http://www.jackvictor.com/,,,,,,Menswear,,,"Now a third-generation family-owned business, Jack Victor makes high-end men’s clothing in Montreal. Don’t expect cheap, but expect quality."
Made in Canada,11/10/2021,2021,https://madeinca.ca/blog,DM,Personal Care: Druide,,,https://druidebio.com/,,,,,,"Toothpaste, shampoo, conditioner, deodorant, face cream, lip balm",,,"Druide manufactures a wide variety of personal care products, many of which meet the coveted EcoCert standard. They might be owned by Derme &amp; Co, but that company doesn’t list Druide as one of their brands – but they share an address. So, they definitely make their products in Canada, just not 100% sure on ownership."
Made in Canada,11/10/2021,2021,https://madeinca.ca/blog,DM,Rayerraver,,,http://rayerraver.etsy.com/,,,,,,Women’s clothing,,,Unique and rare rave and festival outfits (also Halloween outfits). Made by a stay at home mom in BC.
